,Restaurant Name,Overall Rating,Total Reviews,Specialty,Region,Price Range,Author,Comment,Rating,Date
0,Asteria,4.5,120,Griechisch / ,Prenzlauer Berg,2,Solaris C.,"Asteria ist sicherlich das beste Griechische Restaurant in Berlin. Nach der Renovierung hat der Ort Stil und viel groesser ist. Das Essen ist hervorragend  - wie immer. Die ueberbackene Gerichte in Metaxasauce (Haenchenbrust, Gyros usw) sind ein ""Must"". Die Bedienung ist normalerweise kommunikativ, humorvoll und schnell. Die ganze Atmosphaere ist lebhaft und authentisch: Griechische Musik, Ouzo, ... und viele Kunden. Die Gerichte sind ziemlich gross! (fast zu viel fuer eine Person am Abend..).",5,24.5.2017
1,Asteria,4.5,120,Griechisch / ,Prenzlauer Berg,2,Steffen R.,"Wir sind wegen den guten Bewertungen an dem ersten Tag von unserem Wochenendtrip nach Berlin hierher gekommen und waren absolut begeistert von dem sehr aufmerksamen und gastfreundlichen Service! Was soll ich sagen... dieses Restaurant ist einfach unglaublich gut, sodass wir heute eine Stunde vor der Abreise wieder hier sitzen und uns auf das sehr leckere und qualitative Essen freuen, während der zuvorkommende Service uns mit ausreichend Ouzo (hier sehr großzügig aufs Haus) versorgt. Ich habe noch kein Restaurant erlebt, welches mit der Qualität von diesem Service mithalten kann! Ich empfehle jedem dieses Restaurant zu besuchen, auch wenn es etwas teurer als andere Griechen ist, denn die Qualität und der Service rechtfertigen diesen auf jeden Fall.",5,3.2.2020
2,Asteria,4.5,120,Griechisch / ,Prenzlauer Berg,2,Sascha G.,"Grundsätzlich ist das Asteria ein typisches griechisches Restaurant. Die Karte bietet keine Überraschungen: Gyros, Souflaki, panierter Schafskäse etc. in vernünftiger Qualität zu relativ normalen Preisen.Es gibt hier jedoch ein paar Dinge, die den Laden doch ein wenig besonders machen:Die Einrichtung ist zum Beispiel ziemlich einladend. Hier und da gibt es den üblichen Griechenlandkitsch, aber die hohen Decken und die angenehmen Farben und Materialien schaffen eine tolle Atmosphäre.Doch das wirklich bemerkenswerteste ist ein Kellner, der nur eine einzige Aufgabe hat: er streunt dauerhaft mit einer vollen Flasche Ouzo in der Hand durch das Restaurant und füllt einfach jedem Gast ungefragt die Schnapsgläser auf Kosten des Hauses wieder auf.Ich bin froh, dass ich den Abend überlebt habe. Denn ich und meine Freunde lassen eigentlich nie volle Schnapsgläser länger vor uns stehen.Wenn ich am nächsten Tag nicht früh aufstehen muss und ich Appetit auf solide griechische Küche habe, gehe ich sicher immer wieder hier her.",4,19.1.2017
3,Asteria,4.5,120,Griechisch / ,Prenzlauer Berg,2,Jens K.,"Großartiger Grieche!Es war schon recht voll und es war mir etwas unangenehm, ich brauchte nur einen Platz für mich. ""Selbstverständlich, kein Problem, kommen Sie bitte mit.""Ich saß noch nicht ganz, da bekam ich auch schon den ersten Ouzo. Dieser Vorgang wiederholte sich von nun an, wenn mein Glas leer war. Am Nebentisch habe ich mitbekommen, dass man das Auffüllen mit vielem Bitten abwehren konnte.Bestellt habe ich Souvlaki. Das leckerste Souvlaki, so bildete ich mir zumindest immer ein, habe ich einmal auf Kreta bekommen. Na gut, Kreta ist jetzt halt auf Platz 2 gerutscht.Sehr tolle Location, ganz unglaublich freundliches Personal und sehr leckeres Essen und vielleicht ist Berlin jetzt eben doch eine ""Reise wert"".Meine Rechnung bekam ich übrigens mit einem Espresso.Vielen Dank!",5,19.2.2015
4,Asteria,4.5,120,Griechisch / ,Prenzlauer Berg,2,Nicole H.,"Waren heute das erste man im ASTERIA und waren begeistert. Extrem aufmerksame Mitarbeiter, schnelle und freundliche Bedienung, große- aber vor allem auch leckere Portionen! Dazu Ouzo im Überfluss! Nach dem Essen noch einen kleinen Obstteller auf Haus, danach noch griechischer Joghurt mit Früchten -- auch aufs Haus und wäre das nicht genug gab es zum bezahlen noch für jeden einen Espresso und einen schnaps dazu. Fazit: papp satt und gut angetrunken haben wir das ASTERIA verlasen - wir werden auf jeden Fall wieder kommen. Vielen Dank an das Team",5,7.1.2018
5,Asteria,4.5,120,Griechisch / ,Prenzlauer Berg,2,Andy L.,"Wahnsinnig tolles Restaurant. Große leckere Gerichte, toller Service und ausreichend gratis Ouzo ;-).Einfach nur zu empfehlen und immer einen Besuch wert.",5,16.1.2018
6,Asteria,4.5,120,Griechisch / ,Prenzlauer Berg,2,Tillmann S.,"Wer super lecker griechisch Essen will - hier muss man her.Freundliche Bedienung und ""geiles"" Essen - dazu lecker Ouzo, oder auch zwei oder drei ...",5,19.10.2014
7,Asteria,4.5,120,Griechisch / ,Prenzlauer Berg,2,Robert B.,"Ouzo flatrate für alle! ;)Gemessen am durchschnittlichen Alkoholverbrauch pro Person sind selbst die Speisen die nicht auf der Mittagskarte stehen ein echtes Schnäppchen. Mit Salat, Brot und allen Beilagen kommt man mit dem Asteria Teller absolut an die Grenze dessen, was man als trainierter, routinierter und kampferprobter Fleischfresser mit aller Macht in sich reinstopfen kann ;)Mein Favorit ist immer noch das Bifteki, dass mengenmäßig nah an den Asteria Teller ran kommt. Ein absolutes muss für jeden, der Freitag mittag nach einer geistig anstrengenden Woche die physische Herausforderung sucht. Hier ist es immer lecker, man wird herzlich mit Handschlag begrüßt und verabschiedet. Der Espresso danach geht auch aufs Haus. Ich freu mich auf die Neueröffnung!",5,5.2.2016
8,Asteria,4.5,120,Griechisch / ,Prenzlauer Berg,2,Matthias R.,"Ach menno, das war so vielversprechend. Das Restautant ist wirklich modern und angenehm eingerichtet. Das Personal sehr sehr aufmerksam, wenn auch ein wenig von der lauten, hektischen Sorte. Die Vorspeise (gebratene Auberginen) war wirklich OK und für 7€ üppig dimensioniert. Das Hauptgericht, eine gemischte Platte (17 €) mit Gyros, Souvlaki und Bifteki brachte dann allerdings den Dämpfer. Nahezu ""geschmacklos"" war es im wahrsten Sinne des Wortes. Der Salat: weitestgehend Eisbergsalat mit Fertigdressing, das Fleisch ohne Eigengeschmack und kaum gewürzt und der Reis erinnerte an eine Tube Tomatenmark. Das machte dann auch die unglaubliche Menge von ""5"" (wenn auch etwas gestreckten) Ouzo, die Obstschnitzel und der Joghurt sowie der kleine Espresso, allesamt ""auf's Haus"", nicht wett. Unterm Strich stimmte also das Preis-Leistungsverhältnis, aber nur durch die zahlreichen kostenlosen Zugaben, nicht durch Qualität und Geschmack der Speisen. Deshalb leider nur 3 Sterne. Ich würde beim nächsten Mal wohl eher ein anderes Lokal ausprobieren.",3,26.2.2018
9,Asteria,4.5,120,Griechisch / ,Prenzlauer Berg,2,Rich B.,"Meine Freundin und ich kamen gerade aus einem Griechenlandurlaub zurück, da eröffnete plötzlich das Asteria in der Schönhauser. Da lag es geradezu auf der Hand sich dieses Restaurant etwas näher anzusehen und gleich mal den Unterschied zwischen der originalen Küche in den Kykladen und dem, was hier als Griechisch verkauft wird, zu testen. Wir waren verblüfft, es war genauso lecker, die Portionen genauso groß und der Ouzo wurde auch ständig nachgefüllt. Es war, als hätten wir ein weiteres lokales Restaurant entdeckt, nur dass wir jetzt zurück in Berlin waren. Dieser Grieche zählt für mich zu den zwei besten Griechen außerhalb Griechenlands.",5,23.3.2017
10,Asteria,4.5,120,Griechisch / ,Prenzlauer Berg,2,Jörg S.,"Asteria ist ein griechisches Restaurant in der Schönhauser Allee 143 (direkt am U-Bahnhof ""Eberswalder Straße"").Da wir seit Kurzem in der Nähe vom Asteria wohnen und jedes mal wenn wir daran vorbei laufen es immer gut besucht ist, dachten wir uns, da müssen wir auch einmal hin.Begrüßt wurden wir standesgemäß mit einem Ouzo. Dieser wurde im Übrigen ständig nachgeschenkt, wenn man nichts sagte. Wir lehnten jedoch von vornherein ab.Die Kellner waren allesamt nett und nahmen rasch unsere Bestellung auf. Kurz nach den Getränken kamen die Vorspeisen. Ich hatte Knoblauchbrot.Zwischendrin kam dann der Beilagensalat und kurze Zeit später dann auch schon die Hauptspeise. In meinem Fall Mixteller (Souvlaki, Gyros mit Reis und Zaziki). Dieser war recht üppig, sodass ich einen großen Teil mit nach Hause genommen habe.Als Nachtisch wurde verschiedenes Obst gereicht und ein Espresso, da wir eben den Ouzo nicht trinken wollten.Alles in allem: Gerne bezahle ich einen höheren Preis und genieße solch einen Service!",4,18.6.2016
11,Asteria,4.5,120,Griechisch / ,Prenzlauer Berg,2,Sebastian T.,"Ein Grieche, ganz nach unserem Geschnmack und an diesem Abend, voller Unkenntnis der Gegend, über Yelp gefunden (klasse). Der Laden war brechend voll und es herrschte gute Stimmung. Nach einer kleinen Wartezeit von ca. 3 Minuten wurde tatsächlich ein Tisch für uns frei und das Ausziehen der Mäntel mit einem Ouzo belohnt.Das Essen von Gigantes über firschen Kalamari bis hin zum Stiffado war alles frsich und sehr lecker und wurde von flinken Kellnern überaus graziös durch die engen Reihen balanciert.Hier werden wir definitiv zu Wiederholungstätern.",4,26.12.2016
12,Asteria,4.5,120,Griechisch / ,Prenzlauer Berg,2,Jule J.,"Schon mehrere Jahre dran vorbeigelaufen und heute zum ersten Mal drin gewesen -es hat sich voll und ganz gelohnt. Die Kellner begrüßen einen sehr persönlich, ohne aufdringlich zu sein. Das Essen war sehr lecker und alles war sehr frisch, der Ouzo mehr als reichlich und am Ende gab es noch einen Espresso und kleinen Obstteller aufs Haus. Absolut zu empfehlen!",5,17.4.2014
13,Asteria,4.5,120,Griechisch / ,Prenzlauer Berg,2,Andreas B.,"Zu dritt eingekehrt, nachdem man jahrelang daran vorbei gelaufen ist.Ein netter Ort ein paar Meter abseits des Tourismusstroms im Kiez rund um den Mauerpark. Erstaunlicherweise geht die Bedienung es entspannt an und glänzt mit Höflichkeit. Griechentypisch ist der erste Ouzo schnell im Glas. Das passiert im Laufe des nachmittags öfter.Das Essen ist überdurchschnittlich gut, schön angerichtet und schmackhaft. Portionen absolut ausreichend. Preislich bewegt es sich etwas höher als man es beim Griechen gewohnt ist, hält sich aber im Rahmen. Das Tzatziki ist sehr lecker, Fleisch saftig und gut gegrillt.Erschreckend sind Getränkepreise ( Glas Wasser über 4 EUR).Insgesamt empfand ich den Besuch als sehr angenehm und verliess das Restaurant dank des reichlichen Ouzos aufs haus leicht angegangen und satt.Eine freundliche Bedienung die alles im Griff hat rundet das Ganze ab !",4,26.5.2015
14,Asteria,4.5,120,Griechisch / ,Prenzlauer Berg,2,Tyler D.,"Nettes Servicepersonal mit Hang zu Späßen. Essen war gut, ich wollte einen griechischen Grillteller und ich bekam einen. Für meinen Geschmack zu wenig Pommes, da hätte ich gerne ein Fleischstück weniger gehabt und mehr Pommes. Ist aber Geschmackssache. Letztendlich blieb etwas über, die Portion war mehr als ausreichend. Sollte es in Berlin nochmal Griechisch sein, dann ruhig wieder hier. Ouzo ging aufs Haus und nicht nur einer.Einen Stern habe ich abgezogen weil mir ein Lammspieß auf dem Teller fehlte, den ich vor Jahrhunderten beim Griechen in Münster immer so schätzte. ;-)",4,29.7.2014
15,Asteria,4.5,120,Griechisch / ,Prenzlauer Berg,2,Sven Q.,"Grandioses Essen, toller und freundlicher Service und ausreichend Ouzo!!!",5,23.6.2013
16,Asteria,4.5,120,Griechisch / ,Prenzlauer Berg,2,Nils T.,Einfach super! Sehr nettes und zuvorkommendes Personal. Traditionelle Musik und Ouzo aufs Haus bis man aus dem Restaurant kriecht. Das Essen ist sehr lecker und wirklich sehr großen Portionen. Der Hauswein ist auch sehr gut. Das war aufjedenfall nicht das Letzte mal in der Asteria.,5,14.6.2015
17,Asteria,4.5,120,Griechisch / ,Prenzlauer Berg,2,Martin F.,"Das ist der Hammer! Wenn ich das nächste mal in Berlin bin, fahr ich gerne einen Umweg um hier wieder vorbei zu kommen!",5,26.5.2017
18,Asteria,4.5,120,Griechisch / ,Prenzlauer Berg,2,Bernd B.,"Bester Grieche in Berlin! Man findet hier eine reichliche Auswahl an leckersten Speisen. Preis- / Leistungsverhältnis SEHR GUT!Das Personal ist stets freundlich und sehr, sehr bemüht einem hier einen schönen Aufenthalt zu ermöglichen! Was ihnen im übrigen auch immer gelungen ist, wir kommen mind. 1 x 1/4 jährlich!",5,21.9.2015
19,Asteria,4.5,120,Griechisch / ,Prenzlauer Berg,2,David S.,"Vorneweg...das Essen ist grundsolide lecker und vor allem auch immer reichlich, wenn auch nicht besonders. Einmalig dürfte aber auf jeden Fall das Personal, die lockere Atmosphäre und der Service drumherum sein. Dafür also absolut Daumen hoch! Durch den Ouzo aufs Haus geht es dann aber auch unter den Gästen manchmal etwas lauter zu und eine gewisse ausgelassen-laute Stimmung stellt sich ein...wer das mag: Tisch reservieren und ausprobieren!In jedem Fall immer für einen netten Abend zu empfehlen.",4,26.11.2014
20,Asteria,4.5,120,Griechisch / ,Prenzlauer Berg,2,Press Member X.,"Der grosszügigste Grieche der Stadt! Wenn Sie echte griechische Gastfreundschaft erleben wollen, dann ab in's Asteria. Man sitzt nett auf der kleinen Terrasse (die Verkehrsgeräusche vergessen Sie bereits nach dem ersten Ouzo, den es schon kurz nach dem Eintreffen im Lokal ""auf's Haus"" gibt. Aber auch sonst lassen sich die Gastgeber hier eine Menge einfallen, um die Gäste bei Laune zu halten. Kein Wunder, dass der Laden jeden Abend brummt. Wer einmal hier war, kommt immer wieder!",5,21.8.2018
21,Asteria,4.5,120,Griechisch / ,Prenzlauer Berg,2,Clara V.,"Vor drei Jahren war das Asteria wohl eines der besseren griechischen Restaurants im Prenzlberg. Mittlerweile sind die Preise ordentlich gestiegen und die Qualität hat leider nachgelassen. Das Gyros war mehr als einmal relativ fad, Salatbeilagen etwas lieblos und welk, generell alles einen Ticken zu fettig. Das Hähnchen in Metaxa-Sauce meiner Begleitung war derart roh, konnte man nicht essen. Nach freundlichem Hinweis darauf und der Bitte, es noch einmal in den Ofen zu schieben, hat der Kellner recht unprofessionell reagiert und auch keine Einsicht gezeigt, schade! Trotz all des (günstigen) Gratis-Ouzo, ich würde nicht noch einmal hier speisen.",3,12.6.2018
22,Asteria,4.5,120,Griechisch / ,Prenzlauer Berg,2,Jennifer S.,"Kann die guten Bewertungen leider nicht nachvollziehen. Hatte telefonisch für 20 Uhr einen Tisch für 2 Personen reserviert. Schon am Telefon sagt man mir, dass wir nur bis 22 Uhr bleiben könnten. Ich weiß, das ist mittlerweile in vielen Berliner Restaurants üblich, doch ist das nicht grade das, was ich mir unter einem gemütlichen Abend und schon gar nicht unter griechischer Gastfreundschaft vorstelle. Habe seit Jahren einen Stamm-Griechen zu dem wir an dem Abend leider nicht konnten und den ich nach diesem Erlebnis umso mehr schätze. War um 20 Uhr da, statt einer freundlichen Begrüßung wurde ich nur knapp gefragt, ob ich denn reserviert hätte. Als ich mit ""ja"" antwortete, wurde ich an den Tisch geführt. Nachdem meine Freundin dann ankam, studierten wir die Karte und bestellten eine gemeinsame Vorspeise und 2 Hauptgerichte. Noch während wir unseren Schafskäse aßen, brachte der Kellner unsere Hauptspeisen, die aufgrund der Größe des Tisches dann nicht mal rauf passten. Das Essen war gut, aber nicht herausragend, normales griechisches Essen. Nach dem Essen verteilte ein Kellner einen kleinen Obstteller sowie einen Espresso, was zwar sehr nett war, jedoch mit der Begeisterung einer Kantinenkraft serviert wurde. Um 21.57 Uhr legte man uns dann die Rechnung auf den Tisch. Mein erster und definitiv letzter Besuch!",3,7.1.2018
23,Asteria,4.5,120,Griechisch / ,Prenzlauer Berg,2,Lance R.,"Faustdicke ausgebackene Ringe aus Calamari Tuben. Ein Batzen stichfester Joghurtcreme. Ein wilder Haufen leicht verkochter Brokkoli. Vorweg ein Simpelsalat mit Eisbergblättern und sauren Karottenstiften. Klingt nicht so raffiniert? Ist es auch nicht. Im Asteria liebt man offenbar die Fritteuse, nicht aber die Gewürze. Die gemischte Fischplatte ist eine Ode ans fade Fettgebackene. Leider ist alles etwas zu weit gegart. Was bleibt dem Gast also übrig? - Die imposante Menge zusammen mit dem Knoblauchdonner des Tzatziki und dem Ouzo runterspülen. Die Stimmung in dem Laden ist jedenfalls bombig und der Service ist herzlich und auf Zack.",3,6.10.2015
24,Asteria,4.5,120,Griechisch / ,Prenzlauer Berg,2,Fyfy B.,"Ich habe im Asteria gegessen und es war wirklich super lecker!Wir waren zu Dritt und haben 3 Vorspeisen und 3 Asteria-Teller. Das Essen war wirklich super lecker, jedoch war es viel zu viel! Deswegen würde ich vorschlagen eher Essen zu teilen um nicht soviel Essen zu vergeuden..Wir waren an einem Samstag da, und es war super Atmosphäre. 2 Griechische Musikanten haben den ganzen Abend laute Musik gespielt und Leute sind während dem Essen aufgestanden haben getanzt und geklatscht! Es war also ziemlich Laut, dh nicht geeignet für ein romantisches Dinner. Auf jeden Fall authentisch, dar viele Griechische Familien dort gespeist haben.Ich würde Asteria auf jeden Fall Empfehlen! Jedoch machen Sie am Wochenende eine Reservierung!",4,11.1.2015
25,Asteria,4.5,120,Griechisch / ,Prenzlauer Berg,2,Michael K.,"Bester Grieche wo ich ausserhalb Griechenlands gegessen habe! Sehr freundliches Personal, sehr gutes Essen (große Portionen!) und dazu noch ne Ouzo-Flatrate für lau. Ambiente auch sehr einladend. Vorab unbedingt Reservieren! Ich komme wieder.",5,17.9.2014
26,Asteria,4.5,120,Griechisch / ,Prenzlauer Berg,2,Kristian C.,Große Portionen - was bei einem griechischen Restaurant nicht überraschen sollte - dafür jedoch deutlich besserer Geschmack als man es gewohnt. Zackiges Kellner und Ouzo so viel man möchte - aufs Haus ;),5,1.10.2015
27,Asteria,4.5,120,Griechisch / ,Prenzlauer Berg,2,Peter R.,"Hier gibt es noch richtige Gyros. Unterschiedliche Größe stücke Fleisch , kross ein bisschen Fett aber so wie sie sein sollen. Suflaki lecker frisch , ein Spieß in richtiger Größe mit roten Reis und zaziki. Lecker bis man satt ist, weil leer habe ich und meine Frau nicht geschafft. Emma sagt die Pommes waren auch gut. Wir kommen wieder",5,13.5.2014
28,Asteria,4.5,120,Griechisch / ,Prenzlauer Berg,2,Lisa M.,"Der beste Grieche überhaupt! Immer wenn ich bei meiner Schwester in Berlin bin, ist ein Besuch hier Pflicht! Sehr gutes Essen,große Portionen,extrem freundliches Personal und hier ein Quzo extra und da noch ein bisschen Obst! Einfach großartig!!!!",5,21.9.2014
29,Asteria,4.5,120,Griechisch / ,Prenzlauer Berg,2,Flo R.,Persönliche Begrüßung und Verabschiedung per Handschlag von jedem Gast. Wie schon mehrfach angemerkt wurde gibt es wahnsinnig viel Ouzo aufs Haus. Vermutlich ist die Stimmung daher sehr gut und laut. :-)Das Essen ist guter Durchschnitt und der kostenlose Obstteller nach dem Essen ist aller Ehren Wert. Ich komme beim nächsten Berlinbesuch gerne wieder.,5,5.12.2012
30,Asteria,4.5,120,Griechisch / ,Prenzlauer Berg,2,Michael J.,"Netter Laden, wenn man es lebhaft mag. Ordentliche Küche und ordentlich Ouzo auf's Haus.",4,23.8.2015
31,Asteria,4.5,120,Griechisch / ,Prenzlauer Berg,2,Lars M.,"2. Besuch (erfolgreich) Nachmittags angerufen und Terminwunsch auf die gewünschte Uhrzeit (mit Groupongutschein) klappte problemlos. Vor Ort wie jeder Gast auch eingecheckt. Mehrere nette Kellner waren bei der Arbeit und das Lokal war zu ca. 30-40% ausgelastet. Der Service war TOP und das Essen auch. Weinblätter, Rinderfilet, Salat, Calamaris und gebackener Feta waren sehr zu empfehlen. Dazu gab es eine Runde Ouzo, frei Haus. Wir hatten nicht das Gefühl, mit dem Gutschein dieses Mal benachteiligt zu sein. Die Musik war ein wenig laut, gut, dafür hat der Gast den Straßenlärm vermutlich nicht gehört. Alles in Allem 5 Sterne bei diesem Besuch, addiert mit der Enttäuschung beim 1.Versuch mit einem Stern = 6 Sterne, geteilt durch 2=3*** Warum nicht gleich so?!?!? Der alte Bericht:- 1. Besuch (Versuch)Wir haben hier gegen 19:00 Uhr angerufen und wir wollten einen Tisch reservieren. Nachdem das Stichwort Groupon-Gutschein gefallen war, wurde behauptet, dass das Lokal voll wäre und erst ab ca. 22:30 Uhr wären wieder Plätze frei. Kurzer Hand vorbeigefahren, vorbeigeschaut und festgestellt, dass 80% der Tische frei waren. Auf persönlicher Nachfrage waren auch Plätze frei. Umgedreht und gegangen. Lage des Restaurants an lauter Hauptstraße mit Straßenbahn und Hochbahnlärm. Fazit: Unverständliche Benachteiligung von Gutscheinkunden. Warum werden hier erst Gutscheine verkauft? Man wird durch das Personal belogen und auf Uhrzeiten zur nachtschlafenden Zeit mit Gutschein verwiesen, ohne das dieses auf den Gutscheinen steht.",3,14.2.2012
32,Asteria,4.5,120,Griechisch / ,Prenzlauer Berg,2,Aliofredi ..,"Super Essen und Super Stimmung!  Uneingeschränkt zu empfehlen !!!! Komme sehr gerne wieder! .Man sollte Ouzo mögen, denn der fließt reichlich",5,17.10.2015
33,Asteria,4.5,120,Griechisch / ,Prenzlauer Berg,2,Michael B.,"ich bin ja eher skeptisch bei Restaurants die so mitten auf einer Touristenmeile liegen. Aber der Hunger nach Griechischen Essen war groß. Wir wurden positiv überrascht. Das Restaurant Asteria unterscheidet sich in keinster Weise von einem Griechen auf dem Lande. Das Essen war angenehm reichlich, das Fleisch nicht trocken. Es war gut. Es wurde desöfteren mit einem witzigen Spruch Ouzo auf`s Haus nach geschenkt. Sehr familiär und freundlich die leute da. Toiletten sind sehr sauber. Und auch das restaurant selber macht einen gepflegten Eindruck.Wer also in der Ecke Schönhauser Allee / Eberswalder Strasse Hunger auf Griechische Speisen hat, sollte hier mal rein schauen. Sitzplätze gibt es sowohl drinnen als auch draußen.",5,17.6.2012
34,Asteria,4.5,120,Griechisch / ,Prenzlauer Berg,2,Guenter L.,"Nach Superfreundlichem Empfang mit Handschlag und Lächeln kam das Gyros,das wirklich  allererste Sahne  war.Dann kamen 4 Ouzo fuer mich und meine Begleitung.Danach bekamen wir  weiterhin aufs Haus:0,5 liter Ouzo  FlascheNachtisch,mit Obst und nachdem  der alle  war,nochmals das selbeAls wir danach vor lauter Essen und  Trinken fertig  waren,kamen nochmals 2  Espresso aufs haus.Was soll man dazu noch sagenSuper ServiceFreundlichkeit gepaart mit Essen vom Feinsten und dazu noch ein Preis-Leistungsverhältniss,das einmalig ist.Besseren Griechen habe ich noch nie erlebt.",5,28.12.2014
35,Asteria,4.5,120,Griechisch / ,Prenzlauer Berg,2,Josef H.,Liebloses Touristenessen. Keine Raffinesse und teuer oben drein. Ich habe lieber gutes Essen als gratis Ouzo bis zum Abwinken. Obwohl den braucht man in dem Fall wirklich ganz dringend!,2,17.8.2016
36,Asteria,4.5,120,Griechisch / ,Prenzlauer Berg,2,Christian B.,Sehr gutes essen zum fairen Preis und dazu noch Super freundlich. Dazu hab's nen gratis Ouzo. Atmosphäre war (im positiven Sinne) familiär.Ein richtiger Tipp von mir.Gerne wieder!,5,22.10.2013
37,Asteria,4.5,120,Griechisch / ,Prenzlauer Berg,2,Daniel A.,"Persönliche Begrüßung,Hammer essen , nette Leute , gerne wieder, wenn man nicht auf sein Schnapsglas achtet wird es nix mit nüchtern nach hause Gehn es wird ständig reichlich Ouzo nachgeschenkt,",5,5.1.2016
38,Asteria,4.5,120,Griechisch / ,Prenzlauer Berg,2,Wolfram H.,"Lebhafter Grieche direkt neben der U-Bahn Station Eberswalder Strasse. Viel Fleisch, Qualität gut, allerdings kaum Beilagen. Ouzo gibt es ununterbrochen dazu, auch ein Dessert zum Abschluss. Leider ist der Laden brüllend laut, speziell im Obergeschoss. Wer sich beim Essen unterhalten will, sollte besser woanders hingehen.",3,5.11.2017
39,Asteria,4.5,120,Griechisch / ,Prenzlauer Berg,2,Susi S.,"Immer wieder ein Besuch wert! Ein Muss für alle Fleischliebhaber! - Super Essen, leckeren Ouzo und ein tolles Team. Wer wird nach dem dritten Besuch nicht gerne mit Namen begrüßt :)",5,16.10.2015
40,Asteria,4.5,120,Griechisch / ,Prenzlauer Berg,2,Sven B.,Gefährlicher Laden :) . Wir hatten zum Essen In Summe vier oder fünf Ouzo aufs Haus plus Obst als Nachtisch. Die Portionen waren reichlich groß und allen hat es gut geschmeckt. Die Lage direkt an Der U-Bahn ist bestens. Wir kommen wieder.,5,6.1.2013
41,Asteria,4.5,120,Griechisch / ,Prenzlauer Berg,2,Chris R.,"Hab dieses tolle griechische Restaurant erst vor einigen Wochen entdeckt. Wer hier nicht reserviert, braucht Glück, um einen Tisch zu kriegen. Kein Wunder! Wenn man einmal hier war, kommt man auf jeden Mal wieder. Das Essen ist toll (vor allem Lammkoteletts, Gyros und die Vorspeisenteller), die Portionen und die Auswahl sind riesig. Die Jungs sind mega nett und offen für Sonderwünsche. Auf den ersten Blick können einem die Preise für Berliner Verhältnisse etwas hoch vorkommen. Aber dafür gibts den ganzen Abend Ouzo für lau sowie gratis Nachtisch und Espresso. Da kann man nicht meckern. Stimmung ist gut und durchaus gern mal etwas lauter in dem schön eingerichteten Lokal. Nichts für Leute, die es gern ruhig haben beim Essen.",5,27.9.2016
42,Asteria,4.5,120,Griechisch / ,Prenzlauer Berg,2,Katja V.,"Freundlicher Service, leckeres Essen und sehr mächtige Portionen. Die Hälfte der Portionen hat uns der nette Kellner zum mitnehmen eingepackt (ohne dass wir ihn drum gebeten haben). Das finde ich sehr gut, weil so nicht unnötig Essen weggeschmissenen wird (schmeckt ja schließlich auch noch am nächsten Tag). Die Preise sind für diese gute Laga in schönen Prenzlauer Berg, den guten Service, guten Geschmack und für die Größe der Portionen vollkommen zulässig und akzeptabel. Der einzige Kritikpunkt war für uns die ziemlich laute und doch sehr rhythmische Musik, die einen das entspannen am Feierabend schwer macht. Daran soll es aber nicht scheitern und wir kommen gerne wieder.",5,22.2.2017
