,Restaurant Name,Overall Rating,Total Reviews,Specialty,Region,Price Range,Author,Comment,Rating,Date
0,100 Gramm Bar,5,50,Cocktailbar / Tapas / Russisch / ,Mitte,Unknown,Wolfgang F.,"Wow. Wirklich gute Drinks hier. Ich bin kein großer Cocktailtrinker, aber nach meinem Mule am Samstag war ich am nächsten Abend wieder da. Wirklich gute Cocktails die sich meilenweit von den üblichen Happy Hour drinks unterscheiden. Tolle Aromatik und auch durchaus mit einemes wird eben auch nicht an Rum und Co gespart. Dazu bekommt man direkt eine Flasche Leitungswasser auf den Tisch gestellt. Die Bedienung ist freundlich, flott und sehr aufmerksam. Draußen aufgrund der Nachbarschaft leider schon gegen kurz nach 21h letzte Runde, am Wochenende sehr gut besucht.  Aus gutem Grund. Volle 5 Sterne.",5,8.6.2022
1,Restaurant Café Madrid,4.5,4,International / Fischrestaurant / Deutsch / ,Mitte,Unknown,Christian S.,"AllgemeinIn unmittelbarer Nähe zum S-Bahnhof Friedrichstraße liegt das Hotel Melia, eine spanische Hotelkette. Das Café-Restaurant Madrid gehört zum Hotel und ist in der ersten Etage durch die Lobby oder durch die unter dem ""Madrid"" gelegene Tapas Bar erreichbar. Zum Zeitpunkt des Besuchs war später Mittag und es waren nur wenige Gäste anwesend, aber die Küche war bereit. Das Restaurant zählt zur etwas gehobenen Preisklasse, wird aber diesem Anspruch auch gerecht. Wiederkommen lohnt.BedienungTrotz der relativ geringen Auslastung zur Besuchszeit waren noch mehrere Servicekräfte im Einsatz, die alle über einen guten Ausbildungsstand verfügten. Servieren, Ansprechen der Speisen und Beantworten von Nachfragen klappten perfekt. Freundlichkeit kam hinzu.Das EssenDen Auftakt machte ein Gruß aus der Küche, der bis zum Ende des Hauptgangs auf dem Tisch verblieb: Kräuterbutter mit zwei Ölen und grobem Salz sowie drei Brotsorten. Die Suppe von der Quitte war der nächst folgende Genuss. Sie wurde am Tisch aus einer Karaffe in den sehr heißen Teller eingebracht. Ein kleines Erlebnis. Der Hauptgang, Heilbutt unter der Orangenkruste, war optisch und sensorisch wunderbar. Hier ist eine sehr gute Küche am Werk. Für ein Dessert blieb wegen der anstehenden Zugabfahrt keine Zeit.Das AmbienteEs handelt sich um einen großen, um das Straßeneck gebogenen Gastraum, der auch für das Frühstücksbuffet genutzt wird. Etwas steif wirkt er, aber nicht unangenehm. Der Blick an den Fenstertischen wird zudem auf das pulsierende Leben auf der Friedrichstraße im Dreieck zwischen Admiralspalast, Berliner Ensemble und Friedrichstadtpalast gelenkt. So ist man auch als Einzelgast jederzeit unterhalten.SauberkeitSehr feine Tischwäsche wird verwendet. Den fünf Sternen in diesem Bereich ist nichts weiter hinzuzufügen.",5,30.11.2013
2,Restaurant Café Madrid,4.5,4,International / Fischrestaurant / Deutsch / ,Mitte,Unknown,1 Foto,"AllgemeinVorneweg: das Rind und die Garnele können sich glücklich schätzen, dass sie bei einem so guten Koch in der Pfanne gelandet sind. Medium-rare und butterweich ist selten.Wir kamen um 14.30 im Restaurant an. Gutschein wurde entgegengenommen und es gab auch noch Mittagessen, was uns sehr freute. Nach der etwas lauten und hektischen Stadt waren wir froh in einen ruhigen Ort zu kommen - mit leichter 'bedeutungsloser' Musik. Das Restaurant war komplett leer. Auch später kamen keine Gäste mehr dazu - es war auch nicht gerade die Zeit für 'Mittagessen'.BedienungDen Tisch durften wir uns frei aussuchen. Wir nahmen uns ein Plätzchen am Fenster mit Blick auf die Bootchen und einer Fußgängerampel mit wunderbarem Beobachtungspotential auf das Treiben ;-)Gutschein zählt auf ein Hauptgericht. Bedienung hat leider nicht darauf hingewiesen, dass der Salat auch als Hauptgericht zählt und damit in die RK-Gutschein 2für1 läuft. Dabei hätte Sie beim Bestellen hinweisen können. Auf unsere Frage als wir die Rechnung hatte, wurde es uns erkärt.Aber gerne erinnere ich mich an den sanften Windhauch, wenn die Bedienung von hinten kam und mir das Wasserglas nachgeschenkt hat. Ach, das ist einfach herrlich.Die Wartezeit zwischen Vorspeise und Hauptgang empfand ich als einen Tick zu lange.Bei jedem Gang wurden wir gefragt, ob alles zu unserer Zufriedenheit ist. Tipp: 1 min später ... ich muss erst alles probieren ... nicht gleich fragen.Das EssenVorgedeck:Brot mit Öl+Balsamico+Salz+Paprikabutter (siehe Bild - bitte anklicken). Es gab dunkles Brot mit Körner (kein Vollkorn) und helles Brot. Welches auch gerne nachgereicht wird. Das Brot und Butter blieb während des Hauptgangs stehen.'Vorspeise': 6 Riesengarnelen mit Spinatsalat und eingelegten Gurken6 marinierte große Garnelen mit Granatapfelkernen und Pinienkerne. Eine Salatmischung mit Spinat und öhhh... Frisee-Salat (?) ... mit Balsamicodressing. Lecker.Filtesteak gegrillt mit Kartoffelgratin, Böhnchen, Pilz mit Tomate(siehe Bild) Das Filetsteck war butterzart und wie gewünscht medium rare. Da hatte das Rind doch richtig glück, dass es so sanft und gekonnt behandelt wurde. Der Kartoffelgratin war messerscharf in ein quardat geschnitten. Die grünen Böhnchen mit Pesto bestrichen und einmal 'längs' einmal 'quer' geschichtet. Darauf ein gegrillter Pilz mit einer gehäuteten Tomate gefüllt. Sehr schöne Anrichtung. Nicht zu übertrieben, aber irgendwie mit 'Liebe'.Ich hatte eine Pfefferjus dazu. Der beste-Ehemann-von-allen nahm Kräuterbutter.Nachtisch wurde angeboten - war uns aber einfach zuviel, da wir schon pompööös gefrühstückt hatten.Das AmbienteSchön - aber doch ein wenig 'hotelmäßig' funktionell. Ist glaub ich auch der Frühstücksraum.Blick auf die Straßenkreuzung, wo immer was los ist.SauberkeitDa gibt es gar nix zu beanstanden. Besteck wurde poliert. Stoff-Servietten haben ein 'Einsatzdatum' von 03-2013 ... das Qualitätsmanagement-Herz läßt das höher schlagen.",4,6.7.2013
3,Restaurant Café Madrid,4.5,4,International / Fischrestaurant / Deutsch / ,Mitte,Unknown,FoodLover H.,"Gutscheineinlösen in Berlin, die Zweite.  Meine Frau und ich hatten für Samstag Abend Konzertkarten (CrashDiet - wie passend...) und ich dachte mir, es wäre gut vorher noch eine Kleinigkeit zu essen. So beschlossen wir im Cafe Madrid anzurufen und zu fragen, ob denn auch Nachmittags, gegen 16.00 geöffnet sei. Kein Problem meinte die nette Dame am Telefon, allerdings gäbe es nur eine ""kleine Karte"".So liefen wir am selben Nachmittag in die Lobby des Gran Melia Hotels an der Friedrichsstraße ein, ließen uns den Weg ins Restaurant zeigen und stiegen die Freitreppe in der 1. Stock. Dort sprachen wir die Hostess an und baten um einen Tisch, worauf die Dame meinte, sie hätten heute geschlossene Gesellschaft. Das erboste mich dann doch und ich erklärte ihr, dass wir extra angerufen hätten. Darauf meinte sie, sie hätten heute einige Jugendweihen (????) und wir müssten mit Wartezeiten rechnen, da gerade die Desserts angerichtet würden...Nun ja, wir bekamen einen schönen Tisch abseits der drei kleinen Gesellschaften, die sich in dem ansonsten leeren Gastraum befanden. Das kann ja was werden, dachte ich mir, zumal wir unseren DinersChoice Gutschein noch gar nicht erwähnt hatten, und schaute erst einmal aus dem Fenster auf die Spree und die Straßenszenerie - schön urban. Dann bekamen wir die Karten. Die waren nicht klein, sondern eher optimal. Wir fanden schnell was wir suchten. Ein Rumpsteak, mit Princess Bohnen, Gratin und frischen Champignons. Das bestellten wir zweimal rare, dazu eine Flasche Wasser und eine Karaffe Tempranillo für mich.  Ich überreichte der Hostess, die uns bediente und inzwischen sehr freundlich war unseren Gutschein und hielt den Atem an. Aber wie durch ein Wunder lächelte sie nur und meinte: sehr gerne. Fortan war der Service, wirklich perfekt und sehr herzlich. Das war wirklich eine positive Überraschung.Die Getränke kamen nach angenehmer Wartezeit und waren wohltemperiert. Dazu gab es leckeres Brot mit Salz, Quark und Olivenöl. Kurze Zeit später dann das Amuse Geule. Eine sehr leckere Bärlauch Consommé - wunderbar würzig - ein angenehmer Gaumenschmeichler.  Da das Timing des bisherigen Serviceablaufs perfekt war, fiel die etwas längere Wartezeit auf die Hauptspeisen nicht weiter ins Gewicht und war durchaus angenehm. Die Teller waren nett angerichtet, es gab noch zwei (!) Saucieren mit Rahmsauce dazu und für jeden eine große Schale frischem Salat. Ich schnitt das Steak an... und es war rare!!! Ich konnte mein Glück kaum fassen. Darüber hinaus schmeckte es uns beiden ganz vorzüglich. Die Komposition war nun zwar nicht außergewöhnlich aber handwerklich perfekt umgesetzt.  Wir tranken dann noch gemütlich aus, genossen die Aussicht und vergaßen fast, dass wir es doch eilig hatten... So verzichteten wir auf Espressos und baten um die Rechnung, die nicht nur aufgrund der Gutschein Ersparnis äußerst moderat ausfiel. So kamen wir am Ende incl. Tip auf 40,00 EUR, die wir problemlos mit MasterCard bezahlen konnten.  Fazit: Ein ganz wunderbarer Nachmittag im Café Madrid. Dringende Empfehlung meinerseits!",4,16.5.2013
4,Restaurant Café Madrid,4.5,4,International / Fischrestaurant / Deutsch / ,Mitte,Unknown,Anna D.,"Auf der Suche nach einem Tapas-Restaurant sind mein Lebenspartner und ich durch Berlin gelaufen. Aufgefallen ist das Café Madrid durch die Glasfront, die den Gästen einen wunderschöne Aussicht gewährt und Passanten erlaubt, einen Blick in das schick eingerichtete Restaurant zu werfen. Wir wurden von einer netten und aufmerksamen Kellnerin empfangen, die uns einen Tisch zugewiesen hat.Die Speisekarte ist nach Tapas und Hauptgänge geteilt und ist sehr umfangreich.Wir haben verschiedene Tapas bestellt. Die Qualität und die Armoen der verschiedenen Tapas war überwältigend. Es gab sehr interessante Kompositionen wie Scampis angebraten in Olivenöl mit Chili, Zitronengras und Knoblauch. Wirklich sehr köstlich und absolut empfehlenswert!Auf Empfehlung der Kellnerin haben wir verschiedene Weine zu den Tapas getrunken.Bei dem nächsten Besuch in Berlin ist ein ein absolutes muss für jeden Tapas-Liebhaber dieses Restaurant zu besuchen!Bach",5,16.1.2012
5,phönicia,4.5,6,Libanesisch / Mediterran / Fast Food / ,Wedding,1,Maggi S.,Best schawarma in Berlin by far. Very very tasty and cheap. A true gem in wedding. Try the mix teller with extra meat!,5,13.12.2021
6,phönicia,4.5,6,Libanesisch / Mediterran / Fast Food / ,Wedding,1,Simon E.,"Das Essen ist von mittlerer Qualität, aber man wird günstig satt. Zudem ist der Inhaber sehr freundlich und man wird flott bedient.Ideal also für einen business lunch.",4,11.11.2015
7,phönicia,4.5,6,Libanesisch / Mediterran / Fast Food / ,Wedding,1,Tobias L.,"Innen lädt es nicht unbedingt zum Verweilen ein, aber das Essen macht das alle mal wieder wett. Die Falafel schmeckt so wie sie soll - außen knusprig, innen fluffig. Die Soßen geben dann noch einen schönen Kick. Man merkt: Der Mann weiß, was er tut.  Die Preise sind unschlagbar. Kurzum: Top! #leckerschmecker",5,8.4.2017
8,phönicia,4.5,6,Libanesisch / Mediterran / Fast Food / ,Wedding,1,Gui M.,"Mix-Teller, 6€: ein Häufchen schmackhaftes Schawarma, 2 leckere Falaffel, 1 Haloumi, extrem leckere Süßkartoffel, Aubergine, gutes Taboule, 2 sehr leckerere Saucen, normales Hummus. Schawarma-Teller, 5€: auch gut.Den Krautsalat habe ich nicht gegessen (isst den irgend jemand?). Am Freitag Abend bei 24 Grad war das wie ein Urlaubsabend. Wir waren sehr zufrieden.",4,19.8.2016
9,phönicia,4.5,6,Libanesisch / Mediterran / Fast Food / ,Wedding,1,Lisa L.,Das Phönicia liegt gleich bei mir um die Ecke. Das Essen ist einfach super lecker und die Bedienung ist sehr freundlich. Für wenig Geld bekommt man wirklich was auf den Tisch- auch auf Bestellung vegan,5,7.8.2016
10,SaDu am Pergamon,5,50,International / ,Mitte,Unknown,Ciecero G.,"Die Lage ist super. Drinnen gibt es Hinweise auf ein Cafe - warum? Klassisches Restaurant findet man hier. Dss Personal hat noch Luft nach oben, aber ich denke es passt. Das EsseN war super  es ließ keine Wünsche offen. Zubereitung und Anrichtung super!",5,22.1.2020
11,Sarod’s Thai Restaurant,4.3,43,Thailändisch / ,Bergmannkiez,2,Stefan S.,"Das Sarod's ist ein schönes kleines Thai Restaurant im sogenannten Bergmannkiez in Berlin. Hier gibt es sehr viele kleine aber feine Restaurants - unter anderem eben auch das Sarod's, das mit dem Thai Select Label ausgezeichnet wurde. Ich wurde herzlich begrüßt, als ich in den schicken Laden kam. Gleich aufgefallen sind mir die Designer Lampen, die alles in ein gedämpftes Licht hüllen. Leider kann man dadurch aber das wundervolle Essen garnicht richtig bewundern, da es Abends einfach fast zu dunkel im Restaurant ist. Aber das nur am Rande. (Daher leider auch keine Bilder)Das Essen war sehr gut. Scharf ist auch wirklich scharf - also, wer es nicht gewohnt ist, bitte aufpassen. Preis-Leistung ist absolut ok. Bedienung:    *****Ambiente:      ****Essen:            *****Getränke:       ****Preise:            *****Schärfe:         *****Thai Select:    Ja Empfehlung:  unbedingt besuchen",5,22.3.2019
12,Sarod’s Thai Restaurant,4.3,43,Thailändisch / ,Bergmannkiez,2,Hendrik A.,"Gestern abend zu viert da gewesen, in erster Linie wgen der guten Bewrtungen. Kann ich leider nicht bestätigen. Der Laden war brechend voll, wir hatten reserviert, das hat auch gut geklappt. Karten kamen schnell, bis jemand die Bestellung aufnahm, dauerte es rund 15 Minuten, Getränke kamen zügig - dann passierte erstmal nichts. Nach ca weiteren 20 min kam dann eine Vorspeise. Die 2.te bestellte kam dann ca. 40 min später, nach weiteren 20 min die Hauptgerichte. Also rund 1 Stunde 20 min von Bestellung bis zum Essen...Das Essen selbst war ok, aber nichts Besonderes. Einer von uns hatte extra scharf bestellt - das ging offensichtlich unter...Bedienung war praktisch nicht vorhanden. Wir wurden nicht einmal nach weiteren Getränken gefragt. Man musste sich einer Bedienung praktisch in den Weg werfen, um bemerkt zu werden. Insgesamt enttäuschend, Wiederholungsfaktor ist 0.",2,28.8.2021
13,Sarod’s Thai Restaurant,4.3,43,Thailändisch / ,Bergmannkiez,2,Tommy T. T.,"Dass man mal einen nicht so guten Tag hat, wird gemeinhin auch der Bewertung eines Restaurants gerecht bleiben müssen. Und das war so, zweifelsohne. Aber summa summarum mag ich das Restaurant deswegen trotzdem. Denn erstens ist es hier ein bemühtes, aber leicht wirkendes miteinander Arbeiten von Gast, Gästin und Bedienung. Meine war am 04.10. besonders bemüht und supersüß. Ich habe mich mehr als überschwänglich bedankt, denn sie half mir noch, ein Blumenphuket (...) in gewinnbringender Art und Weise zu fotografieren. Da wusste ich: Hier bin ich gut aufgehoben. Es ist der Respekt vor so Kanaillen wir mir, die nichts besseres zu tun haben, als alles zu fotografieren und in Szene zu setzen.Mit dem Fisch hatte ich Pech. Ich esse eigentlich nämlich Tilapia nicht. Mein Wissen ist nicht profund, aber ich weiß oberflächlich, dass dieser FIsch zu den meistgezüchteten der Welt gehört, oft unter grausamen Bedingungen und in Aquakulturen. Ich weiß es wie gesagt nicht. Aber ich ließ mich breitschlagen, paff, und nun saß ich dort, breitgeschlagen und verköstigte Tilapia. Der Tisch war schön kross frittiert, die Soße war gut und reichlich (Ich orderte: ""Der Fisch muss schwimmen. Bittschön, gnä Frau."" Und nun schwomm er auch.)Mein Tischkompagnon Volker hatte so eine Art thailändisches, gemischtes Allerlei. Davon kostete ich und es war nicht meins. Seins auch auch nicht. Wie schade. Wir hatten uns sehr drauf gefreut. Mir ist das egal. Ich schreibe hier eine Aktualisierung. Ich bin nicht so blöd zu behaupten, dass nun das Restaurant schlechter geworden ist. Nein, ich hatte Pech. Ich weiß, dass das ein gutes Restaurant ist und ehrlich gesagt glaube ich, beim nächsten Mal bin ich hier wieder glücklich. Bedingung ist natürlich, dass Sie mich wieder bedient und mir hilft, dies narrische Blumenphuket zu fotografrieren: Weil Winter ist und es ist kalt. Har. Scheiß-Wortspielerei...aber luschdick iss scho, gelle?Weiterlesen....",5,6.10.2018
14,Sarod’s Thai Restaurant,4.3,43,Thailändisch / ,Bergmannkiez,2,Wolfgang M.,"Dirk bestellte einen Salat mit Flügelbohnen und Garnelen, ich eine Tom Khai-Suppe - beides war sehr gut. Als Hauptgericht Krosse Ente, gelbes Curry und Kokosmilch, wo wir uns für jeweils für kleine Portionen entschieden. Auch diese Gerichte waren hervorragend. Die Ente sehr zart. Der Service ist ausgesprochen freundlich. Selbst an blöde Restaurantgäste wurde gedacht: neben Messer, Löffel und Gabel lagen auch Stäbchen bereit (die existieren in der thailändischen Küche überhaupt nicht, werden aber ständig von nicht-thailändischen Gästen, besonderen von den Messer- und Gabelessern verlangt. Die Peinlichkeit das dem Gast zu sagen, wird so umgangen.)",5,14.9.2016
15,Sarod’s Thai Restaurant,4.3,43,Thailändisch / ,Bergmannkiez,2,Patrick R.,"Unserer Vorliebe für asiatisches Essen folgend kehrten wir im Sarod's ein. Während das im Bergmannkiez gelegene Restaurant über reichlich Innenplätze verfügt, ist man durch mehrere Tische im Außenbereich und großflächig geöffnete Türen auch auf gutes Wetter vorbereitet. Wir nahmen außen Platz.Nach der Bestellung der Getränke - man hat Lemonaid im Angebot - bei der aufmerksamen und freundlichen Bedienung studierten wir die Karte. Wir wählten Muh Phad Kra Phao (Thaibasilikum, Gemüse in Knoblauch -Chilisoße) sowie Thod Man Plah (Fischfrikadellen (Thai-Art) mit Thaibasilikum und hausgemachter Soße). Beide Gerichte waren schmackhaft und wurden auf vorgewärmten Tellern serviert. Für meinen Geschmack hätte die Portion des Phad Kra Phao etwas größer ausfallen können.Insgesamt hat es uns gut gefallen und wir werden wieder reinschauen und mit Sicherheit noch eine Vorspeise bestellen.",4,20.6.2018
16,Sarod’s Thai Restaurant,4.3,43,Thailändisch / ,Bergmannkiez,2,Wolfram M.,"Das sarod's in der Friesenstr., unweit der Marheinike-Markthalle,  ist ein wirklich sehr gutes thailändisches Restaurant. Freundliche Atmosphäre und Bedienung und hervorragendes Essen. Hier war ich eher zufällig, da ein anderes Restaurnat, dass ich urspünglich ansteuern wollte geschlossen hatte. Damit eine persönliche Entdeckung, die ich immer wieder aufsuchen werde.Die Speisekarte ist umfangreich und bietet für jeden Geschmack etwas passendes. Zu empfehlen ist die Tages- bzw. Wochenkarte. Übrigens: Wenn hier hinter einem Gericht ""scharf"" steht, dann ist das wörtlich zu nehmen. Wer nur gerne mal scharf ist, sollte bei der Bestellung genau abklären, wie scharf es denn sein darf.",5,7.5.2016
17,Sarod’s Thai Restaurant,4.3,43,Thailändisch / ,Bergmannkiez,2,Thorsten G.,"Letzte Woche mit drei Kollegen hier gewesen. Schon lange nicht so gut thailändischen gegessen. Die Fischbällchen waren sensationell, das anschließende Curry stand dem in nichts nach. Der Wein kam aus der Weinbar nebenan und war entsprechend gut. Die Betreiber waren sehr freundlich und zuvorkommend. Die angemessenen Preise haben alles abgerundet. Ich war hier nicht das letzte mal.",5,30.5.2018
18,Sarod’s Thai Restaurant,4.3,43,Thailändisch / ,Bergmannkiez,2,Herr R.,"Freundlicher Gastraum, sehr nette Bedienung und wirklich gutes thailändisches Essen in eher üppigen Portionen...Was will Mann mehr ??Beeindruckend:Auf dem Weg zum Klo an der Küche vorbei, da duftete es so frohlockend und herrlich: frisch und 'kräuterich'..da war so gar nichts von altem Fritierfett und abgestandenem Reis zu riechen ich hätte direkt nochwas bestellen können obwohl ich schon satt war toll !!.....Alles supersauber und clean...das geht auch ganz anders :-0Ich war mit dem Abend sehr zufrieden, 1 Stern Abzug wegen der Preise, ist jetzt nicht überteuer, aber schon über dem normalem Level.... aber insgesamt o.k.",4,1.1.2016
19,Sarod’s Thai Restaurant,4.3,43,Thailändisch / ,Bergmannkiez,2,Geli R.,Essen ist etwas zu teuer und an qualitativ hochwertigen Zutaten wird gespart. Der Fisch war frittiert obwohl es nicht in der karte stand und für 75 Euro mit wein für 2 erwarte ich mir in Berlin etwas mehr von einem Lokal. Service war allerdings top! Sehr nett und flink.,2,8.5.2015
20,Sarod’s Thai Restaurant,4.3,43,Thailändisch / ,Bergmannkiez,2,Stephan F.,"Mit Berücksichtigung der bei Yelp vergebenen Note eine Enttäuschung.Das Ambiente im hinteren Raum des Restaurants wirkt nicht so ganz gemütlich und gleicht eher einem engen Durchgangsraum, denn dahinter befinden sich WCs und Küche, es ist sehr hellhörig, die Tische sind zu dicht gestellt.Preislich hat der Wirt gut auf seinen Gewinn kalkuliert, denn große Gerichte sind in anderen Thai-Restaurants mindestens genau so groß, allerdings um einiges günstiger. das gilt besonders für die vegetarischen Varianten.Wenn einem vom Chef einfach mal die Menükarte ohne Fragen vom Tisch entrissen wird ohne eines Blickes zu den Gästen, ist Kundenzufriedenheit und Service nicht an erster Stelle.Insgesamt gutes Mittelmaß, mit einem unausgewogenen Preis-Leistungsverhältnis und Schwäche im Service, deshalb 3 Sterne.",3,15.2.2015
21,Sarod’s Thai Restaurant,4.3,43,Thailändisch / ,Bergmannkiez,2,Patrick D.,"Sehr gutes Essen. Es gibt das was man auch erwartet. Das schmeckt dann auch so.Preise sind in Ordnung. Möchte man draußen sitzen sollte man reservieren. Die Lage ist gut, es gibt einige Fußgänger und Radfahrer die die Kellner ab und an kreuzen. Essen und Getränke sind schnell am Tisch. Die Kellner sind sehr freundlich.Empfehlenswert!",4,21.7.2017
22,Sarod’s Thai Restaurant,4.3,43,Thailändisch / ,Bergmannkiez,2,Leon H.,"Ein Thailänder der etwas schicker als die meisten ist. Wirklich sehr, sehr gutes Essen. Vorsicht: scharf ist scharf. Nicht europäisch scharf ;)",5,10.3.2015
23,Sarod’s Thai Restaurant,4.3,43,Thailändisch / ,Bergmannkiez,2,Bastian G.,"Sehr netter gemütlicher Thai, freundlicher Service und ausgesprochen schmackhafte Speisen.Kann man nur weiterempfehlen.",5,30.10.2011
24,Sarod’s Thai Restaurant,4.3,43,Thailändisch / ,Bergmannkiez,2,1 Foto,"Ich kam, ausgehungert und angenervt von den verdammt rutschigen und vereisten Gehwegen, am Sarod's vorbei und dachte mir als Liebhaber thailändischer Küche: Warum nicht? Probierst du es halt mal aus. Also rein in den gemütlichen Gastraum und erstmal drei der fünf Schichten Klamotten auf die Garderobe bugsiert. Die Begrüßung durch die nette - und auch, man verzeihe mir die Anmerkung, sehr hübsche - Bedienung war herzlich, freundlich und sehr zuvorkommend. Ich hatte die Wahl zwischen einem gut aussehenden kleinen Buffet für 6,- EUR, das aus zwei Suppen, Krabbenchips, fleischlosen Mini-Frühlingsrollen sowie jeweils zwei Gerichten für Carnivoren und Vegetarier bestand und der ganz normalen Karte. Auch wenn das Buffet angenehm aussah und gut roch (und für 6,- EUR einem Schnäppchen gleichkam), wollte ich lieber richtig scharf essen und habe mich darum für die Variante a la Carte entschieden. Vorweg nahm ich ein mit Hackfleisch gefülltes Hühnerbein, das mit einem kleinen Kohl-Möhrensalat sowie einem schmackhaft leichten, süßlichen Dip daher kam, der nach Zimt, Ingwer und Sojasauce schmeckte. Für 3,50 EUR kann man dazu nichts sagen, außer vielleicht: Ja, danke, weiter so! Als Hauptgang kam dann eine knusprige Ente an Thai-Gemüse und dem obligatorischen Reis. Besonders angenehm fiel mir die Option auf, jedes Gericht als kleine oder große Portion bestellen zu können. So kann man durchaus eine oder zwei Vorspeisen probieren und danach noch ein Hauptgericht bestellen, ohne sich automatisch zu überfressen oder die Hälfte überlassen zu müssen! Knusprige Ente - das ist für mich ein Maßstab-Gericht, an dem sich die Qualität einer Küche auszeichnen kann. Wird das Federvieh zu schnell gebraten, ist sie zwar außen knusprig, hat aber eine ""dschiddelige"" Schicht aus halbrohem Fett zwischen Knusperhaut und Fleisch. Wird sie hingegen zu lange der Pfanne ausgesetzt, dann wird das Fleisch trocken, nimmt kaum noch Soße auf und schmeckt faserig. Im Sarod's war die Ente aber ein Volltreffer! Haut knusprig, das Fett ins darunter liegende Fleisch geschmolzen, wo es nun zur Zartheit desselbigen beitragen und als Geschmacksträger aktiv werden konnte. Herrlich! Auch die alte Problemstellung: Wie kriege ich es hin, die Ente so zu servieren, dass die Soße nicht gleich alle Knusprigkeit wieder zu Labbrigkeit werden lässt?, wurde hier gut gelöst, indem Gemüse und Soße in einer kleinen Schale gebettet waren, auf der die Ente dann mit sicherer Entfernung zur Feuchtigkeit thronte. Geschmacklich war es ein absolutes Gedicht. Das Gemüse, zu dem auch exotische Thai-Sorten wie Thai-Auberginen, Pfefferschoten (die ich so vorher noch nie gesehen habe und aussahen wie die Pfefferkornvariante eines Bündels Weintrauben), Thai-Basilikum und Thai-Chilis gehörten, war knackig und korrekt gegart. Es harmonierte wunderbar mit der Ente und - was mich als Freund des gesamten Spektrums der Skoville-Skala besonders begeisterte - kam in exakt der Schärfe daher, die ich mir erbeten hatte. Überhaupt schön, dass bei der Bestellung von alleine gefragt wurde, wie scharf man es denn gerne hätte. Service top!Essen top!Gastraum top! Zusammenfassend kann ich nur klare fünf Sterne geben!",5,6.1.2011
25,Sarod’s Thai Restaurant,4.3,43,Thailändisch / ,Bergmannkiez,2,Sven H.,"Mit ""groß"" ist hier auch wirklich ""groß"" gemeint! Trotz der Menge äußerst lecker. Hier geht die Quantität nicht auf Kosten der Qualität. Ambiente und Freundlichkeit überzeugen.",5,14.10.2013
