,Restaurant Name,Overall Rating,Total Reviews,Specialty,Region,Price Range,Author,Comment,Rating,Date
82,Schwarzwaldstuben,4,40,Frühstück & Brunch / Schwäbisch / Badisch / ,Mitte,2,Unknown,"Der Schwarzwald ist im Kommen. Auch an einem gewöhnlichen Wochentag ist es ratsam, einen Tisch zu reservieren, wenn man nicht auf der charmant geführten Warteliste wiederfinden will. Am Tisch direkt an der Tür zieht es übrigens kräftig und beim Flammkuchen mit Blauschimmel und Walnüssen ist auf die Existenz letzterer zu achten. Darüber hinaus ein angenehm entspannter Ort für lange Gespräche und viel Wein oder Bier oder",4,16.2.2007
83,Schwarzwaldstuben,4,40,Frühstück & Brunch / Schwäbisch / Badisch / ,Mitte,2,Unknown,"Die Atmosphäre in den Schwarzwaldstuben ist schön gemütlich. Das Essen war lecker (besonders die Bratkartoffeln waren gelungen), das Bier sowieso. Vier Sterne nur weil ich vom badischen Schäufele ein wenig enttäuscht war, das kann mit dem fränkischen Verwandten leider nicht mithalten.",4,13.1.2009
84,Schwarzwaldstuben,4,40,Frühstück & Brunch / Schwäbisch / Badisch / ,Mitte,2,Unknown,"Ich habe keine Ahnung von Schwaben und deren Lokalpatriotismus, aber hier gehe ich gerne öfters mittags hin, gute Tagesgerichte, nette Bedienung. Abends gibt es sicher interessantere Locations, insgesamt aber empfehlenswert.",4,21.6.2009
85,Schwarzwaldstuben,4,40,Frühstück & Brunch / Schwäbisch / Badisch / ,Mitte,2,Unknown,"Sehr gemütlich, sogar für österreichische Ansprüche.",4,21.9.2011
86,Schwarzwaldstuben,4,40,Frühstück & Brunch / Schwäbisch / Badisch / ,Mitte,2,Unknown,"Ich war einmal mit meinem Freund da und er  als Fleischliebhaber und jemand der gerne viel ist- ist voll auf seine Kosten gekommen! Er hatte das Wiener Schnitzel und war sehr zufrieden, auch meine Maultaschen waren sehr gut. Dazu genossen wir ein paar Bier. Alles in allem hats Spass gemacht, weil die Atmosphäre so traditionell schwäbisch und bodenständig war, genau wie das Essen,war alles stimmig.",5,26.1.2012
