,Restaurant Name,Overall Rating,Total Reviews,Specialty,Region,Price Range,Author,Comment,Rating,Date
111,tulus lotrek,4.5,16,Deutsch / ,Kreuzberg,3,Rene K.,"Eine Offenbarung. Als wir Max Strohe bei kitchen impossible gesehen haben, war der Besuch Pflicht und wir wurden nicht enttäuschst. Witziges Restaurant im urigen Ambiente, netter und authentischer Service. Das Essen spricht für sich und die ausgewählten Weine von einem guten Sommelier",5,2.6.2020
112,tulus lotrek,4.5,16,Deutsch / ,Kreuzberg,3,Anne S.,"Wer neben Walter Momper dinieren möchte, ist hier richtig! könnte ich schreiben. Wer am Südkreuz mal richtig gut essen möchte, auch! Und wer einen Service mag, der jenseits von Steifheit agiert ohne die Kompetenz zu verheimlichen, auch!Das Tulus Lotrek ist ein Ort, an dem Auge, Herz und Gaumen sich wohlfühlen können, so sehr, dass sie gar nicht mehr gehen möchten. Gut, dass der Weinkeller gut gefüllt und die Küche auch für Extrawünsche empfänglich. Reservieren lohnt und auch ggf das Sparschwein vorher zu plündern, denn das Feine hat seinen Preis.",4,25.2.2017
113,tulus lotrek,4.5,16,Deutsch / ,Kreuzberg,3,Ina B.,"Edle Aromen mit vielen geschmacklichen Überraschungen. Kleine feine Hänge. Ganz liebevoller Service. Beispiel: 7-Gänge Menü für 89 €.Ist es noch der absolute Insider Tipp? Voll wars nicht, hätte es aber total verdient.",5,11.9.2016
114,tulus lotrek,4.5,16,Deutsch / ,Kreuzberg,3,Miki K.,"Wunderbare Entdeckung, sehr netter Service, ambitionierter Chef mit Luft nach oben. Gelungenes Wine pairing.Auf jeden fall Empfehlenswert !Freuen uns schon auf den zweiten Besuch !!",4,6.5.2016
115,tulus lotrek,4.5,16,Deutsch / ,Kreuzberg,3,Andreas C. M.,"Noch recht neu in Berlin und schon in aller Munde! Das liegt zur einen Hälfte an Max, dem Koch. Zur anderen Hälfte an Illona, der Gastgeberin. Beides harmoniert sowas von derart gut, dass man nach einem Besuch direkt wieder reservieren möchte. Hier wird gehobene internationale Küche serviert, die sich bewußt nicht in eine bestimmte Ecke manövrieren will: erlaubt ist, was schmeckt.",5,12.5.2016
116,tulus lotrek,4.5,16,Deutsch / ,Kreuzberg,3,Mia M.,"Der pure Wahnsinn. Ich schreib's nicht oft, aber es ist so. Da ich jetzt mit Worten nicht beschreiben kann, wie Essen & die wunderbaren Inhaber so sind, lass es ich und sage einfach: Probiert es selbst.",5,25.9.2016
117,tulus lotrek,4.5,16,Deutsch / ,Kreuzberg,3,Press Member X.,"SOMETHING SPECIAL! Hier ist alles besonders: von der Schreibweise des Namenspatrons des schoen gestalteten Lokals bis hin zum Kellner, der charismatisch (aber auch ein wenig Oberstudienrätisch) durch das köstliche 5 Gänge Menue fuehrt. Nehmen Sie 5 Gänge - das reicht (7 ist nur was für Reiner Calmund und Co.) Die Weine sind fair ausgepreist und der ganze Abend war geprägt durch sehr viel Liebe zum Detail. Z.B. dass der Service stets auch (sei es durch Kleid oder Schürze) die Dschungel-Optik der handgemalten Restaurant-Tapete zum Gast trägt. Oder das keck getextete Intro zum Menue. Soviel Raffinesse und Kulinarik in Bestform, das gab's schon länger nicht mehr bei einer Berliner Gastro-Neueröffnung!",5,26.2.2016
118,tulus lotrek,4.5,16,Deutsch / ,Kreuzberg,3,Robert N.,"Gemütlich und liebevoll gestaltetes Restaurant in der Nähe vom Südstern. Man nimmt in einem der beiden Speiseräumen an Holztischen Platz umgeben von der Dschungel-Tapete mit versteckten Leckereien und schönem Deckenstuck. Die Karte bietet neben einem Menü auch Speisen a'la carte. Die Gerichte fokussieren sich auf wenige Hauptzutaten die in der Kombination sensationell harmonieren. Eine Offenbarung war zum Beispiel die Wildente mit Radicchio und Hibiskus, aber auch die nicht zu süße Kombination aus Matcha-Tee mit Honig. Auffallend ist der erfrischende Verzicht auf Tupfer- und Texturen-Überschwall. Statt dessen wird viel mehr Fokus auf die Produkte, deren Harmonie, sowie punktgenaue stimmige Würzung und präzise zubereitete Soßen gelegt. Schöne Weinauswahl, auch wunderbar passend zu den jeweiligen Gängen. Gelungen war auch der Begrüßungstrunk mit hausgemachtem Sirup. Herzliche Bedienung.",5,21.11.2015
119,Zur Haxe,4.5,81,Deutsch / ,Prenzlauer Berg,2,Pablo E.,Lecker bayrisches Essen in gemütlicher Atmosphäre. Der Service ist sehr bemüht und das Essen schmeckt. Sie haben das leckere König Ludwig Bier.Testest es selber mal...,5,14.6.2018
120,Zur Haxe,4.5,81,Deutsch / ,Prenzlauer Berg,2,Dominik K.,"Bayrische Küche in Berlin - geht! Als ""Bayer"" kann ich sagen es passt! Essen bayrisch gut, Ambiente angemessen.Einen Besuch wert",4,21.9.2017
121,Zur Haxe,4.5,81,Deutsch / ,Prenzlauer Berg,2,Alex K.,"An einem Sonntagmittag hat es uns, da wir nach langer Zeit mal wieder Lust auf etwas typisch deftig Bayerisches hatten, zur Haxe verschlagen.Leider etwas abseits der öffentlichen Nahverkehrsanbindungen gelegen, überzeugte das Restaurant durch freundlichen und schnellen Service (auch wenn man den Humor des Kellners nicht teilen muss).Wir hatten zwei Weißbier, die Haxe mit Knödeln und den Leberkäse. Alles war sehr lecker und preislich völlig angemessen. Wiederkehrgarantie.",5,17.9.2017
122,Zur Haxe,4.5,81,Deutsch / ,Prenzlauer Berg,2,Morlin S.,"Wir hatten uns vorgenommen an unserem letzten Tag in Berlin ein Schnitzel zu gönnen, und haben deshalb auf Yelp nach einem gutem Deutschen Restaurant gesucht. Fündig sind wir geworden. Wir kamen um ca 16:15 an einem Sonntag vorbei, und alle Tische waren für diesen Abend reserviert. Die Bedienung (im Dirndl natürlich) hat für uns netterweise einen Tisch gedeckt der für 17:30 bestellt war. Wir bestellten 2x Schnitzel mit Bratkartoffeln und 1x Leberkäse. Das essen war lecker, kam einigermassen schnell und war heiss. Die Mahlzeit war perfekt für einen ruhigen Sonntag und hat geschmeckt wie bei Oma zuhause. Riesige Portion inklusive. Schwarze Johannisbeere mit Vodka kam mit der Rechnung.Bis nächstes mal :-)",5,31.10.2016
123,Zur Haxe,4.5,81,Deutsch / ,Prenzlauer Berg,2,Cynthia T.,"Leider leider kann ich nur 3 Sterne geben, aber ich hoffe, dass bei einem eventuellen neuen Besuch die Fehler nicht mehr gemacht werden. Wir hatten an einem Samstagabend für einen Geburtstag einen Tisch reserviert. Das Restaurant war bis zum letzten Tisch belegt. Wir mussten etwas warten bis wir die Speisekarten bekamen und wurden begrüßt mit den Worten: ""Sie sehen ja was hier los ist"". Ist ja schön und gut, dass die Kellner im Stress waren, aber der Gast sollte davon so wenig wie möglich mitbekommen. Auf dem Tisch lagen Bonbons, um das Geburtstagsmotto etwas aufzugreifen. Fand ich noch ganz nett.Nach der Bestellung kamen die Getränke nacheinander, da die Kellnerin kein Tablette benutze, was ich wieder nicht so gut fand. Das Essen kam dann auch sehr schnell und hat sehr gut geschmeckt.Leider haperte es anschließend am Abräumen der Teller sowie leeren Gläser und ein Dessert wurde uns auch nicht angeboten. Die leeren Nachbartische standen erstmal dreckig rum und wurden erst nach einer Weile wieder sauber gemacht. Mein Freund kam erst später zum Tisch, wo wir schon gegessen haben und wurde von der Bedienung komplett ignoriert. Er musste sich die Speisekarte nach einer Weile selbst holen. Als wir dann auf Eigeninitiative uns die Karten fürs Dessert holen und bestellt haben, war ich von meiner ""Eisüberraschung"" enttäuscht. Zwei Kugeln Vanilleeis mit Sahne und einer billigen Gummibärchenpackung an der Seite. Da war ich wirklich enttäuscht. Zur Bezahlung gab es für die Biertrinker einen Likör und für alle anderen wieder diese billigen Gummibärchenpackungen. Muss das denn sein? Was sollen diese Gummibärchen? Ich finde das schrecklich. Kann man nicht noch ein kurzes alkoholfreies Getränk anbieten (z.B. Kiba in einem Likörbecher). Das Personal war zwar nett, aber sehr gestresst, was sich negativ auf die Atmosphäre übertrug.Fazit: Die Hauptspeisen sind Klasse und kamen auch sehr schnell. Der Service ist stark ausbaufähig und die Sache mit den ständigen Gummibärchen sollte überdacht werden.",3,18.10.2015
124,Zur Haxe,4.5,81,Deutsch / ,Prenzlauer Berg,2,Lin L.,Ein sehr schöner rustikaler Laden. Das Essen hier ist immer sehr sehr lecker und und reichhaltig. Das Personal ist sehr lieb und zuvorkommend. Ich fühle mich hier immer sehr wohl und komme immer wieder gern,5,17.12.2015
125,Zur Haxe,4.5,81,Deutsch / ,Prenzlauer Berg,2,Hilde H.,"UPDATE: Hier noch eine Homepage (zurhaxe-berlin.de) nachgereicht. Berliner Küche meets Bayern and Kitsch. Originelle Kombi, auf der Durchfahrt dieses Lokal gefunden. Jede Menge gute Bewertungen. In dieser Pregnancy Hill Lage zwischen all den Bierschwemmen eine Ausnahme. Sogar einen Riesling vom Wegeler gab es. Ich staune- zu moderatem Berliner Weinpreis. Die weibliche Bedienung im Dirndl, die männliche ( Chef?) in der Lederhose. Gepaart mit absolut kitschigen Details wie Kunstblumen, Lampions, kleiner Pröttel, Plüschtieren und bayr. Mobiliar. Das Lokal voll bis zum Anschlag- aber ein Plätzchen fand sich noch. Das Essen -nichts spektakuläres. Die Teller, die wir sahen, waren ordentlich gefüllt und es schmeckte wohl auch. Wir hatten nur etwas für den kleinen Hunger und das war ok. Der Hauptfokus liegt wohl auf den vielen Haxenvarianten. Ich gebe gerne für den freundlichen Service, den guten Wein, Preis/Leistung und das irgendwie gemütliche Ambiente 4Sternchen",4,20.6.2012
126,Zur Haxe,4.5,81,Deutsch / ,Prenzlauer Berg,2,Andreas W.,"Für FleischLiebhaber ein Must: Haxen in allerbester leckerster Qualität- reichlich und dabei preiswert. Über das bayerische Ambiente und die im Hintergrund trötende bayerische Volksmusik muss man hinwegsehen- die witzige, kompetente und stets aufmerksame Bedienung lässt einen das vergessen. Da der Geheimtip nun auch den Weg in die Medien gefunden hat ist er so geheim nicht mehr- reservieren also empfohlen.",4,17.10.2016
127,Zur Haxe,4.5,81,Deutsch / ,Prenzlauer Berg,2,Mel C.,Definitiv 5 Sterne war total toll der Besuch hier essen war mega ich bin da eher immer was mekelig aber hier total leggaaaa,5,14.10.2015
128,Zur Haxe,4.5,81,Deutsch / ,Prenzlauer Berg,2,Georg B.,"Die Haxe bietet gute deutsche Küche in entsprechendem Ambiente. Die Bedienung ist in Ordnung, deren Humor vielleicht nicht jedermanns Sache. Das Essen ist sehr lecker und qualitativ sehr gut. Wir kommen gerne wieder.",4,24.2.2016
129,Zur Haxe,4.5,81,Deutsch / ,Prenzlauer Berg,2,Jean Claude P.,"Was für ein abgefahrener Laden in Zeiten der Style Kultur. Hier ist eher das Ur-Prenzlauer Berg zu finden, garantiert keine Kinderwagen- Demos ;). Wenn man schon seit Jahren koin Haxn mehr gefratzt hat und einem dann so ein gutes Essen von einem noch mehr abgefahrenen Kellner serviert wird, sage ich bis gleich. Alles wurde schnell serviert und beliebt ist der Laden sichtlich. Gegen 18:00 versammelten sich kleine Gruppen von reiferen Damen zwischen 35 ind 60. Der Kellner und seine Haxn haben auf jeden Fall eine charmante Fangemeinde. Der arme Kerl traut sich bestimmt abends nicht allein auf die Strasse, daher wird die Lust gekonnt mit einem Ratzeputz aufs Haus gebändigt. Ansonsten ist das Restaurant gemütlich, wenn auch schlicht, eingerichtet. Alles ist sehr gepflegt.Eine starke Empfehlung !!",5,8.11.2011
130,Zur Haxe,4.5,81,Deutsch / ,Prenzlauer Berg,2,Andreas B.,"Sehr gute bayrische Küche und Haxen, die einen Jeden zum Schwärmen bringen können. Riesen Portionen, die einen auch wirklich satt werden lassen. Dazu eine sehr freundliche Bedienung in Trachten. Ich habe den Laden schon sehr oft besucht. Als Paar und auch zu größeren Feiern. Für Letzteres bietet sich ein Extraraum an. Gutes Bier zum Essen und der Abend ist perfekt. Absolut empfehlenswert !",5,2.12.2009
131,Zur Haxe,4.5,81,Deutsch / ,Prenzlauer Berg,2,Harald P.,"Mal was anderes ist das Ambiente, das Personal und die Speisenauswahl.Wir waren mit 8 Personen in der Woche hier und wurden wir schon mal nett begrüßt. Die bestellten Getränke wurden recht flott und freundlich serviert. Jeder bestellte ein anderes Gericht. Ich hatte die Eisbeinsülze mit Remoulade mit Bratkartoffeln. Sülze, Eisbein und Remoulade waren sehr gut. Aber auch die Grillpfanne, das Schnitzel, die Leber, das Omlett mit Pfifferlingen und das Schäufele waren alle gut.Alle Speisen wurden fast gleichzeitig serviert. Die Qualität und die Portionsgröße fanden wir alle gut. Zwischendurch wurde sich recht unaufdringlich nach unserer Zufriedenheit erkundigt. Waren wir!Zum Schluss gab es als kleinen Absacker für alle noch einen Johannisbeerschnaps.Hier merkt man, dass die Servicekräfte mit Spaß bei der Arbeit sind.Wir waren zufrieden. Danke.",5,30.8.2012
132,Zur Haxe,4.5,81,Deutsch / ,Prenzlauer Berg,2,Florian U.,"Ich war ja nie ein großer Haxenfan, aber die Schinkenhaxe hier hat mich so begeistert, dass ich immer gern mal wieder komme. Das Personal ist super und lebt das urige Flair des Ladens auch glaubhaft, so dass man sich mitten in Berlin plötzlich wie in einer zünftigen bayrischen Wirtschaft fühlt. Einziges Manko: Ich überfresse mich in der ""Haxe"" immer sehr. Da gibt's allerdings mit ""Ratzeputz"" entsprechend Abhilfe. Aber Vorsicht: der Name ist Programm.",5,14.9.2015
133,Zur Haxe,4.5,81,Deutsch / ,Prenzlauer Berg,2,Remo S.,"War mit einem guten Freund bei Zur Haxe, da wir mal wieder richtig Lust auf deftige, deutsche Küche hatten:Meine Meinung:Schinkenhaxe, eine absolute 1+Bier, (König Ludwig Hell) sehr gut, sehr süffig.Knödel, absolut eklig. Erinnerten optisch an diese in Scheiben geschnittenen böhmischen Knödel. Leider nur optisch, geschmacklich erinnerten sie an alte, total fettige Brotscheiben, wirklich nicht essbarSauerkraut, anders als gewohnt, aber nicht schlechtPersonal, etwas aufdringlich und verbrüdernt",3,22.8.2011
134,Zur Haxe,4.5,81,Deutsch / ,Prenzlauer Berg,2,Harald P.,"Wir haben natürlich im Restaurant ""Zur Haxe"" Haxe gegessen. Die Megaportionen waren köstlich und die Krusten so wie sie sein sollten - sehr knusprig, knackig, einfach lecker.Aber erst einmal zum Anfang:Am Dienstag nach Ostern suchten wir ein Lokal, wo wir unseren Hund mitnehmen durften. Mehrere andere Lokale hatten geschlossen oder Hunde waren nicht erlaubt. In der ""Zur Haxe"" war das überhaupt kein Problem. Das Lokal war so gut wie ausgebucht - wir hatten keinen Tisch vorbestellt, weil wir glaubten, dass das einen Tag nach Ostern nicht notwendig sei - aber der sehr freundliche Wirt disponierte hin und her, diskutierte mit seiner Bedienung, griff zu einem Hundenapf, füllte ihn mit Wasser und brachte uns zu einem noch freien Ecktisch, wo wir sehr gut saßen und auch unser Hund sich gut platzieren konnten.Das Lokal ist urig bayrische eingerichtet und Wirt und Bedienung zeigen sich in uriger Tracht.So fröhlich und kundenorientiert wie der Wirt, war auch die Bedienung (oder Wirtsfrau?). Mit Humor wurden wir aufmerksam aber nicht aufdringlich bedient.Wir hatten einen genußvollen Abend und möchten uns auf diesem Wege ganz ausdrücklich bei den Wirtsleuten bedanken.Das wir das Lokal nur empfehlen können, bräuchten wir eigentlich nicht noch extra erwähnen, soll aber am Ende des Berichtes nicht fehlen.",5,31.3.2016
135,Zur Haxe,4.5,81,Deutsch / ,Prenzlauer Berg,2,Mike H.,"Sehr nett und freundliches geführtes Restaurant. Wir kommen regelmäßig hier her, um das gute Essen und die Atmosphäre zu genießen. Die Karte bietet gut bürgerliche deutsche Küche garniert mit leckeren Bayrischen Spezialitäten (Tip: unbedingt den Obatzta und den Pfannkuchen mit Blaubeeren versuchen).",5,21.3.2010
136,Zur Haxe,4.5,81,Deutsch / ,Prenzlauer Berg,2,Enrico D.,"Gut bürgerliche Küche trifft auf zuvorkommendes Personal. Wir haben uns für die Gaststätte ""Zur Haxe"" entschieden um seit langem mal wieder die deutsche Küche zu genießen. Es hätten auch 5 Sterne werden können, doch leider wurden wir am Eingang nicht in Empfang genommen und  nur von weitem kurz begrüßt, obwohl wir ""fast"" die einzigen waren. Das ist aber auch schon das einzige was uns nicht gefallen hat. Das Essen wurde sehr liebevoll zubereitet. Es war heiß und war gut gewürzt. Die Getränke wurde schnell serviert und der Service war sehr gut und freundlich. Wir werden wieder ""Zur Haxe"" gehen!! Macht weiter so!",4,11.2.2014
137,Zur Haxe,4.5,81,Deutsch / ,Prenzlauer Berg,2,Florian P.,"Meine letzte Rettung auf Empfehlungen,eine Orginal Bayrische Küche verköstigen zu können trieb mich hierher. Wir saßen draussen und alles ging recht flott. Der Servicemann, eine absolute Institution für dieses Restaurant, der seinen Job versteht, höflich, witzig, aufmerksam ist und vorallem optisch noch in diese Konzept passt, Bestellt haben ich das Schäufele, das mit Kraut und Kartoffelknödel auf sich wartete. Mein Begleiter ordete die Schinkenhaxe. Schäufele das ursprünglich aus Franken stammt, ist ein Schaufelbraten aus der Schulter, den ich den Schweinebraten bevorzuge da er am Knochen zubereitet wird und mehr Geschmack hervorbringt. Ehrlich gesagt hätte das Fleisch ein bisschen saftiger sein können, jedoch war dieses sehr schmackhaft, das Kraut Super, und die Knödel auch lecker. Die Soße auch sehr  gut nur nicht Original, wie auch in anderen Bayrischen Restaurants in Berlin zu sehr abgebunden, Leider ! Die Schinkenhaxe meine Freundes schaute perfekt aus mit toller Kruste. Satt wird man definitiv und der Preis stimmt auch. Alles in allem gehört dieses Restaurant zu den Top 3 Bayrischen in Berlin, komme natürlich wieder wenn ich ma wieder Heimweh habe = )",4,6.8.2015
138,Zur Haxe,4.5,81,Deutsch / ,Prenzlauer Berg,2,Unknown,"Wir haben uns sehr wohl gefühlt. Klar es ist bayrisch, kitschig dekoriert, aber was solls. Vorher war dort ein Grieche drin. (Deshalb vorne das Wandbild.)Aber wir sind ja zum Essen hingegangen. Und es war sauber und ordentlich, auch die Toiletten!Die Bedienung war sehr aufmerksam, freundlich und immer ansprechbar. (Ja , der Bayer ist ein Original.)Das Essen kam nach nicht zu langer Wartezeit. Hat sehr gut geschmeckt. War alles frisch zubereitet. Die Schinkenhaxe war sehr mächtig, kaum zu schaffen. Kann man aber sich auch zum mitnehmen einpacken lassen. Alles kein Problem. Super.Wir können die Lokation nur empfehlen.Freuen uns schon auf unser Weihnachtsessen.Weiter so.",5,5.12.2009
139,Zur Haxe,4.5,81,Deutsch / ,Prenzlauer Berg,2,Unknown,"Ich bin ein Freund guten Essens und Trinkens. Das Ganze im Rahmen einer gemütlichen Atmosphäre und einer flotten aufmerksamen Bedienung.Das Preis-Leistungs-Verhältnis sollte auch stimmen.Das Alles finde ich im Lokal Zur HaxeMit ein paar Freunden war ich schon mehrmals dort. Aktuell wieder am 10.10.2011. Ich habe mir ein Eisbein geleistet, das mustergültig war mit Erbspuree und Kraut. Von der Größe her hätte es locker für 2 Personen gereicht. Das Essen kam flott und dampfend auf den Tisch, begleitet von Wodka und Bier (beide Getränke gepflegt).Die Bedienung dem bayerischen Ambiente angepasst, modisch im tollen Dirndl.Wenn man draußen noch die Berge sehen würde, glaubte man in Bayern zu sein, so die ganze reizvolle Innenausstattung.Für den November habe ich mich schon zur Martinsgans angemeldet.Ich kann die Gaststätte 100%ig empfehlen.",5,26.10.2011
140,Zur Haxe,4.5,81,Deutsch / ,Prenzlauer Berg,2,Unknown,"Endlich mal wieder Haxe essen. Das war das Ziel, der Weg war einfach und ich kann nur sagen, Ziel erreicht...Super freundlicher Service, etwas gestresst, aber hat sich sehr bemüht dies zu verbergen. Wirklich lecker Essen, riesige Portionen. Sehr gut. Die Haxen super gegart nur leider war die Soße und auch das Erbspüre nicht ganz selbst gemacht. Die Knödel waren wohl selbstgemacht, hätten aber etwas Salz vertragen können. Insgesamt sehr lecker, wir kommen bestimmt wieder.",4,13.1.2010
141,Zur Haxe,4.5,81,Deutsch / ,Prenzlauer Berg,2,Sabrina B.,"Ich bin vor vier Jahren nach Berlin gezogen. Was ich damals schon wie heute immer doof fand, war dahin zu rennen, wo alle hinrennen, außerdem wird jeden Tag Margaux und Borchardt ja auch mal schnell langweilig, ne? Mein Plan ist daher, auch mal dorthin zu gehen, wo man eigentlich nicht so schnell hingehen würde oder sogar eher einen großen Bogen darum macht, wie zum Beispiel eine Hell's Angels Kneipe. Oder eben eine bayrisch-rustikal anmutende Berliner Gaststube mit dem Namen: Zur Haxe. Es war gleich große Liebe auf den ersten Blick zwischen der Haxe und uns (also meinem Ex und mir, da war die Liebe allerdings vergleichsweise schmal)  und ich kann fast sagen, dass diese Abende, an denen wir genussvoll schmatzend über einer knusprigen RIESIGEN halben Ente saßen, zu unseren heimeligsten zählten. In der Haxe isst man eben wie zuhause. Wirt und Wirtin, sind so charmant und aufmerksam, dass ich ihnen die teilweise etwas überladene Dekoration (und ihrer selber: Tracht Galore) des Ladens verzeihe. Ist auch klar, dass die zwei nicht aus Bayern oder Ösiland kommen - aber der Koch wohl schon, wurde mir damals gesagt. Ansonsten geht's in der Speisekarte zünftig auf und nieder: Schweinshaxen, Eisbein, Wiener Schnitzel und und und. Alles zu superfairen Preisen und echt lecker. Außerdem muss man sich endlich mal nicht mit Klickerklacker Musik die Ohren beim Essen verkleben lassen. Das kann man ja dann noch danach erledigen.",4,12.2.2011
142,Zur Haxe,4.5,81,Deutsch / ,Prenzlauer Berg,2,Mrs T.,"Ganz lecker. Allerdings mag ich die Einrichtung nicht so, gut es soll das typisch bürgerliche darstellen aber wenn mir ein Teddybär ins Essen fällt, finde ich es nicht mehr lustig! Aber es hat gut geschmeckt und war sauber.",4,21.3.2013
143,Zur Haxe,4.5,81,Deutsch / ,Prenzlauer Berg,2,Frank W.,"Wir waren letzten Sonntag auf Empfehlung eines Freundes, in der Haxe und müssen sagen, wir wurden nicht enttäuscht und kommen auf jeden Fall wieder.Wer mal ordentlich bayrisch bzw. herzhaft  zu einem guten Preis essen möchte, der ist hier genau richtig.Wir hatten eine Biersuppe mit Rosinen, mal ganz was anderes und super lecker,ein Schnitzel ""Hamburger Art"", mit perfekten Bratkartoffeln und einen Grillteller ""Zur Haxe"", mit sehr leckeren Bohnen und reichlich auf dem Teller.Der Kellner war richtig gut drauf und  immer für ein Scherzchen zu haben.Beim nächsten Mal werden wir definitiv die Haxen probieren, bis dann.",5,29.11.2013
144,Zur Haxe,4.5,81,Deutsch / ,Prenzlauer Berg,2,Miriam M.,Ein tolles deutsches Restaurant. Das Personal ist sehr freundlich und das Essen schmeckt gut. Preis Leistung stimmt hier völlig überein,5,9.2.2014
145,Zur Haxe,4.5,81,Deutsch / ,Prenzlauer Berg,2,Chris D.,"Sehr gemütliches bayrisches Restaurant mit Liebe zum Detail. Das Personal ist sehr nett und zuvorkommend!  Das Essen schmeckt ausgezeichent, große Portionen zu fairen Preisen! Wer also mal richtige, gute, deftige deutsche Küche genießen will, sollte dort mal speisen!",5,27.1.2013
146,Zur Haxe,4.5,81,Deutsch / ,Prenzlauer Berg,2,Michael A.,Absolut zu empfehlen! Uriges Ambiente und lecker! Echter Tip!,5,23.10.2012
147,Zur Haxe,4.5,81,Deutsch / ,Prenzlauer Berg,2,Unknown,"Preislich und gastronomisch ganz okay. Sehr gemüthlich - verkitscht, an guten Tagen ein sehr witziges Personal und immer nett und freundlich.",4,17.6.2009
148,Zur Haxe,4.5,81,Deutsch / ,Prenzlauer Berg,2,1 Foto,"ich muss mich da anschliessen.ich bin regelmäßig, eigentlich jede woche, in der haxe zu gast und esse immer eine käsesuppe vorwegsowas leckeres gibt`s nicht nochmal!!!der äusserst freundliche kellner (glatze und bart) hat mir auch mal die schinkenhaxe empfohlen und seitdem esse ich sie mindestens einmal die woche!super lecker!an so warmen tagen wie zur zeit kann man auch den obatzer echt empfehlen,schmeckt auch einfach nur gut!",5,2.6.2008
