,Restaurant Name,Overall Rating,Total Reviews,Specialty,Region,Price Range,Author,Comment,Rating,Date
0,Zollpackhof,3.5,122,Deutsch / Biergarten / ,Tiergarten,2,Steve E.,"Heute sollte es mit einer größeren Gruppe zum Zollpackhof gehen. Gemütlich ein paar Bier zischen und sich die Wampe mit feinen Speisen füllen. Bei unserer Ankunft wurden wir sehr freundlich begrüßt und konnten umgehend Getränke bestellen. Nach dem studieren der Speisekarte konnte auch rasch Verpflegung geordert werden. Das Essen kam nach einer angemessenen Wartezeit an den Tisch, alle Gerichte waren heiss und recht hübsch angerichtet. Geschmacklich gab es hier absolut nichts zu beanstanden. Schade das das Teller ablecken gesellschaftlich nicht so anerkannt ist, sonst hätte ich...  Lassen wir das. Zum Ambiente möchte ich mich durchweg positiv äußern. Es gibt echt einiges zu sehen. Ich finde das Lokal geschmackvoll und stilecht eingerichtet. Im Großen und Ganzen ist das hier schon etwas gehobene Klasse. Leider ist es meist recht voll und somit auch sehr laut und daher auch etwas ungemütlich. Aussicht ist auch vorhanden aber naja ist halt Berlin wa...Nun wollen wir aber mal Abrechnen:Lokation:                           Aussicht:                            Bedienung:                        Freundlichkeit / Service:  Geschmack:                       Preis / Leistung:                Fazit: Kann man und sollte man sich ruhig mal gönnen...",5,4.9.2021
1,Zollpackhof,3.5,122,Deutsch / Biergarten / ,Tiergarten,2,Thomas M.,"Riesiger Biergarten, Augustiner vom Fass, bayrische Gemütlichkeit trifft auf Berliner Schnoddrigkeit (""Karte geht jetzt nicht mehr, und jetzt komm mir nicht mit nem 200€-Schein!"").Die Aussicht ist super, passend zur Lage treibt sich wohl der halbe Politikbetrieb hier rum, gefühlt ergänzt und viele PR-Berater. Eine Blaskapelle spielt dazu, lustigerweise ABBA und Adele. Drumrum wuselt das Personal, also der Teil, der fürs Abräumen zuständig ist.An der Theke sieht es anders aus, wer nicht kapiert, dass es zwei Schlangen gibt ganz nach bayrischem Vorbild (Essen+Trinken vs nur Trinken) steht endlos.Der Preis fürs Warten war in unserem Fall leicht schales Bier vom Fass, in der zweiten Runde kredenzt in einem Glas, an dem noch Lippenstift war.Überlege ich mir nochmal, ob ich wiederkomme. Ich glaube, Berlin hat angenehmere Plätze zum draußen sitzen.",3,13.5.2022
2,Zollpackhof,3.5,122,Deutsch / Biergarten / ,Tiergarten,2,Sven Q.,"Es ist warm, nein es ist heiß draußen. Was kann es da besseres geben, als ein schönes kaltes Bier? Dazu Brezeln oder eine gegrillte Schweinehaxen? *yummy*All das kann man hier bekommen. Das Bier ist lecker, die Speisen deftig und die Aussicht auf die Spree super. Einzig das Personal könnte enthusiastischer sein.",4,31.8.2019
3,Zollpackhof,3.5,122,Deutsch / Biergarten / ,Tiergarten,2,Eva S.,"Super leckere Currywurst mit knusprigen Pommes, mehr als ordentliche Portionsgröße und ein sehr freundliches und zuvorkommendes Team. Die Aufnahme der Bestellung hat etwas gedauert, allerdings saß ich alleine und etwas abseits. Der nette Herr vom Service hat sich mehrmals für die Wartezeit (Max. 10 min) entschuldigt und danach ging alles sehr flott. Preise sind mehr als in Ordnung, absolut angemessen für das, was man bekommt.",5,3.8.2020
4,Zollpackhof,3.5,122,Deutsch / Biergarten / ,Tiergarten,2,Theres B.,"Gute bodenständige Küche auf hohem Niveau, nahezu wie in südlicheren Gasthäusern (Bayern, Österreich). Gutes Schnitzel wo die Panade passt, ist in Berlin nicht oft zu finden! Klare Empfehlung! Speisen groß, Preis Leistung gut! Personal freundlich und schnell. Location total nett zum Verweilen",5,26.7.2020
5,Zollpackhof,3.5,122,Deutsch / Biergarten / ,Tiergarten,2,Oktay D.,Langsamste Bewirtung die ich je erlebt habe. Das Ganze wird durch unmotivierte Mitarbeiter dekoriert.Schade!,1,26.10.2019
6,Zollpackhof,3.5,122,Deutsch / Biergarten / ,Tiergarten,2,Paul P.,"Ich wusste, dass wir in einer größeren Gruppe hier sein werden und schaute mir zuvor die Karte online an. Ein Schnitzel sollte es werden und natürlich ein leckeres Bier. Als wir ankamen, musste man feststellen, dass viele Bänke mit dem Müll der früheren Gäste belegt waren. Wie appetitlich! Es dauerte ganze 15 Minuten bis man den Müll entfernte. Ich wollte nun mein Schnitzel haben und ging dafür in den Betrieb. Dort sagte man mir, dass man das Schnitzel nur auf der Terrasse servieren könne. Gut und schön, diese war doch belegt. Angeblich sei dies auch nur mit Reservierung möglich. Konsequenz: Schnitzel gibt es nur mit einem Platz auf der Terrasse, einen Platz auf der Terrasse nur mit Reservierung. Ich meinte, dass ich auch warten könne, doch das wollte man nicht. Zu diesem Zeitpunkt war das Restaurant innen komplett leer und es hätte nichts bedeutet, dass ich dort gesessen hätte und vielleicht 15-20 Minuten auf mein Schnitzel gewartet hätte. Das Schnitzel blieb also offensichtlich nur der Premium-Economy vorbehalten. Also jener feinen Gesellschaft, die hier einen Platz im voraus reserviert hatte. Wenn ich zuvor reservieren muss, um ein Schnitzel zu essen, dann kann ich gleich in bessere Läden gehen, wo ich weiß, dass das Schnitzel für 15,90 Euro auch gut schmecken wird.Derweil ist dies eine klare Täuschung des Kunden, denn immerhin steht nicht auf der Seite, dass man Plätze reservieren muss, um ein Schnitzel zu bestellen. Es wäre also zu begrüßen, wenn ein Wettbewerber diese ""Laden"" mal endlich abmahnt. In der Tourist-Class, dem sogenannten Biergarten oder besser gesagt ""Die Müllterme"" war eigene Bedienung angesagt. Langes Anstehen für eine ekelhafte Wurst mit Budenpommes zu überteuerten Preisen (Bratwurt mit Pommes zu 5,40, Currywurst mit Pommes zu 5,90). Dazu Getränke, die so schnell aufgefüllt wurden, dass sie überliefen und man selbst nasse Finger bekam. Wenn der Laden ein Abfertigungsproblem hat, dann soll er eben mehr Personal einstellen. Abräumen am Ende der Bewirtschaftung? Nein, nicht ansatzweise. Einige Schüler waren damit zwar beschäftigt, kamen jedoch nicht hinterher. Positiv:(+) Die Location liegt ganz gut(+) halbwegs saubere Toiletten mit Geldeintreiber(in) vor der Tür Negativ:(-) Täuschung der Kunden. Schnitzel gibt es nur bei Platzreservierung in der Premium-Economy (Terrasse) (-) Schlechte Selbstbedienung mit absoluten Chaos(-) Vermüllte Tische(-) Kinderfreundlich (Spielplatz am Rande der ""Müllterme"")(-) Personal ist nicht in der Lage, ein Bier ordentlich zu füllenTIPP: Meiden, der Laden ist unseriös!",1,15.6.2017
7,Zollpackhof,3.5,122,Deutsch / Biergarten / ,Tiergarten,2,Reiner H.,Ich habe eine super Grillhackse vertilgt. Ein spitzen Restaurant was durch aus empfehlenswert ist. Ob Leberkes oder Schnitzel mit Pfefferlingen oder einleckeres Bier im Garten alles ist super.,4,25.8.2019
8,Zollpackhof,3.5,122,Deutsch / Biergarten / ,Tiergarten,2,Bri B.,"Hier stimmt die Atmosphäre im Sommer im großen Biergarten mit Selbstbedienung oder im Winter im Restaurant oder Kellergewölbe. Wenn man sich nicht an manchmal lauten Touristengruppen stört, kann man hier einen schönen Abend verleben. Alles was in ein bayrisches Lokal gehört, schmeckt hier gut. Kleinigkeiten wie Radi mit Obatzter zünftig auf Holzbrett serviert oder Weißwurst mit frischer Brezel. Münchner Schnitzel mit Senfpanade lecker. Jederzeit weiter zu empfehlen",5,29.10.2017
9,Zollpackhof,3.5,122,Deutsch / Biergarten / ,Tiergarten,2,Joe G.,"Es ist einfach super, bei gutem Wetter unter der riesigen Kastanie zu sitzen.Alles perfekt!Einziger Wermutstropfen: Das Anstehen. Hier würde ich mir wünschen, dass bei gutem Wetter vielleicht auch etwas mehr Personal geplant wird...",4,27.7.2016
10,Zollpackhof,3.5,122,Deutsch / Biergarten / ,Tiergarten,2,Hilde H.,"Netter SB Biergarten gegenüber des Bundeskanzleramtes. Heute wurde hier gegrillt, ob das immer ist, weiss ich nicht.Draussen die Ankündigung von Umbaumassnahmen, vermutlich das Gebäude betreffend. Der Biergarten liegt oberhalb der Spree und so kann man auch Schiffchen vorbeifahren sehen. Der Yelppfeil sitzt leider auf der falschen Spreeseite. Der Blick auf das Kanzleramt auch ""die Waschmaschine"" genannt und derzeit regiert hier Angela Merkel, wenn sie denn da ist. Also der Blick ist schön. Getränkepreise  für Berliner Verhältnisse für das einfache, aber nette Ambiente unter Kastanien und Linden an der Grenze. Das gegrillte geht mit 3 Sternchen durch. Das Personal mit den roten TShirts und dem Aufdruck MdB sind nicht etwa ""Mitglieder des Bundestages"", sondern ""Mitarbeiter des Biergartens"". Und schon kommt wieder ein Schiff vorbei :-)Guter 3Sterne Kandidat. Kann mehr werden",3,15.6.2014
11,Zollpackhof,3.5,122,Deutsch / Biergarten / ,Tiergarten,2,Boris S.,Unglaublich was hier Berlin zu bieten hat! Eine perfekte Lokation mit netten Personal! Das Bier einfach hervorragend und das Essen nicht nur gut sondern spitze! Ich ziehe nur einen Stern ab weil 5 Sterne meistens eher negativ gewertet werden! Die ferne bayrische Konkurrenz braucht man hier nicht zu fürchten! Ein echter berlin-bayrischer Geheimtipp! Hier möchte ich mich namentlich bei Alexandra bedanken für eine hervorragende  Bedingungen! Weiter so!,4,11.8.2016
12,Zollpackhof,3.5,122,Deutsch / Biergarten / ,Tiergarten,2,Detlef D.,"Im Sommer für mich einer der schönsten Berliner Biergärten! Romantisch unter ein großen Kastanie, gegenüber vom Kanzleramt, direkt an der Spree...parken in der Nähe problematisch, aber fussläufig zum Hauptbahnhof...",5,22.10.2016
13,Zollpackhof,3.5,122,Deutsch / Biergarten / ,Tiergarten,2,Rob V.,"Ich möchte erstens loswerden, dass ich viele Jahre in Sternelokale in der Schweiz sowohl im Service als auch in der Küche gearbeitet habe und mich sowohl mit Preiskalkulation und Qualitätsbeurteilung von Lebensmitteln auskenne.Zweitens weiß ich daß bei vielen Deutsche (ich bin Niederländer) das Credo ""Geiz ist (unheimlich) GEIL!!!"" zur Lebenseinstellung und schon zum Mantra geworden ist. Hauptsache billig, aber bitte nur premium Qualität...Mein Mann ludt Heute Abend zum Essen und hatte dieses Restaurant ausgesucht, weil wir und die andere Gäste gerne quer durch den Globus essen und ein Diner mit ""traditionell gutbürgerliche"" Speisen eine gute Abwechslung und sehr lecker sein können.Das Intérieur ist wie man es in einem gehobenen Brauhaus in München erwarzen kann. Große schmiedeiserne Lampen, einen sehr schönen und großzügigen Kamin mit halbrunden Tisch davor und ebenso großzügige Tische.Ein Kontrast zu den mittelmäßige Restaurants im Gendarmenmarkt Gebiet, wo man mittelmäßiges, extrem überteuertes Essen auf Nachttisch große Tische geknallt bekommt von arrogante, ungelernte, duvenhaft blassierte Kellner während man mit den Beinen schon fast unter dem Tisch des Nachbarn sitzt und mit den Ellbogen die gleiche Nachbarn ständig attackiert.Hauptsache man wird gesehen. Kirmes der Eitelkeiten.Unser Tisch war Heute Abend sehr angenehm direkt beim knisternden Kamin. Der Herr im Service war sehr freundlich und zuvorkommend und wirklich herzlich. Hatte oft einen lustigen, aber avsolut nicht aufdringlichen, Spruch auf den Lippen und der kleine Mann (etwas älter als ein Jahr) bei uns am Tisch bekam umgehend und als Erster seine begehrte Pommes Frites damit er glücklich ist.Es wurde Krustenbraten, Saibling, Wiener Schnitzel und von mir Tafelspitz mit Meerettich bestellt.Der Tafelspitz war, in einem Wort, hervorragend und meine Tischgenossen waren ebenso angetan vom Serviertem.Der Wein wurde fachgerecht serviert und auch regelmäßig nachgeschenkt. Ständig mit einem freundlichen Gesicht.Die Preise sind mehr als human!  Ich weiß sebstredend nicht woher meine Vorredner stammen, aber es kommt den Eindruck hoch, daß viele Kommentatoren eher nicht in Berlin wohnhaft sind.Die Zeiten, in der Berlin außerhalb des Weltgeshehens vor sich hin träumte, sind schon lange vorbei. Berlin IST die Stadt wo das Geschehen stattfindet. In einer Stadt, wo fancy Hamburger die € 7,00 kosten standard sind, sollte man sich nicht echauffieren wenn eine Currywurst € 3,00 und ein Salat € 5,00 kostet.Vor Allem nicht, wenn man diese Speisen an einer Location in direkter Nähe des Kanzleramts zu sich nimmt.Was würde manch' Vorredner sagen wenn er in Paris an der Champs Elysée für zwei KLEINE Tassen Kaffee € 16,00 bezahlt? Oder über die Tatsache dass man in Paris die Preise staffelt je weiter man sich vom Tresen befindet?Man sollte die Welt, in der man lebt, kennen. Wenn man dies nicht tut, wäre man besser beraten Zuhause zu bleiben und im Discounter Zutaten von minderwertigem Qualität zu erstehen samt Massenzucht Folgem und Antibiotika.Man kann nicht UND eine schicke Location UND gutes Essen UND einen guten Service bekommen UND nur Kantine Preise oder Preise eines Lokals in einem Dorf bezahlen.Man möchte ein schickes Ambiente? Man möchte gut speisen? Man möchte umsorgt und beraten werden? Mann möchte all' Dies an einem angesagtem Standort? Dann sollte man willens sein, einen gebührenden Preis zu bezahlen.Wenn ich im KaDeWe einkaufe, kann ich keine Aldi Preise erwarten :-) Mein Mann hat für ein Abendessen für 5 (und ein halb) personen, samt Aperitif, Mineralwasser, Hauptspeise, Dessert, Kaffee und € 18 Trinkgeld € 200 bezahlt.Wer diesen Betrag überteuert findet, sollte nicht in Restaurants essen gehen, weil er oder sie Großstädten und ihre Preise nicht verstanden hat und er oder sie kennt sich mit Preise von qualitativ gute Lebensmittel nicht aus.Alle weltgewandte  Leser gebe ich den Tipp einen schönen und gemutlichen Abend mit gutem Essen und freundlichen Service in diesem Restaurant zu verbringen.Es lohnt sich absolut ;-) Und bevor wieder der, inflationär verwendeter, Spruch ""Lerne mal Deutsch"" oder ""Ist deine Tastatur betrunken?"" als Antwort artikuliert wird (passiert nämlich regelmäßig), ich bin Niederländer und werde nie das hochheilige Ziel erreichen ein 100% fehlerfreies Deutsch zu schreiben.",5,30.1.2016
14,Zollpackhof,3.5,122,Deutsch / Biergarten / ,Tiergarten,2,Oli B.,"Toll gelegener Biergarten am Fluß gegenüber des Kanzleramtes, Preise noch OK. Allerdings arbeitet bei der Essenszubereitung ein einziger Mann. Der ist supergut, also wenn ich ein Restaurant betreiben würde , würde ich den sofort abwerben, aber mit einer Person ist dies einfach total unterbesetzt. Die Parkplatzsituation ist ebenfalls unmöglich, es gibt dort etwa 7 Parkplätze, die Alternative ist das Parkhaus am Hauptbahnhof, das kann es ja wohl echt nicht sein.",3,26.7.2013
15,Zollpackhof,3.5,122,Deutsch / Biergarten / ,Tiergarten,2,Oliver F.,"Schöne Location, ordentliches Essen. In Spitzenzeiten aber unendliche Schlangen im Biergarten und wenig (freundliche) Bereitschaft der Organisation, etwas daran zu ändern. Schade.",2,19.7.2017
16,Zollpackhof,3.5,122,Deutsch / Biergarten / ,Tiergarten,2,Uwe H.,Für den gemütlichen Ausklang nach dem Feierabend in einem Biergarten mit nettem Ambiente. Wer so etwas sucht ist hier richtig. Die Bedienungen sind schnell und freundlich. Im Biergarten wird regelmäßig und auch gut gegrillt. Die Preise sind in Ordnung. Mit Blick auf´s Bundeskanzleramt und direkt an der Spree gelegen ist dieser Ort auch gut geeignet um mit auswärtigen Gästen hier einzukehren.Die Parkplatzsuche gestaltet sich häufig jedoch schwierig,4,30.7.2015
17,Zollpackhof,3.5,122,Deutsch / Biergarten / ,Tiergarten,2,Lisa L.,"Kühles Bier, tolle Luft und lauschig sitzen unter Bäumen.Sehr freundliche Bedienung  und die Preise sind angemessen bei der Lage und Qualität.",5,4.7.2018
18,Zollpackhof,3.5,122,Deutsch / Biergarten / ,Tiergarten,2,Daphne W.,Sehr gute Location zum Mittagessen. Das Lokal ist darauf sehr gut eingestellt. Es gibt eine Mittagskarte und auf Sonderwünsche Richtung Laktoseunverträglichkeit wird auch sehr entspannt eingegangen. Man sollte ein wenig mehr Zeit mitbringen. Für einen schnellen Gang zum Mittagessen ist es eher nichts. Aber das Essen war sehr gut und lecker. Ich komme wieder!,5,6.1.2017
19,Zollpackhof,3.5,122,Deutsch / Biergarten / ,Tiergarten,2,Joyce R.,"Wer sitzt im Sommer bei schönem Wetter nicht gerne in einem Lokal mit Spreeblick? Nach einer wunderschönen Bootsfahrt auf der Spree hatte ich noch lange nicht genug vom Wasser und wollte den Nachmittag im Zollpackhof am Ufer der Spree ausklingen lassen.Die Location ist wirklich traumhaft schön und sicher sehenswert. Trotzdem hab ich mich geärgert. Auch wenn der Spitzenkoch Carsten Knebel eigens für das Restaurant ein ""Zollpackhof-Salz"" kreiert hat, mit dem er nun seine Speisen verfeinert, gebe ich nur  ungern für ein Schnitzel mit Kartoffelsalat 17.90 Euro aus.Kein Wunder also, dass ich zwangsläufig darüber nachzudenken musste, ob man am Ende das Salz kreiert hat, um die Preise damit zu salzen. Positiv ist mit Sicherheit zu bewerten, dass man sich bei sommerlichen Temperaturen entweder für die Terrasse des Restaurants mit charmanter  Bedienung oder den rustikaleren Biergarten mit Selbstbedienung entscheiden kann.  Leider sind auch die Preise im Biergarten ordentlich gepfeffert. Im Zollpackhof hatte ich persönlich das Gefühl, man wartet dort auf Touristen, denen man das Geld aus der Tasche ziehen kann. Zur Spitzengastronomie gehört für mich mehr als ne weiße Tischdecke.",2,30.6.2010
20,Zollpackhof,3.5,122,Deutsch / Biergarten / ,Tiergarten,2,Adrian S.,"Vor 2 Wochen war ich mit einer größeren Gruppe dort.Eigentlich wollten wir ""innen"" im Bereich mit Bedienung essen. Leider wurde uns nicht gestattet, dass wir uns zusammen setzten. Da kam man unserer Bitte nicht entgegen und es kam die Antwort, im Hotel Adlon kann man auch nicht so mit 13 Leuten kommen.Wir blieben dann im SB-Biergarten.Zumindest die Currywurst selber war sehr wenig und dahr für den Preis zu teuer. Getränkepreise fand ich ok. Vielen habens ich dann noch von der Grillstation zusätzlich ein 2.Essen geholt. Leider gab es da schon am frühen Abend nicht mehr alles...Die Bedienungen waren zum Teil nicht soo wirklich freundlich.Ob das typisch ""berlinersich"" ist, kann ich nicht sagen, ich komme nicht von dort...Jedenfalls ein Biergarten, den ich nicht wieder besuchen möchte/werde.",2,10.10.2014
21,Zollpackhof,3.5,122,Deutsch / Biergarten / ,Tiergarten,2,Jana K.,"Bin auf der Fahrradtour entlang der Spree hier vorbei gekommen.Die meisten Gäste sind Touristen und dementsprechend sind auch die Preise. Wohl auch wegen der Lage und des Ausblicks. Eine Flasche Bionade 3€, kleine Flasche Orangina 2,50€. Getränke und Essen muss man sich hier selbst abholen, das Personal ist sehr kurz angebunden und spricht auch teilweise weniger gut Deutsch. Die Tische werden regelmäßig aufgeräumt, aber der Mitarbeiter hatte dabei weniger auf den entstehenden Lärmpegel geachtet. Man hat eher das Gefühl, dass das Personal durch ein Gericht zu Sozialstunden verurteilt wurde, so war zumindest die Stimmung und Freundlichkeit. Das Essen habe ich nicht probiert, auch wenn das Fleisch frisch gegrillt wurde, sahen die Zutaten und Beilagen nach Kantinenessen aus. Kartoffelsalat etc. waren definitiv nicht selbst gemacht, sondern aus dem großen Plastikeimer geschaufelt worden. Da verzichte ich dann lieber auf das Essen. Drei Sterne gibt es für den Ausblick und die Lage. Die Umsetzung ist allerdings weniger gut. Lohnt sich nicht unbedingt, außer man möchte nur ein Bier trinken.",3,21.7.2014
22,Zollpackhof,3.5,122,Deutsch / Biergarten / ,Tiergarten,2,Aski M.,"Wir sind hier heute zu viert im Restaurant eingekehrt und hatten zum Glück auch reserviert. Für einen Mittwoch war der Laden erstaunlich gut besucht. Wir bestellten: Schweinebraten, Schweinshaxe, Blutwurst und Schnitzel. Jeder war mit seinem Gericht ausnahmslos zufrieden! Das Personal erhält die Note 1+. Jeder der an unserem Tisch vorbeikam hakte noch, ob noch Wünsche zu erfüllen wären. Absolut aufmerksam. Auch die Lokalleitung fragte, ob wir mit allem zufrieden waren und ob es uns gefallen hat. Die WCs sind sauber und der Biergarten draußen mit Selfservice sah ebenfalls sehr einladend aus. Von uns gibt es hier ein dickes ""Daumen hoch"" für eine tolle Betreuung durch die Teams des Zollpackhofes. Der Chef muss sehr froh sein, solch ein super engagiertes Personal zu haben und erfreulich ist auch, dass die Geschäftsleitung bei den Gästen nachhakt, ob alles gepasst hat. Das ist leider nicht überall so und erhält dafür von uns das Prädikat : ABSOLUT EMPFEHLENSWERT!!!",5,11.4.2018
23,Zollpackhof,3.5,122,Deutsch / Biergarten / ,Tiergarten,2,Uwé R.,"Unglaublich enttäuschend! Mensa-Qualität ist noch nett ausgedrückt. Ochsenbäckchen waren unglaublich hart, Möhren schmeckten nach altem fett, Kartoffelbrei war Instant... die Bedienung war sehr unhöflich und sogar frech. Brachte bei der Bestellung eines ""Schnitzel Wiener Art"" ein Wiener Schnitzel statt eines Schweineschnitzels. Meinte dann anschließend mich aufklären zu müssen, dass ein Schnitzel Wiener Art bei Ihnen ein Wiener Schnitzel sei und ich falsch bestellt hätte! WTF??? Nie wieder!!!",1,27.4.2018
24,Zollpackhof,3.5,122,Deutsch / Biergarten / ,Tiergarten,2,Maik Uwe K.,"Wir waren gestern im Zollpackhof , bis zum Ende der Öffnungszeiten wollten garnicht solange bleiben.Kommen sehr gerne wieder. Wusste garnicht das es ein so gutes Restaurant gibt in Mitte.Bis bald Zollpackhof..",5,4.3.2018
25,Zollpackhof,3.5,122,Deutsch / Biergarten / ,Tiergarten,2,1 Foto,Netter Biergarten am Kanzleramt. Essen ist aber nur mittelprächtig. Currywurst war eher längliche Boulette mit fadem Currygeschmack. Bier aber super.,3,25.5.2011
26,Zollpackhof,3.5,122,Deutsch / Biergarten / ,Tiergarten,2,Maria G.,"Wer Lust auf eine kalte, trockene Haxe ohne Sauce hat ist hier bestens aufgehoben. Das Augustiner Bräu ist spitze und der Biergarten an sich auch nett, aber kulinarisch nicht mit dem Augustiner Keller in München mit halten.",2,7.6.2017
27,Zollpackhof,3.5,122,Deutsch / Biergarten / ,Tiergarten,2,Felix L.,Die Location ist super. Das Essen eine Katastrophe. Pommes waren totfritiert. Curry Wurst auch nicht zu empfehlen. Die Getränke sind ok. Personal typisch berlinerisch... Pokéstop vom Biergarten nicht erreichbar.,2,29.7.2016
28,Zollpackhof,3.5,122,Deutsch / Biergarten / ,Tiergarten,2,Mike B.,"24. Mai 2015.Wir haben uns heute dort mit Freunden getroffen, um das sommerliche Wetter zu genießen.Ein gemischter Salat, der unter Frischhaltefolie verpackt in der Kühlung stand. Als wir dann die Folie entfernt haben fanden wir etwa 5 Blätter Salat (total welk) und ein paar Tomaten und etwas Paprika. Unglaublich schlecht, war definitiv noch vom Vortag - einfach widerlich! Und die Menge an Salat wäre selbst bei Frische unverschämt teuer: 5€Zwei 0,5L Flaschen Cola Life: je 4€(es gibt einen guten Grund, dass keine Preisliste an der Getränkvitrine steht)Zwei uninteressante vegetarische Flammkuchen: je 9 € (die mit Fleisch waren 1 € billiger)Ingesamt: 31€ für etwas, was eigentlich nur ein Snack war.Den Stern gibt´s nur für die Aussicht.",2,24.5.2015
29,Zollpackhof,3.5,122,Deutsch / Biergarten / ,Tiergarten,2,Gerald A.,"den zollpackhof durfte ich noch unter dem namen menardie kennen lernen. die betreiber damals waren aufgeblasene münchner nasenbären die einige berliner vollproll-marzahner mit der gastronomischen abwicklung beauftragten. mir wars egal, ich habe dort (während der Fussball-EM2004) in meiner existentiellen not einen sommer lang für fünf euro fuffzig die stunde eine halbe goldmiene voller biertische von A nach B geschleppt und ganz nebenbei noch gut fünfmillionen fässer bier gezapft. die deppen von der isar mussten bereits nach einem jahr konkurs anmelden und ich, ich habe es ihnen aus ganzem herzen gegönnt. und was ist heute? dank des neuen betreibers -- angeblich der österreicher gerhard lengauer, ehemaliger partner von joe laggner und jetziger chef des josty am potsdamer platz -- hat sich das honorargefüge für niedrige angestellte auch nicht wesentlich verbessert. radelst du im sommer lang, bindest deinen esel ans geländer, trinkst beschattet dein bier unter kastanien, stört dich/mich weniger der preis und die schlange vor dir/mir (was soll man schon erwarten), vielmehr irritiert mich der versklavte ausdruck der angestellten (selektiver blick). okay, so ists im sommer, was aber läuft im winter? der innenausbau des restaurants ist zugegeben einigermaßen gelungen, trotzdem, irgendwie fehlt dort ein inspiriertes händchen. eine kraft mit stil und chuzpe. denn merke lieber betreiber: wer mit der allgemeinen rezession spekuliert und die gehälter von küche und service auf osteuropäisches niveau nivelliert, kann weder niveauvolles personal, noch mit niveauvollen gästen rechnen (natürlich gibt es immer ausnahmen, liebe kollegen). im zollpackhof, so erzählt man sich, interessieren derlei gedanken kaum jemanden, vor allem nicht den chef. und weil dem so ist, geht auch keiner hin, abgesehn von den schweizern aus der botschaft gegenüber, die schon immer ein enges verhältnis zu ihren nachbarn hatten. fazit: dieser ort ist wirklich einer meiner innerstädtischen lieblingsorte, ich spüre es ganz stark, wie sehr er auf mich wartet. eines tages werde ich dort das zepter schwingen und vieles wird sich zum guten wenden.",3,21.11.2006
30,Zollpackhof,3.5,122,Deutsch / Biergarten / ,Tiergarten,2,Fanny F.,"Gute Lage. Etwas teuer, sonst top!",4,6.3.2013
