,Restaurant Name,Overall Rating,Total Reviews,Specialty,Region,Price Range,Author,Comment,Rating,Date
79,Midtown Grill,3.9,39,Steakhouse / BBQ & Barbecue / ,Tiergarten,3,Zaza M.,"So nun haben wir also auch einmal den legendären Midtown-Grill in der hippen Mitte besucht.Vorschusslorbeeren gab es ja reichlich. Wir essen gerne ein gutes Steak und ich war meinem Mann ein  Essen schuldig, so dass wir anlässlich unseres Mall of Berlin Besuches einmal reinschauten. Begrüssung war noch relativ freundlich, wir wurden platziert und auch am Platz gabs nichts zu bemängeln. Ambiente: Nun ja gehobener Kantinencharakter. Gemütlichkeit kommt dort nicht auf...soll wohl auch nicht...Das Restaurant war an diesem Nachmittag kaum besucht, also die Servicedamen hatten wahrlich keinen Grund irgendwie gestresst o.ä.  Zu sein. Dennoch machte unsere Bedienung von Anfang an an - sagen wir es einmal freundlich - ein sparsames Gesicht. Kein Lächeln wollte ihr über die Lippen kommen als sie uns die Karte reichte und uns mechanisch die angebotenen Biere herunterrasselte. Meine Frage, welchen Rotwein (trocken) sie empfehlen könne, beantwortete die Dame zunächst mit einem ""...wir haben nur trockene Weine  (hört, hört!!) ....ich bringe Ihnen am besten die Karte...Nun wir mögen uns irren...aber das klang verdammt arrogant. Das geht einmal gar nicht. Ich entschied mich nach Kartenstudium für einen Nero d'Avola (10,00 € für 0,2 l) und mein Mann für ein Bit vom Fass. Ohne Mimik und schon gar keine Freundliche wurde unsere Bestellung aufgenommen. Ich mache es kurz: Ich hatte einen Burger, mein Mann ein RibEye Steak jeweils mit hausgemachten Pommes als Beilage. Alles schmackhaft, aber keine Offenbarung. Nett fanden wir den Gruß aus der Küche in Form von warmen Brot und selbstkreierten Dips. Das Bier hatte zunächst keine Kohlensäure. Eine andere Kellnerin (zunächst ebenso hochnäsig wie die erste, taute dann aber im weiteren Serviceverlauf auf) kümmerte sich um ein Neues, welches deutlich besser schmeckte.Alles in allem war dieser Besuch eher enttäuschend. Das Preis-Leistungsverhältnis ist angesichts des Services und auch der Speisen keinesfalls gerechtfertigt. Wir sind wahrlich keine Bauern die noch nie ein gehobenes Restaurant von innen gesehen haben. Ganz im Gegenteil. Wir sehen vielleicht nicht so aus, weil wir andere Werte schätzen, aber die Kunst eines guten Hauses ist es, sich auf den jeweiligen Gast gekonnt einzustellen. Ein Grundfreundlichkeit ist aber ausnahmslos immer - ob in der gehobenen Gastronomie oder aber in der bürgerlichen Gaststätte - unabdingbar. Die Sterne gibt es nur für das Essen!!!",3,20.11.2014
80,Midtown Grill,3.9,39,Steakhouse / BBQ & Barbecue / ,Tiergarten,3,Patrick W.,"Besser gehts kaum. Die besten Steaks der Stadt kommen nicht von Blockhouse oder Maredo. Das Restaurant des Marriott Hotels Midtown Grill befindet sich am Potsdamer Platz und gehört zum Beisheim Center. Nicht gerade günstig, dafür aber exklusiv. Ob Entrecote oder Filet Mignon, vom Rind oder vom Strauß, alles wird nach bester Midtwon Manier auf dem Grill in der offenen Küche vor den Augen des Gastes zubereitet. Dazu leckere Steakhouse Frites oder Salat, lecker! Abgerundet wird die Karte durch iene große Auswahl an Burgern. Natürlich lässt sich bei Midtwon auch ein Salat essen, aber wer geht schon ins Steakhouse um Gemüese zu essen? Zuoft geht das nicht, sollte man aber in jedem Fall mal erlebt haben.",5,5.6.2010
81,Midtown Grill,3.9,39,Steakhouse / BBQ & Barbecue / ,Tiergarten,3,Franz D.,Der Midtown Grill war viele Jahre mein Lieblings Steakhaus.Die Salze sind der Hammer sehr netter Service und das moderne Ambiente im Marriott gefällt mir gut.Besonders die staks waren sehr gut und das man nach dem Essen ins catwalk gehen konnte wo man super Drinks bekommt.Die letzten beiden male war das Steak jedoch sehr stark mit Sehnen durchzogen und meiner Meinung nach ungenießbar deshalb nur drei Sterne.,3,25.11.2013
82,Midtown Grill,3.9,39,Steakhouse / BBQ & Barbecue / ,Tiergarten,3,Hartmut P.,"Nach langer Zeit besuchten wir mal wieder den Midtown Grill. Er liegtdirekt am Potsdamer Platz, gegenüber der S-Bahn Station Potsdamer Platz. Da wirgerade in der Nähe waren, testeten wir den Mittagstisch für 16,50. Saltimboccamit gegrilltem Spargel, dazu Salbeijus und Gemüse Risotto, mein Kollege kosteteLinguine mit Hühnerstrreifen, Paprika mit Mangold und Mascarpone. BeideGerichte waren gut zubereitet und schmackhaft, die Nudeln weiter wenig zu lange im Topf. Die Portionen überschaubar, aber für Mittagstischausreichend. Das Salatbuffet für 11.50 war sehr frisch. Leider waren dieKellner ein wenig lahm"". Den Grill kann man auch für Nichtsteakesser""empfehlen.",4,6.2.2013
83,Midtown Grill,3.9,39,Steakhouse / BBQ & Barbecue / ,Tiergarten,3,Daniel B.,ich geben meinem Vorredner absolut Recht. Vergessen hat er jedoch die Dessertkarte zu erwähnen. Ich hatte einen New York Cheese Cake. Sensation! Auch wenn sehr gehaltvoll - aber: Sensation!Sehr empfehlenswert.,4,19.10.2010
84,Midtown Grill,3.9,39,Steakhouse / BBQ & Barbecue / ,Tiergarten,3,OrgaQueen B.,"Ich habe den Ausschläfer Brunch für 32 Euro miterlebt. Uns erging es ähnlich wie Herrn ""attitude"". Auf der ganzen Linie enttäuschend. Der Midtown Grill dient dem angeschlossenen Marriott Hotel als Frühstücksraum für die Übernachtungsgäste. Wenn ich das gewusst hätte, wäre ich glaube nicht hingegangen. Der Brunch ist ein normales Hotelfrühstück, sonst nichts. Sicher, es gibt ein paar andere Dinge als anderswo, aber es ist nichts besonderes. Wen es interessiert ... das ganze Erlebnis mit Fotos ist hier nachzulesen. berlinerfresse.de/2008/1…",3,19.12.2008
85,Midtown Grill,3.9,39,Steakhouse / BBQ & Barbecue / ,Tiergarten,3,Unknown,"Erstmals war ich letztes Jahr an einem Adventswochenende im Midtown Grill zum Brunch (während der Arbeit,grins). Ich habe schon einige hochkarätige Hotels und Restaurants besucht, aber im Marriott bzw. Midtown Grill blieb mir erst einmal die Spucke weg. Zur Adventszeit gibt es ein wirklich besonderes Brunch, welches ich jedem Gourmet & Feinschmecker ans Herz legen kann. Die offene Show-Küche lädt ein, um sich vielerlei Fleisch- & Fischvariationen frisch brutzeln zu lassen. Die Auswahl ist super vielfältig und das Angebot wirklich gut. Ich kann eigentlich gar nicht alles auflisten, was es gibt, weil es so umfangreich ist, aber ich liste mal ein paar Highlights auf: Steaks, Papageienfisch, Seeteufel, Sushi, Weißwürste, Pfannkuchen und und und und und Die Liste ist wirklich schier unendlich zu allem gibt es Softdrinks, Wasser, Bier, Kaffee, Latte Macchiato, frisch gepresster Orangensaft usw. usw. so viel man mag und wie rein geht ;o) Einfach alles was das Herz begehrt und ich finde, dass rechtfertigt dann auch den etwas höheren Preis von 39EUR zur Weihnachtszeit. Ich gebe sie liebend gern aus, weil jeder einzelne EUR super gut investiert ist :o) Abgerundet wird das ganze, durch einen erstklassigen Service die Gläser füllen sich wie von Geisterhand wieder auf und ein gehobenes und ansprechendes Ambiente. Zur übrigen Zeit des Jahres, kann ich auch das Ausschläfer Frühstück empfehlen. Nicht ganz so umfangreich wie zur Weihnachtszeit, aber auch allemal sein Geld wert und einen Besuch ;o) Kleiner Geheimtipp: das Marriott versteigert bei e-bay Gutscheine für das Ausschläfer Frühstück get 2 for 1. Da kann man echte Schnäppchen landen und so auch mal Feiern ausrichten, oder Freunde einladen :o) Versucht es mal, es ist wirklich toll und wer das Besondere mag, wird sich hier wohl fühlen. PS: für die Autofahrer, das Marriott verfügt über eine Tiefgarage und für die Gäste des Midtwon Grills ist das Parken kostenfrei.",5,22.6.2008
86,Midtown Grill,3.9,39,Steakhouse / BBQ & Barbecue / ,Tiergarten,3,Unknown,"Vorwegnehmend, die Vorspeisen sind ein Gedicht! Die Küche ein Gotteshaus?! ;-)Mein Herz hat der Caesar Salat mit Parmesan und gegrilltem Thunfisch im Sturm erobert!^^ Infolgedessen mein Hauptgang, trotz mitgebrachten Hunger und großem Appetit, hätte entfallen müssen. :-o Der fehlende Hinweis bei der Bestellung wurde mir deshalb zum Verhängnis kleines schade ;-) vom sonst hervorragenden Service; -jung, dynamisch, kein bisschen steif, ganz ausgezeichnet! Derart herzerfrischenden Service, den Restaurantbesuch begleitend, habe ich selten bei vergleichbar 4 o. 5* erlebt, deshalb erwähnenswert! begeistertSo konnte ich, die unberücksichtigte kleine Änderung der Vorspeise, garniert mit verkokelt gegrillter Pesto-Brotscheibe, ignorieren.^^ ;-)Traurig blickte ich dem halbvollen Vorspeiseteller hinterher snief. Ich hab mein Bestes gegeben! Unter uns: zu umfangreich! -kann man es einpacken? Scherz! Was danach kam, war beinah ebenso dem Hochgenuss der Vorspeise gleich schmacht. Unsere leckeren Filetsteaks waren zwar nicht perfekt(!) gelungen (das 1.te Mal in meinem Leben, Fauxpas, der kritisch betrachtet einen halben Stern kostet), aber mit natürlich selbstgemachter Pfeffersoße einfach köstlich! Meine weiteren schmackhaften Beilagen musste ich nahezu ungekostet zurückgehen lassen -wie erklärt Fehleinschätzung meines Vorspeisenumfangs. Was wird sonst geboten?Das Restaurant wird als Gast nicht mehr als Hotelrestaurant wahrgenommen äußerst positiv. Ich persönlich habe mich an dem durchaus ansprechenden Inneneinrichtungsstil schon ein wenig satt gesehen, meine Begleitung war hingegen entzückt, und mir dies wichtiger. Ähnlich wirklich nur bei äußerst kritischer Betrachtung, die Bewegung/Lautstärke, links Bar, rechts offene Küche -ich bevorzuge einen Tick ruhiger, anders als meine Begleitung, auch dies als angenehm empfand! Die Speisekarte, wird als große Tafel gereicht. An unserem Nebentisch haben wir zusätzlich optisch sehr witzige und tolle Kreationen der Darbietung von Vor-und Nachspeise gesichtet sah ebenso super lecker aus, und blanke Teller verließen deren Tisch. Wie bereits erwähnt, werden eine Postkarte, die das Haus versendet und ein Tischofen mit Marshmallows gereicht.Wen tatsächlich hier noch nicht das Völlegefühl erreicht haben sollte, darf auch das noch vollends genießen. Abschließend ein völlig in sich stimmiger und abgerundeter Restaurantbesuch, der das Wiederkommen verdient, zur Empfehlung verpflichtet, undLust auf noch mehr Köstlichkeiten der Küche macht !!! Weitere Infos wie Speisekarten, parken, sind allesamt der Homepage zu entnehmen ;-) Ach ja, es gibt keine Raucherlounge und Terrasse bzw. Außenbereich liegt direkt a.d. durchaus befahrenen Straße. P.S. Meine Sicht ein klein wenig anders als der Vorschreiber: Ich finde durchaus, dass man in Berlin gute Steaks bekommt. Ein Steakhouse mit besonderem Ambiente, erscheint mir als Zugezogene bislang(!) sich auch in Berlin auf eine handvoll zu beschränken. ;-)",4,9.8.2008
87,Midtown Grill,3.9,39,Steakhouse / BBQ & Barbecue / ,Tiergarten,3,Marco P.,"Wir gingen mit hohen Erwartungen in den ""Midtown Grill"". Auf der Suche nach einemGuten Steak House für unsere Berlin Reise sind wir auf dieses Restaurant gestoßen. Wir hatten im Voraus reserviert und einen schönen Platz zugewiesen bekommen. Am Tisch angekommen wird man zuerst mit Speisekarten überhäuft, aber es wird einemalles genau erklärt und überall noch einmal nachgefragt. Vor dem Essen bekommt man noch ein frisches, warmes Brot mit Dips. Die Fragen zum Fleisch wurden alle sofort und kompetent beantwortet. Wir mussten dann ca. 15-20 Minuten auf unsere Steaks warten. Dafür das es Samstag Abend war und recht gut gefüllt, ist das ok. Die Steaks und Beilagen wurden gleich von zwei Personen gebracht, sodass niemand auf den anderen warten musste. Toll! Das Fleisch wird mit einer Kräuterbutter und einer art Zwiebelsouce serviert. Die Kräuterbutter war nicht so mein Fall, für meinen Geschmack zu intensiv. Dafür war die Zwiebelsouce wirklich sehr gut. Als Beilage hatten wir noch die Bratkartoffeln mit Speck und Zwiebeln. Diese waren auch richtig gut. Die Salze sind auch ein Highlight und haben richtig gut gepasst. Als Nachspeise bekommt man noch einen marshmellows mit einem kleinen grill an den Tisch. Auch eine sehr nette Idee :) Alles in allem ein top essen mit wirklich sehr, sehr gutem Service. Zwar nicht ganz billig, zu zweit kann man alles in allem schon so 100€ rechnen, aber es ist es wert! Immer wieder gerne!",5,15.6.2014
88,Midtown Grill,3.9,39,Steakhouse / BBQ & Barbecue / ,Tiergarten,3,1 Foto,"Ich bin ein freundlicher und toleranter Mensch. Ich fand Lage, Einrichtung und auch Form der Gläser durchaus ansprechend. Es gibt allerdings so Tage, da ändere ich mein Gemüt.Ich habe Verständnis, wenn nicht sogar Mitleid mit den armen Mitmenschen, die bei diversen Nahrungsmittelverabreichungsketten den mühseligen Weg zur Fachfrau oder -mann für Systemgastronomie erleiden müssen. Aber hier? Warum nur? Ich weiss, viele meiner Vorredner schwärmen über den Service, aber die hatten bei uns entweder alle Urlaub oder es gab eine vorwinterliche Grippewelle beim Stammpersonal. Immerhin hat sich unsere Bedienung nicht mit den etwas gross geratenen Menuekarten verletzt, und wir danktem dem Schöpfer, dass auch unser Augenlicht knapp dem abrupten Erlöschen entging.Nun denn, die gewählten Speisen hätten uns ja trösten können. hätten.Das Surf and Turf auf Basis eines New York Strip, oder auch Porterhouse war weder medium rare, noch konnte der Lobster behaupten, irgendwas mit fangfrisch zu Tun zu haben. Die Hoffnung, dass die Grillkartoffel irgendein Korrektiv sein könnte, trügte fürchterlich.Ich finde es ja lobenswert, wenn statt des üblichen lieblosen Kellenklatsches ungewürztem Sauerrahms mal eine andere Version angeboten wird, leider war der Speck verbrannt und der angebliche Schweizer Käse lieferte eher den Eindruck einer frisch der Plastikfolie entrissenen garantiert käsefreien Chemie Scheiblette.Sorry, aber das war nix, also auch kein have fun.",1,7.11.2008
89,Midtown Grill,3.9,39,Steakhouse / BBQ & Barbecue / ,Tiergarten,3,Unknown,"Super leckere Filetsteaks (24,50 EUR) , mit Spinatbeilage. Das beste in Berlin.Schöne Überraschung zum Nachtisch, Marsh-Mallows zum selbergrillen.",5,24.5.2011
90,Midtown Grill,3.9,39,Steakhouse / BBQ & Barbecue / ,Tiergarten,3,Manu D.,Hat sich in den Jahren als gutes Hotelrestaurant entwickelt. Mittlerweile gehe ich wieder gern hin. Der Service hat sich stark zum Guten entwickelt. Die Steaks sind sehr gut. Reservierung ist erforderlich da es am Abend schwer wird vor Ort ein Tisch zu bekommen. Fünf Sterne !,5,12.12.2012
91,Midtown Grill,3.9,39,Steakhouse / BBQ & Barbecue / ,Tiergarten,3,Jürgen W.,"Fast das beste Steakhaus in Berlin. Leider immer maximal voll, aber genau das was man von der Küche in einem Spitzenhotel (Marriott) erwartet. Das Personal ist sehr freundlich, jung und kompetent. Die Steaks sind sehr lecker. Manchmal wird das Salz vergessen, daher immer nach der Salzkarte fragen. Da gibt es gefühlte 25 Sorten von. Spektakulär wird es, wenn man Steaks über 500 gr. bestellt. Da schlagen die Flammen in der offenen Küchen schon mal einen halben Meter hoch :-)",5,18.3.2014
92,Midtown Grill,3.9,39,Steakhouse / BBQ & Barbecue / ,Tiergarten,3,Adam C.,"Die Rezension gilt nur dem Service. Wir haben einen Tisch zu Ostern reserviert, leider wurde uns nicht gesagt, dass zu dieser Zeit nur kleine Karte gilt. Der Kellnerin war das wohl ziemlich egal, was uns zugesagt wurde. Enttäuschend haben wir das Restaurant verlassen.",1,17.4.2017
93,Midtown Grill,3.9,39,Steakhouse / BBQ & Barbecue / ,Tiergarten,3,Sybille S.,"Wir saßen draußen - Essen war wie immer perfekt, der Service überaus freundlich und kompetent - ok es ist nicht günstig aber es war jeden Cent wert - bis bald",5,5.8.2015
94,Midtown Grill,3.9,39,Steakhouse / BBQ & Barbecue / ,Tiergarten,3,Unknown,Das Ambiente und der Service machen es aus. Eigentlich gibt es hier nur sehr gute Steaks. Aber der hervorragende Service und das Ambiente durch zum Beispiel die offene Küche rechtfertigen den Preis. Viele kleine witzige Ideen runden den Abend ab. Sehr witzig fanden wir zum Beispiel das die Dessertkarte eine Postkarte ist die man natürlich kostenfrei an Personen seiner Wahl verschicken kann. Zusammengefasst ein nettes Restaurant mit für ein Steakhouse hohen Preisen die aber durch das Ambiente und die Qualität der Speisen gerechtfertigt werden. PS: Man kann zu jedem Steakgericht noch die Option Surf an Turf wählen. Hier wird dann zum Steak noch ein halber gegrillter Hummer serviert. Köstlich.,4,24.5.2008
95,Midtown Grill,3.9,39,Steakhouse / BBQ & Barbecue / ,Tiergarten,3,Unknown,"Wir waren super zufrieden!Service war sehr aufmerksam, Essen ohne Beanstandung preislich okay.Wir kommen wieder!!!Rollstuhlgerecht! - TOP!",4,2.9.2010
96,Midtown Grill,3.9,39,Steakhouse / BBQ & Barbecue / ,Tiergarten,3,Unknown,"Der Midtown Grill ist ein etwas besonderes Steakhouse. Hier gibt es ein sehr hochwertiges Angebot an Steaks, Fisch, bishin zu Hummer.Als Gruß aus der Küche bekommt jeder Gast Brot mit 3 verschiedenen Aufstrichen gereicht, bevor es zur Hauptspeise übergeht.Die Portionen sind übersichtlioch, wenn man allerdings mehrere Gänge bestellt kann man hinterher den Gürtel gut ein Loch weiter stellen.Die Steaks schmecken fantastisch. Die Nachspeisen sind ebenfalls traumhaft.Zum Abschluß bekommt jeder Gast einen kleinen Ofen mit einem Feuer auf den Tisch, an dem man erst Marschmelows rösten und sie später in feinen Schokoladenblättern wälzen kann.Das allein ist ein Grund im Midtown Grill zu essen.",5,7.2.2008
97,Midtown Grill,3.9,39,Steakhouse / BBQ & Barbecue / ,Tiergarten,3,Unknown,"Nun . Meine Zauberhafte Begleitung und ich wurden gestern Abend (kurz vor Schließung der Küche, also gegen 22.45 Uhr) sehr zuvorkommend und höflich empfangen. Bis unser Tisch fertig war, durften wir an der Hotelbar des Marriott Platz nehmen. Eine gute Gelegenheit für den Engel an meiner Seite, während der Wartezeit den Waschraum zu besuchen. Nach gefühlten zwei bis drei Minuten wurden wir dann zu unserem perfekt gedeckten Tisch geführt. Man muss noch dazu sagen dass die Bauart der zwei Personen Tische, genau dem entspricht, was man unter zwei Personen Tisch auch eigentlich versteht. Nicht diese verhinderten quadratisch gebauten Bistrotische, wo eigentlich so gut wie gar nichts Platz findet, sondern eher rechteckig und man sitzt an den kurzen Enden der Tische. Anyway  die Bedienung war sehr zuvorkommend, höflich und (glücklicherweise) nicht aufgesetzt, sondern behielt ihre natürlich menschliche Art bei, was sie (für mich jedenfalls) sehr sympathisch machte. Der Service war nahezu Fehlerfrei. Wir entschieden uns für den Caesar Salad mit gegrilltem Tuna (sehr, sehr, seeeehr zu empfehlen). Meine Zauberhafte Begleitung bestellte den Tuna well done, bekam ihn aber nur Medium gegrillt serviert. Dennoch wurde dieser kleine und verzeihbare Faux Pax schnell, unkompliziert und mit einem sehr höflichem sorry korrigiert. Es ist wohl anzunehmen, dass die Küche schon in Feierabend Stimmung war und deswegen die Konzentration nach gelassen hatte. Das Preis/Leistungsverhältnis (11,- EUR) ist angesichts der Größe und dem Geschmacksfaktor absolut angemessen. Der Style der Inneneinrichtung ist typical Hotel Restaurant, schon seit über 40 Jahren Usus, unverändert und haut einen zwar nicht gerade vom Hocker, aber das Gesamtpaket ist vollkommen stimmig. Von daher sind vier Sternchen als Bewertung vollkommen berechtigt, darüber hinaus war es nicht das letzte Mal, dass ich das Midtown Grill aufgesucht habe. Die Karte verspricht so einige kulinarische Leckerbissen und darum definitiv einen weiteren Versuch wert.",4,23.10.2008
98,Midtown Grill,3.9,39,Steakhouse / BBQ & Barbecue / ,Tiergarten,3,Unknown,"Die Bewertungen fallen ja sehr unterschiedlich aus und ich kenne das Midtown nun auch aus eigener Erfahrung. Für mich in erster Linie bei einem Restaurant wichtig ist der Geschmack und die Zubereitung des Essen. Und das Steak hat mich begeistert, denn es war sehr gut zubereitet und auch geschmacklich im oberen Bereich. Wenn andere schreiben, dass man ""Provinzler"" sei wenn man es nett findet zum Abschluß Marshmallows zum grillen zu erhalten dann ist das deren Problem. Ich kenne dies aus zahlreichen Prime-Steakhäusern aus den USA und es gehört einfach dazu. Fazit: Mir hats geschmeckt und auch wenn der Preis leicht gehoben ist würde ich wieder hier hin gehen.",4,5.10.2009
99,Midtown Grill,3.9,39,Steakhouse / BBQ & Barbecue / ,Tiergarten,3,Unknown,"Wenn man ein Fleisch- und Steakfan ist, ist man hier bestens aufgehoben. Der Service ist wie man ihn in einem amerikanischen Unternehmen erwartet, nämlich zuvorkommendund das tut in Berlin einfach sehr gut. Es besteht auch eine gute Weinkarte, zu der man auch noch sehr gut beraten wird. Was mir am besten gefällt, ist, dass man sich hier sowohl für ein Date als auch für ein Geschäftsessen sehr gut treffen kann. Beides macht hier richtig Spaß.Den Abend kann man übrigens noch wunderbar in der Catwalk Bar (direkt nebenan) abrunden.",5,23.5.2013
100,Midtown Grill,3.9,39,Steakhouse / BBQ & Barbecue / ,Tiergarten,3,Linus K.,"Super Service und das Fleisch hat Topqualität, auch das Frühstücksbuffet ist sehr vielseitig und lecker..",5,25.1.2015
101,Midtown Grill,3.9,39,Steakhouse / BBQ & Barbecue / ,Tiergarten,3,Unknown,"Angenehmes Ambiente und sympathisch bemühter Service. Raum zu groß um gemütlich zu sein.Sehr gute Fleischqualität. Als Hotelrestaurant sicher zu empfehlen.Wer sich wirklich einen schönen Abend machen möchte sollte individueller essen gehen.Ich habe auf meine Begleitung gewartet und nach einer Zeitung gefragt, es gab leider keine im ganzen Hotel (!) und man bot mir eine Messebroschüre der Fashionweek an. Danke, dann lieber die (gute Weinkarte).Leider kein fester Kellner am Tisch. Die Salzkarte ist eine gute Idee, aber ohne Kompetenz am Tisch nimmt man dann die Salzmühle am Tisch. Lange auf die Rechnung gewartet.Ab und zu gerne, aber erst mal nicht mehr",3,22.1.2013
102,Midtown Grill,3.9,39,Steakhouse / BBQ & Barbecue / ,Tiergarten,3,Unknown,"Die Qualität der Speisen waren gut. Die Preise des Essens sind der Qualität entsprechend. Die Getränke sind eindeutig überteuert (5,40 für ein Weizenbier)Im Service ging leider so einiges schief von vergessenen Getränken bis zur falschen und weitaus höheren Rechnung am Ende. Wurde aber alles im Endeffekt gut gelöst und wir waren zufrieden.",3,8.8.2013
103,Midtown Grill,3.9,39,Steakhouse / BBQ & Barbecue / ,Tiergarten,3,Ilmar N.,wir haben uns super wohl gefühlt. Das Essen war lecker und perfekt. Ausgewählte hatten wir Stubenkücken und Ribeye Steak. Beides war perfekt. Das Steak genau auf den Punkt gegart und zart! Sehr freundliches Personal. Gerne kommen wir wieder.,5,21.3.2015
104,Midtown Grill,3.9,39,Steakhouse / BBQ & Barbecue / ,Tiergarten,3,Carlos F.,"Ein ordentliches Steak bekommt man hier sicherlich, aber es ist und bleibt für mich ein nur leicht überdurchschnittliches Steak-Restaurant.Die offene Grillküche ist sicherlich ein Highlight.Das das Restaurant riesig ist, muss man schon auf sich aufmerksam machen.Interessant sind die besonderen Saucen, die zum Grillgut angeboten werden oder auch zum Abschluss die Marshmallows, die man selbst am Tischfeuer rösten kann.Das Ambiente ist zweifellos angenehmer als bei Maredo & Co., aber natürlich muss man dafür auch ein paar ""Dollar"" mehr hinlegen.",3,25.5.2010
105,Midtown Grill,3.9,39,Steakhouse / BBQ & Barbecue / ,Tiergarten,3,Unknown,"Billig wird ein Besuch im Midtown Grill bestimmt nicht, dafür stimmt hier aber, zumindest bei all meinen Besuchen, die excellente Qualität des Fleisches und auch der Service, obwohl einige hier andere Erfahrungen schilderten. Die Karte ist haptisch rießig, was drauf steht aber klein und fein. Nach meiner bisherigen Erfahrung das einzige Steakhouse in Deutschland das ich kenne, das ind er Lage ist, ein Steak auf den gewünschten Punkt zu braten, und zwar nicht nur ufällig mal, sondern immer wieder. Ich komme immer wiede gerne hier her, weenn ich in Berlin zu tun habe und freu mich jedesmal auf ein gut gemachtes Steak, das ich in München leider nicht bekomme. Einzig der wirklich hohe Preis, vor allem für die Weine kostet einen Punkt Abzug.",4,1.4.2011
106,Midtown Grill,3.9,39,Steakhouse / BBQ & Barbecue / ,Tiergarten,3,Sebastian F.,"Absolutes Muß für Fans von US-Food und BBQ und für alle, die bisschen schicker essen gehen wollen als im Hard Rock Cafe.Der Midtown Grill gehört zum Marriott Hotel in Berlin, so dass man da zunächst den Marriott Burger bekommen kann (steht nicht auf der Karte, danach fragen!).Gerade am Wochenende ist es ratsam hier mit Reservierung aufzutauchen, um nicht abgewiesen zu werden.Das Essen wird frisch zubereitet und schmeckt unbeschreiblich gut. Die Preise sind jedoch sehr hoch  also nix für den kleinen günstigen Hunger zwischendurch.Zum Bezahlen der Rechnung gibt es auch nicht Marshmellows inklusive Mini-Raclette. Tolle Idee, die diesen Abend fantastisch abschließt. Das hier ist fast schon Essen als Event sofort wieder!Parken nur kostenpflichtig direkt am Potsdamer Platz oder in der Tiefgarage des Marriott-Hotels.",5,30.8.2011
107,Midtown Grill,3.9,39,Steakhouse / BBQ & Barbecue / ,Tiergarten,3,Unknown,"Ich war mit Freunden zur Weihnachtszeit im Midtown Grill,wir haben uns alle für die steakflatrate entschieden, es super lecker.Auch der Service war sehr auf merksam und freundlich,wir kommen gerne wieder.",4,16.1.2011
108,Midtown Grill,3.9,39,Steakhouse / BBQ & Barbecue / ,Tiergarten,3,Bernd S.,"Wirklich so lecker,alles perfekt vom Grill.Ein gehobenes Ambiente,aber sehr netter Service.Marshmallows gibts als Nachtisch :)).",5,16.9.2014
109,Midtown Grill,3.9,39,Steakhouse / BBQ & Barbecue / ,Tiergarten,3,Unknown,Tunna Steake war himmlisch lecker!!!!Gerne wieder!!!,5,29.5.2012
