,Restaurant Name,Overall Rating,Total Reviews,Specialty,Region,Price Range,Author,Comment,Rating,Date
294,Steakhouse Asador,4.5,235,Steakhouse / ,Kreuzberg,2,Matthias B.,"tl;dr: Das Preis-Leistungs-Verhältnis ist unschlagbar, das Fleisch sehr gut, der Service ohne Tadel. Sehr beeindruckend, gerade zu den Preisen. In der Woche zwischen Weihnachten und Neujahr geht es bei mir alljährlich nach Berlin zum CCC-Congress. Und weil das Essen am Veranstaltungsort sehr kohlenhydratlastig und qualitativ mittelmäßig ist, gehen wir eigentlich immer essen. Dieses (bzw. letztes) Jahr ging es vornehmlich um Steak, und unsere Wahl fiel unter anderem auf das Asador, das wir via foursquare entdeckt hatten. Also ging es erst mit fünf Personen hierher. Die Lage des Restaurants ist absolut nicht top, aber sehr nah an top (das Restaurant Entrecote, wo wir zwei Tage vorher waren, ist etwa 600m entfernt). Dafür ist das Asador aber von außen gut sichtbar und innen recht geräumig. Wir bestellten zu fünft zwei Vorspeisenplatten und einen Chorizo-Teller als Vorspeisen, als Hauptgericht gab es fünf mal das Angus-Filet in verschiedenen Gewichtsklassen, die Beilagen stellt man sich selbst zusammen. Sowohl Vorspeisenplatte als auch Chorizo-Teller waren geschmacklich sehr gut, die Vorspeisenplatte außerdem gut sortiert. Daraus schloss ich, dass auch die Hähnchen-Nuggets selbstgemacht und lecker sind, ebenso war der Tintenfisch sehr gut. Hauptspeise war bei mir das 250g Angus Filet medium rare mit Broccoli als Beilage. Das Filet war fast genau auf den (meinen) Punkt zubereitet, einen kleinen Tick mehr durch als ich noch medium rare nennen würde, aber YMMV. Sehr guter Cut und wundervoll zart  eine Freude zu essen. Auch der Broccoli war nicht wie häufig erlebt einerseits weichgekocht und andererseits schon abgekühlt, sondern knackig und heiß. Am Ende wurde gefragt, ob man die Rechnung zusammen oder getrennt möchte (wir machten's American Style), rief uns auch gerne ein Taxi, und stellte insgesamt sicher, dass wir gerne wiederkommen werden. (Taten wir dann auch drei Tage später, wieder zu fünft, aber in anderer Konstellation, und es begab sich ziemlich genauso begeisternd.)",5,6.1.2012
295,Steakhouse Asador,4.5,235,Steakhouse / ,Kreuzberg,2,Unknown,"Ich hatte Lust auf ein Pfeffersteak und hier bei Qype geguckt, was es so in der Nähe gibt. So bin ich auf das Asador gestoßen, das durch unverschämt viele 5-Sterne-Bewertungen aufgefallen ist. Ehrlich gesagt hat mich diese Lobhudelei schon wieder misstrauisch gemacht. Aber zur Lösung dieses Rätsels komme ich später. Trotz des Zweifels also bin ich mit einem Freund in die Wilhelmstraße gefahren. Von außen muss man sagen, machen die gesamte Ladenzeile und der abgerockte Vorgarten einen sehr schlechten Eindruck. Wenn man was Repräsentatives sucht, um Geschäftspartner oder Familienbesuch aus Westdeutschland auszuführen, ist das Asador sicherlich nicht die richtige Empfehlung. Innen drin ist das Lokal eher klassisch-einfach eingerichtet, ziemlich vorstädtisch bis unambitioniert. Aber gerade diesen eckkneipigen, altmodischen Charme mag ich persönlich sehr. Denn meistens sind die Leute in den weniger gestylten Restaurants viel zugänglicher und netter und das Essen ist nach meiner Erfahrung auch ehrlicher und handgemacht statt Fertigfutter, das von gelangweiliten Billigkräften frittiert wird. Und meine Erfahrung trügte mich auch dieses Mal nicht: Die Mitarbeiter des Asador waren aufmerksam, freundlich, immer ansprechbar und zum Glück zugleich mit Professionalität gesegnet: Unser Kellner hat uns bei der Bestellung beraten (Sonderwünsche waren kein Problem), uns rasch etwas Brot mit Öl und die Getränke serviert und ansonsten in Ruhe gelassen und nicht zugetextet. Als nach einer vernünftigen Wartezeit die Steaks kamen, lagen bei mir Kartoffelspalten statt der gewünschten Pommes auf dem Teller. Kein Problem, sagte der Kellner und die Pommes kamen ein paar Minuten später auf einem Extrateller. Noch ein Satz zur Sauberkeit: Nur weil es stark beansprucht wird und etwas altmodisch ist, muss das nicht heißen, dass es unsauber ist. Das ganze Lokal war vielleicht nicht modern, aber sehr gepflegt und auch die Toiletten waren 1a in Schuss. Ich behaupte ja, es gibt eine Korrelation zwischen Toilettensauberkeit und Küchensauberkeit und würde deshalb Lokale meiden, deren Toiletten schweinisch aussehen. Einziger Nachteil des Asadors: Leider hat der Innenraum keine Klimaanlage und es war relativ voll, weshalb wir beim Essen etwas ins Schwitzen kamen. Ach ja, es gibt keinen kostenlosen Schnaps hinterher. Aber das macht mir wirklich nichts aus, statt dieser Gimmicks habe ich lieber ein gutes Stück Fleisch auf dem Teller, dessen Preis korrekt kalkuliert wurde. Und warum sind nun bei Qype so unglaublich viele und noch dazu ausschließlich 5-Sterne-Bewertungen? Ist da doch eine PR-Agentur aktiv? Die Lösung ist ganz einfach: In der Rechnungsmappe liegt für jeden Gast auch eine kleine Karte, auf der der Gast gebeten wird, eine Kritik bei Qype zu hinterlassen, wenn es ihm gefallen hat. Diesen Hinweis scheinen viele zu Recht begeisterte Gäste einfach aufgegriffen zu haben",5,14.8.2011
296,Steakhouse Asador,4.5,235,Steakhouse / ,Kreuzberg,2,Unknown,"Auf qype entdeckt und getestet.Wer den Zeitgeist nach Event und Loungestil sucht wird hier enttäuscht.Wer Gaumenfreude,grosse Portionen,Top Bedienung suchtfindet selten etwas gleichwertiges oder besseresdanke qype für dieses tolle Restaurant.Selbst in 25 Jahren im Block house habe ich nicht besser gegessen.Hier wird die Kette IMHO im Kerngeschäft geschlagen .",5,30.12.2011
297,Steakhouse Asador,4.5,235,Steakhouse / ,Kreuzberg,2,Michael P.,Lecker! Unbedingt hin!,5,29.5.2013
298,Steakhouse Asador,4.5,235,Steakhouse / ,Kreuzberg,2,Unknown,"Nur zufällig sind wir auf dieses Restaurant gestoßen. Und haben es nicht eine Minute bereut. Das Essen war hervorragend und preislich absolut in Ordnung. Besonders gut gefallen hat uns aber der sehr aufmerksame und freundliche Service. Sollten wir wieder einmal in Berlin sein, werden wir dort wieder hingehen.",5,7.11.2009
299,Steakhouse Asador,4.5,235,Steakhouse / ,Kreuzberg,2,Unknown,Einen derart hochwertigen Service habe ich selten erlebt. Hier merkt man dass Professionalität u Passion zusammentreffen. So wird aus dem Kunden ein Gast und aus einem Essen eine Freude. Auch die Qualität stimmt: das Fleisch war exzellent und genau richtig zubereitet. Auch die Beilagen und die Vorspeise waren gut. Und das alles zu einem sehr fairen Preis. Den klaren Fokus auf Qualität zu legen war hier genau die richtige Entscheidung des Teams. Ich kann den Besuch nur jedem empfehlen. Es ist einfach toll ein Restaurant voller Begeisterung u Freude zu verlassen. Wir kommen sicher wieder.,5,22.2.2011
300,Steakhouse Asador,4.5,235,Steakhouse / ,Kreuzberg,2,Gregor M.,Cool ' sind mit zwölf Leuten spontan eingefallen. Toller Service und super leckeres Essen. Kommen gerne zurück.,5,15.11.2012
301,Steakhouse Asador,4.5,235,Steakhouse / ,Kreuzberg,2,Unknown,wir kamen über einen groupon gutschein hierher und nach vielen groupon enttäuschungen waren wir vom asandor angenehm überrascht. nettes essen und eine sehr freundliche bedienung.,4,19.5.2011
302,Steakhouse Asador,4.5,235,Steakhouse / ,Kreuzberg,2,Unknown,"Ich war vor einem halben Jahr zum ersten Mal mit meiner Freundin hier und war überwältigt. Ein nettes, junges Serviceteam, erstklassige Qualität der Speisen und wirklich faire Preise. Das zweite Mal war ich zum Geburtstag meiner Mutter hier. Auch dieser Abend war ein voller Erfolg. Ich kann nur sagen: WEITER SO!",5,30.11.2011
303,Steakhouse Asador,4.5,235,Steakhouse / ,Kreuzberg,2,Unknown,Sehr gute Steaks und freundlicher sowie zuvorkommende Service. Doch leider ist das Ambiente und die Umgebung nicht so mein Fall.,4,15.3.2012
304,Steakhouse Asador,4.5,235,Steakhouse / ,Kreuzberg,2,Unknown,"Nach einer Menge gelesenen Kommentaren waren wir letzten Samstagabend zu viert im Asador.Für die männlichen Begleitungen gab es Filetsteaks mit Grilltomaten, die beim Servieren hervorragend dufteten und auch sehr gut geschmeckt haben sollen.Wir bestellten uns das Rumpsteak mit Rosmarinkartoffeln, Bohnen, angeschmorten Zwiebeln und Kräuterbutter gab es bei uns Mädels dann auch noch. :)Sowohl die Filetsteaks als auch die Rumpsteaks waren sehr gut medium gebraten. Meine Freunde und ich gehen sehr oft Steak essen und sind, was das angeht, ein wenig verwöhnt, aber die Steaks waren hervorragend, saftig und zart. Die Beilagen waren auch lecker- alles auf unseren Tellern war köstlich.Von den Steaks schwärmen wir noch immer. :)Der Kellner und die Kellnerin, die uns bedienten waren sehr freundlich, sie rührte uns extra eine scharfe Soße an, die sehr gut schmeckte und er hatte immer einen flotten Spruch auf den Lippen. Fazit:Das Asador kann definitiv mit diversen Steakhouse-Ketten mithalten, ist sogar noch ein wenig besser, da es persönlicher ist und vom Preis-Leistungs-Verhältnis sogar ein bisschen günstiger.Von uns gibt es für das Asador eine uneingeschränkte Empfehlung &wir kommen auf jeden Fall wieder!ps.: wer das Geheimnis um die schwarzen Handschuhe der Kellner lüften möchte, fragt einfach nett und kriegt rasch eine Antwort. ;)",5,11.10.2012
305,Steakhouse Asador,4.5,235,Steakhouse / ,Kreuzberg,2,Unknown,"die fünf Sterne sagen doch schon alles oder? ;-)hier ist es wirklich super! gutes essen, Nette und flotte Bedienung, angenehme Atmosphäreprobiert es aus!",5,23.9.2011
306,Steakhouse Asador,4.5,235,Steakhouse / ,Kreuzberg,2,Unknown,"Ich war zu Besuch in Berlin und bin aufgrund der tollen Bewertungen hier Essen gegangen. Das Essen war wirklich fantastisch (hatte einen Teller mit verschiedenen Fleischsorten, Champignons usw.)! Eine riesige, frische Portion zu einem unschlagbaren Preis.",5,2.6.2012
307,Steakhouse Asador,4.5,235,Steakhouse / ,Kreuzberg,2,Unknown,"Man muss die Kirche im Dorf lassen. Es ist sicher ein gutes, inzwischen aber überfülltes, Restsurant. Zunehmend neues, unsicheres, schlechter ausgebildetes Personal im Einsatz.Viele Plätze im Restaurant mit grenzwertiger Lage, z.B. vor den Toiletten, am zugigen Eingangsbereich oder vor dem Tresen. Es ist zusätzlich auch befremdlich, dass bei unserem letzten Besuch Gartenbestuhlung im Gastraum Verwendung findet, nur um zusätzliche Gäste bedienen zu können. Andere Steakhäuser der Stadt sind mindestens ebenso nett und ohne die Mengen von Touristen.",1,20.2.2013
308,Steakhouse Asador,4.5,235,Steakhouse / ,Kreuzberg,2,Unknown,Qualität des Essens TOP ! Das gleiche gilt auch für die Bedienung und den Service. Und nicht zuletzt auch für die Preise. Absolute Empfehlung ! Top Adresse !,5,28.12.2012
309,Steakhouse Asador,4.5,235,Steakhouse / ,Kreuzberg,2,Unknown,"Leckere Speisen, vornhemlich Steaks in allen Variationen und zum selbst zusammenstellen. Ein gutes Preis-Leistungsniveau und eine unglaublich freundlicher und aufmerksamer Service. Ein Restaurant das man vollends empfehlen kann.",5,7.11.2009
310,Steakhouse Asador,4.5,235,Steakhouse / ,Kreuzberg,2,Unknown,Absoluter Geheimtip! Ich war inzwischen 3x mal in 3 Wochen da und es war jedesmal ein highight der Woche. Perfekt gegrilltes Steak zu fairen Preisen und dazu noch ein persönlicher Service der heutzutage seinesgleichen sucht. Wo hat man das noch das das Personal noch weiss welchen Wein man hatte und welches Gericht. Man fühlt sich sofort wohl und freut sich auf das leckere Essen. Wenn ich wieder in Berlin sein werde werde ich auf jeden Fall wieder dort essen. Das hat man leider viel zu selten heutzutage!! Absolut zu empfehlen!!! Weiter so!!! Grüße aus Stuttgart,5,28.1.2010
311,Steakhouse Asador,4.5,235,Steakhouse / ,Kreuzberg,2,Unknown,"hi wir sind begeistert ! so ein gutes steak und service und bier, habe ich nicht erwartet. trotz der positiven beiträgedie sind wahr. und die gegend.egal!lecker lecker leckeres lohnt sicha+b",5,31.7.2011
312,Steakhouse Asador,4.5,235,Steakhouse / ,Kreuzberg,2,Unknown,Ja kann mich den Kommentaren nur anschließen! Super Essen super service! Und das alles auch noch günstig!!! Einfach super!!!,5,9.11.2011
313,Steakhouse Asador,4.5,235,Steakhouse / ,Kreuzberg,2,Unknown,"Sehr lecker, sehr freundlich aber leider etwas zu teuer.",3,20.11.2011
314,Steakhouse Asador,4.5,235,Steakhouse / ,Kreuzberg,2,Unknown,"Ich bin begeistert! Sowohl das Fleisch als auch die Beilagen sind fantastisch! Mein Rumpsteak (medium rare) war auf den Punkt gebraten. Dazu die leckere Champignonsauce und die Rosmarinkartoffeln. Ein Traum! Der Grillteller Asador, den mein Freund bestellt hat, war auch rundum super! Zum Abschluss 2 Crème brûlée  auch das lässt keine Wünsche offen. Der Service war freundlich und zuvorkommend. So glücklich bin ich selten nach einem Restaurantbesuch nach Hause gegangen!  die Beschwerden über die Gegend kann ich übrigens nicht verstehen. Nur weil es in keinem In-Bezirk liegt. Dafür gut erreichbar. Kaum 5min-Fußweg von der Ubahnstation. Wir kommen definitiv wieder!!",5,21.7.2012
315,Steakhouse Asador,4.5,235,Steakhouse / ,Kreuzberg,2,Unknown,"Wirklich leckeres Essen und schnelle Bedienung. Klar, die Preise sind nicht gerade niedrig, aber es lohnt sich weils einfach schmeckt. Gerne wieder!",5,28.8.2012
316,Steakhouse Asador,4.5,235,Steakhouse / ,Kreuzberg,2,Unknown,"Das Essen ist sehr sehr gut und richtig lecker!!!! Ein so guten, netten und zuvorkommenden Service hatten wir schon lange nicht mehr. Auf die Empfehlung des Kellners kann man sich wirklich verlassen. wenn wir wieder in berlin sind, werden wir wiederkommen!",5,23.9.2012
317,Steakhouse Asador,4.5,235,Steakhouse / ,Kreuzberg,2,Jenny F.,"ausgezeichnet! wir hatten die vorspeisenplatte fur 2 mit chickennuggets, fleischbaellchen und calamaris, was sich ein bisschen nach tk-ware anhoerte, doch alles war frisch und selbstgemacht!die calamaris waren gegrillt! die steaks waren sehr gut und der service freundlich und gut gelaunt. man sollte vorher reservieren.",5,7.4.2013
318,Supersonico,4.5,4,Italienisch / ,Wedding,Unknown,S H.,"War noch nicht drin, aber es riecht davor schon so köstlich, dass ich da demnächst unbedingt rein muss!!!!Außerdem sieht es dort schick, aber trotzdem äußerst gemütlich aus!!!!",5,29.3.2018
319,Supersonico,4.5,4,Italienisch / ,Wedding,Unknown,Jan H.,"Atmosphäre:Wirklich ein toller Laden mit einem super Designkonzept. Man fühlt sich direkt wohl und möchte bleiben. Die große Bar lädt auf jeden Fall zu einem super Aperertivo ein und Aperetivo ist ja schließlich die beste Tageszeit. Service:Der Service ist super lieb und gibt sich auf jeden Fall viel Mühe. Es gibt aber Luft nach oben, denn in Details müssen die Jungs leider Punkte lassen. - Frisches Besteck nach der Vorspeise gab es nur auf Nachfrage. - Es wurde stetig von der falschen Seite über die anderen Gäste am Tisch hinweg serviert. - beim Abräumen wurde der Rest Grappa auch einfach mal auf den Boden geschüttet, weil sich das Glas so besser tragen ließ. Diese Kleinigkeiten sind wirklich schade, lassen sich aber über etwas Training und Schulung sehr einfach abschalten. Speisen:Hier haben die Kollegen den zweiten Punkt gelassen. Die Karte ist klein und super gut zusammengestellt, wirklich eine schöne und moderne Interpretation italienischer Küche. Geschmacklich waren meine Vorspeise und auch der Hauptgang sehr lecker und gut zusammengestellt. Leider war meine geschmorte Ochsenbacke nicht genug geschmort und darum sehr fest. Der Fehler wurde aber mit Dessert und Grappa ausgebügelt. Und das war Killer! Das Essen der meiner Begleitungen war allerdings super. Fazit:Toller Laden mit super viel Potential. Die Atmosphäre ist super und macht Laune auf mehr. Wenn die Kleinigkeiten besser laufen, wären 5 Sterne und mehr auf jeden Fall drin. Ich komme wieder und dann gibt es eventuell auch die volle Punktzahl.",3,1.10.2018
320,Birdhouse Imbiss,5,1,Imbiss / ,Tiergarten,Unknown,Eypee K.,"Keine gewöhnliche Imbissbude. Es gibt jeden Tag ein anderes Mittagsgericht die sehr vielfältig und sehr gut zubereitet wird. Die Bude sieht leider im Moment wegen der Baustelle sehr provisorisch aus. Nichtsdestotrotz, ist das Essen dort sehr gut.  Die Leute die gegen Mittag  da hingehen sind meistens Bauarbeiter, junge Leute von Kreativagenturen und sehr interessante Menschen im Allgemeinen. Birdhouse Imbiss kann ich jedem empfehlen. Vorallem auch wegen der sehr netten  Bedienung  :)",5,3.2.2016
321,Dolcini,4.5,35,Italienisch / ,Mitte,2,Frank S.,"Authentisch, superlecker!Bedienung aufmerksam und supernett!Man fühlt sich ein wenig wie in Italien ...",5,28.6.2019
322,Dolcini,4.5,35,Italienisch / ,Mitte,2,Gaby S.,"Seit ca. 2 Jahren ist das ""Dolcini"" mein italienisches Lieblingsrestaurant in Mitte und immer wieder prima. Der Lunch ist absolut empfehlenswert mit einem sensationellem Preis-Leistungsverhältnis, was sich mittlerweile herumgesprochen hat. Der ehemalige Geheimtipp ist zum angesagten Treffpunkt für Mittagsgäste aus den umliegenden Behörden und Büros geworden. Deshalb unbedingt vorab reservieren, denn das Restaurant ist recht klein.Abends ist es hier deutlich ruhiger, die Atmosphäre ist gemütlich und kuschlig, der Service ist genauso lustig wie mittags, allerdings noch etwas entspannter. Für Berliner Verhältnisse und in dieser Lage sind die Preise sehr zivil. Es gibt vor allem Pasta-Gerichte, die saisonal wechseln, und guten Wein. Ein echter Wohlfühlort, wie ein kleiner Italien-Urlaub, und das nur ein paar Schritte abseits der ausgetretenen Touristenpfade.",5,18.12.2016
323,Dolcini,4.5,35,Italienisch / ,Mitte,2,Markus E.,"Sehr lecker, sehr angenehmes Ambiente, super freundliche und unaufdringliche Bedienung. Auf jeden Fall zu empfehlen.",5,21.3.2018
324,Dolcini,4.5,35,Italienisch / ,Mitte,2,Robert K.,"Perfekter Italiener (keine Pizza!) zum Lunchen. Die Preise sind wirklich super für die sehr leckeren Nudelgerichte. Die Bedienung ist aufmerksam und freundlich. Eine wirklich tolle Alternative zu Vapiano! Ich gehe hier sehr, sehr gerne hin.",5,6.10.2015
325,Dolcini,4.5,35,Italienisch / ,Mitte,2,Dr. Alexander Maximilian L.,"Bin mehrmals im Monat hier zu Mittag...super Essen, gute Preise...Mittags nur sehr voll, daher immer Tisch reservieren! Heute war ich auch wieder da...Karotten/Ingwersuppe, danach Pene Pollo (mit Curry) und einen lecketen Cappuccino...alles Top...auch das Tirami-Su kann ich sehr empfehlen, sehr locker und nicht so schwer und süß wie das in Deutschland oft so üblich ist...Beide Daumen hoch! :-)",5,2.12.2013
326,Dolcini,4.5,35,Italienisch / ,Mitte,2,Unknown,"eigentlich 4,9 Sterne; zur Perfektion fehlt nur ein Schuß mehr Ambiente. Essen ist super, hatte ein perfekt Medium Rare gebratenes Steak mit Spargel  auch Extrawünsche werden berücksichtigt. Mario, der Kellner, war super locker und frech, hat Spaß gemacht mit ihm. Service trotzdem gut und schnell (wir waren allerdings abends da; mittags soll es ja wohl etwas voller sein).Preis-Leistungs-Verhältnis in jedem Fall top! Zu empfehlen!",4,27.4.2012
327,Dolcini,4.5,35,Italienisch / ,Mitte,2,S. Thomas G.,"Das Dolcini in Mitte in unmittelbarer Nähe der Friedrichstraße ist ein kleines, nettes Lokal. Die Auswahl der Speisen ist übersichtlich (keine Pizza). Wir waren in der Mittagspause dort und die Preise sind für dieses Pflaster allemal beachtlich, wenn man dann auch noch die befriedigende Qualität der Speisen sieht. Sicher keine Küche auf hohem Niveau aber solide und handwerklich in Ordnung.Punktabzug gibt es für den Service, der mir z.T. etwas überfordert vorkam. So, ließ der Löffel für die Spaghetti etwas arg lange auf sich warten und auch der Kaffee kam recht spät. Der etwas beengte Raum ist sicher Geschmackssache.",3,31.8.2011
328,Dolcini,4.5,35,Italienisch / ,Mitte,2,Anna M.,"Essen und Preise sind top, der Service ist leider enttäuschend. Wenn man zu zweit hingeht, ist es i.d.R. ok, manchmal dauert es etwas lange, aber es ist eben auch ein kleiner Laden. Wir waren jetzt 2x als Abteilung (8-10 Personen) dort und wurden wirklich enttäuscht. Jüngstes Beispiel: wir hatten reserviert, kommen an und da sitzen schon 2 Pärchen an dem ""langen"" Tisch. Wir waren genau 6 Min zu spät (hatten jedoch auch eine Rufnr. hinterlegt sodass man uns hätte erreichen können). Wir standen dann zu 8. 10 Minuten in unseren dicken Mänteln mitten im Lokal und mussten warten, bis die beiden Pärchen an andere frei werdende Tische umziehen konnten (die fanden das übrigens auch nicht so lustig). Zudem wurden wir gebeten, doch jetzt bitte schon im Stehen zu bestellen. Als wir dies taten, kam der Kommentar ""oh, das wird aber lange dauern, Sie nehmen ja alle etwas anderes"" (wohl bemerkt, es gibt dort nur Nudelgerichte). Wieso sollten wir auch alle das gleiche nehmen? Bei der Rechnung wurden wir aufgefordert uns die einzelnen Posten doch bitte selbst auszurechnen, nur widerwillig hat die Kellnerin einzeln abgerechnet. Und das war alles kein Einzelfall, als wir schon mal im Juli da waren, war es sehr ähnlich. Sodexo Checks werden seit neuestem auch nicht mehr akzeptiert, natürlich ohne Hinweis darauf an der Tür o.ä. Es gibt dort in der unmittelbaren Umgebung einfach zu viele bessere Mittagslokale, sodass wir als Abteilung dort sicherlich nicht noch einmal hingehen werden. Sehr schade, das Essen ist nämlich echt gut, aber auf so einen Ärger hat man in der Pause einfach keine Lust!",3,2.1.2016
329,Dolcini,4.5,35,Italienisch / ,Mitte,2,Georg H.,"Eigentlich wollten wir in Nö, dieses war leider zu und so sind wir zufällig im Dolcini gelandet. Ein etwas untypischer Italiener: Es gibt/gab(?) keine Pizza. Dafür aber 1a Pasta und eine gute Weinauswahl.. Preislich völlig in Ordnung. Gerne wieder.",4,23.4.2010
330,Gayaya,4.5,20,Vegetarisch / Asiatisch / ,Mitte,1,Nikolaus H.,"Asiatische Cross-Over-Küche, vegetarisch und vegan - das ist das Programm des Gayaya. Das Lokal ist stilsicher eingerichtet und spiegelt das Fusion-Konzept der modularen Karte wieder. Diese bietet Hauptgerichte zu acht Euro, aber auch mehrgängige Menüs mit fairen Preis-Staffelungen für mehrere Personen. Ich entscheide mich für das ""Bento Madame"". Wie in der Karte empfohlen, lasse ich mich von der perfekt freundlichen Bedienung, und der Küchenchefin Chang, überraschen. Man folgt Prinzipien aus der 5-Elemente-Küche.Es geht los mit ""Kokossuppe"" (mit einer schönen Schärfe), gefolgt von Avocado-Sushi mit roter Beete. Weiter geht es mit dem ""Ga Ya Ya-Curry"" mit Kartoffeln, Zuckerschoten, Roter Beete, Rucola und Naturreis - einfach sensationell! Den Abschluss bildet ""Gelber Ga Ya Ya"", eine Mango-Creme mit Zimt und Granatapfel.Fazit: Asiatische Köstlichkeiten, mit Charme serviert.Kategorie: Moderat Ambiente: Fünf SterneService: Fünf SterneQualität der Speisen: Fünf SternePreis-Leistungs-Verhältnis: Fünf SterneWiederbesuchs-Faktor: Fünf Sterne",5,29.12.2018
331,Gayaya,4.5,20,Vegetarisch / Asiatisch / ,Mitte,1,Julika M.,"Als Besucherin Berlins für einen Tag habe ich mir schon vorab das Ga Ya Ya rausgesucht und meine Erwartungen wurden übertroffen! Die Inhaberin selbst hat mir bei der Auswahl der Speisen geholfen - ich habe nur gesagt, dass ich gern sehr scharf esse, es vegan sein muss und ich gerne den Algensalat hätte. Ich hatte eine Kokosnuss-Curry-Ingwer Suppe, den gewünschten Algensalat, ein sehr leckeres Gemüsecurry mit extra frisch geschnittenem Chili. Obwohl ich nur diese drei Sachen bestellt hatte, brachte man mir noch einen süß-sauren Glasnudelsalat und Kokosmilchreis aufs Haus. Die Portionen sind alle klein, deshalb kann man viel probieren, aber da ich an diesem Tag keinen großen Hunger hatte, habe ich zum Teil den Reis vom Curry, den Glasnudelsalat zur Hälfte stehenlassen und habe den Nachtisch nur probiert. Fazit: Lieber Service, experimentelle asiatische Küche, sehr günstig - gerne noch mal!",5,12.12.2015
332,Gayaya,4.5,20,Vegetarisch / Asiatisch / ,Mitte,1,Kathi B.,"Kaum bin ich in der Nähe und habe etwas Zeit zu überbrücken, zieht es mich ins Gayaya. Egal, was man hier bestellt, man kann sicher sein, es ist lecker und gesund.Dieses Mal hatten wir einen Glasnudelsalat, einen riiiesigen Mangolassi und die hausgemachte Limonade, einfach grandios. Allein dieser Glasnudelsalat ist so ein tolles Geschmackserlebnis, das möchte man einfach immer wieder haben!Das Curry in Eile (auch ohne Eile zu genießen...) ist auch sehr zu empfehlen, oder man vertraut einfach Chang und ihren Künsten und lässt sich überraschen.",5,21.1.2015
333,Gayaya,4.5,20,Vegetarisch / Asiatisch / ,Mitte,1,Corinna C.,Niemand geht ans TelefonRufen schon seit Wochen an. Haben schon für Menü bezahlt und können nicht reservieren....,1,26.2.2018
334,Gayaya,4.5,20,Vegetarisch / Asiatisch / ,Mitte,1,Aileen G.,"Irgendwie anders, als ich es erwartet habe. An einem verregneten, grauen Tag ist die Stimmung in Berlin meist betrübt. Da hilft eigentlich nur eine warme Suppe. Also auf ins Gayaya, in dem die farbenfrohe Mango-Kokosnuss-Nudelsuppe gleich für bessere Laune und innere Wärme sorgen sollte. Aber auch dort wirkte alles chaotisch, und irgendwie ungemütlich. Die Speisekarte suchte ich mir selber vom Nebentisch. Bestellt werden kann anscheinend nur auf Nachfrage, von alleine kam niemand und hat gefragt, ob ich etwas trinken oder essen wolle. Die Suppe kam dafür umso flinker und sah sehr gut aus. Dezente Schärfe von Chili und Ingwer, abgerundet mit Erdnüssen und Zitronengras. Leider leider leider waren die Nudeln totgekocht und konnten mit den Stäbchen nicht gegessen werden. Und die drei Streifen Gemüse waren auch übersichtlich. Mhhhh.Vielleicht muss man außerhalb des Mittagstisches kommen. Den das Gayaya hat Potential und das Essen war wirklich gut und günstig.",4,23.6.2015
