,Restaurant Name,Overall Rating,Total Reviews,Specialty,Region,Price Range,Author,Comment,Rating,Date
149,Midtown Grill,3.9,39,Steakhouse / BBQ & Barbecue / ,Tiergarten,3,Unknown,"Aktualisierung:Bewertung zum Essen am Freitag Abend:Ich kann Midtown Grill an einem Freitag Abend definitiv abraten. Während man unter der Woche auf relativ wenig Leute im Midtown Grill trifft ist alles im Grunde genommen in Ordnung. Ganz anders jedoch an einem stärker frequentierten Wochenende-Abend. Das eine Vorspeise gute 30 Minuten braucht und das Hauptgericht über 1 Stunde gehört hier anscheinend zum guten Standart. Also sollte man viel Zeit einplanen für einen solchen Besuch.Wenn man dann meint, man werde für die lange Wartezeit durch das Essen entschädigt, der täuscht sich.Wir hatten an dem Abend unter anderem 3 Steaks Well-Done welche allesamt einer Schuhsohle glichen.Ohne Ketchup kaum essbar.Auf die Nachfrage der Kellnerin ob es denn schmecke und der Antwort: Wenn sie auf Schuhsohlenartige Konsistenz stehen dann ja."" ging sie ihres Weges unbekümmert.Résumé: Hotelrestaurant was sich nicht sonderlich um Ihre Kunden kümmert. Unter der Woche kann man dort einigermaßen gut essen. Am Wochenende werden wir diesen Laden in Zukunft jedoch meiden.Wär einen guten Tausender an einem Abend zu 7 ausgibt erwartet definitiv mehr. Von gehobener Klasse kann hier nicht mehr die Rede sein. Meine ursprünglichen 3 Punkte (unter der Woche) wurden nun in der Gesamtbewertung auf 1/5 hinabgestuft.Ursprüngliche Bewertung: Fleisch ist ganz gut. Weinkarte weist keine Jahrgänge auf. Auf Nachfrage ist niemand in der Lage einen Wein nach dem Jahrgangswunsch zu finden. Personal ist bischen fähiger als im Wilsons aber in der Preisklasse immernoch zu schlecht. Essen 4/5Personal 1/5",1,11.8.2013
150,Midtown Grill,3.9,39,Steakhouse / BBQ & Barbecue / ,Tiergarten,3,Unknown,Klasse steak Restaurant der gehobenen (Preis) klasse. Bis hin zu wagyu alles zu haben. Einen Besuch Wert!!,5,20.7.2013
151,Midtown Grill,3.9,39,Steakhouse / BBQ & Barbecue / ,Tiergarten,3,Unknown,"Es ist gar nicht so einfach, in Berlin einfach mal ein wirklich ordentliches Steak zu bekommen. Für mich gibt es - bisher - nur zwei Adressen: Das Entrecote und den Midtown Grill. Der Midtown Grill ist das Restaurant des Hotels Marriot, entsprechend hoch sind die Preise. Aber für rund 30 Euro bekommt man hier wirklich ein fantastisches Rinderfilet mit Prommes Frites. Das Fleisch ist exzellent, großartig gegrillt und wird zusammen mit einem Mini-Klecks Gemüse serviert. Aber wer will hier schon Gemüse essen - hier geht es um Steaks. Kein Vergleich mit den einschlägigen Steakhouse-Ketten. Hier ist alles zwei Nummern besser. Lieber einmal hier essen als zweimal woanders. Dass man hier Wert auf Qualität legt, ist schon an einem kleinen Detail zu erkennen: Zu dem Pommes Frites kommen zwei kleine Gläser (!) mit Ketchup und Mayonnaise von Heinz. Und mit der saftigen Rechnung kommt ein kleiner Grill, auf dem man zum Abschluss noch ein paar Marshmallows brutzeln kann. Für Steak-Liebhaber eine uneingeschränkte Empfehlung!Nachtrag 5.3.2009:Mittlerweile ist allerdings der Service etwas nervig. Es werden offenbar nur Auszubildende eingesetzt, die einerseits etwas unorganisiert und unsicher sind. Andererseits offenbar einer Gehirnwäsche durch ihre Schule unterzogen wurden. Statt dem sektengrinsenden Hallo, ich bin der/die xy und heute abend für Ihre Betreuung zuständig wäre es mir wichtiger, dass die Servicekräfte den Unterschied zwischen medium rare und medium kennen würden. Und dass jedesmal so getan wird, als sei der kleine Marshmallow-Grill zur Rechunung DIE Sensation, nervt auch. Außerdem wäre es schön, wenn man im fast leeren Restaurant rasch einen Tisch bekommen würde und nicht zugucken müsste, wie das Personal die Zuständigkeit dafür klärt.Dennoch: Die Steaks sind einfach klasse! Und das ist ja das Wichtigste ;-)",4,4.7.2008
152,Midtown Grill,3.9,39,Steakhouse / BBQ & Barbecue / ,Tiergarten,3,Sören F.,"Leider hatte ich diesmal nur die Gelegenheit, die Qualitäten des Frühstücksbuffetts zu erleben. Aber dieses macht schon Lust auf mehr. Ist zwar nicht die klassische Gelegenheit, ein Steakhaus kennzulernen, resultiert aber daraus, dass ich im Marriott nächtigte und das Frühstück halt hier ausgerichtet wird. Das Restaurant selbst macht schon auf den ersten Blick Lust auf mehr. Ein modern eingerichtetes Steakhaus mit einer langen Theke als Blickfang des Raumes. Hier ist ein köstliches Frühstücksbuffet aufgebaut, das keine Wünsche übrig läßt. Sowohl mehrere Varianten von warmen Speisen, eine große Auswahl frischen Gemüses, verschiedene Brotsorten, Marmeladen, vegetarische Leckereien als auch sehr appetitlich angerichtete Trockenfrüchte, Salate und Joghurts sind vorhanden. Hier habe ich zum ersten Mal zum Frühstück saftige Trockenfrüchte mit Mandelsplittern bekommen, dazu sehr gutes Bircher Müsli, eine Tageszeitung und guten Kaffee. So kann der Tagesstart nur gelungen sein. Derv Service auch zu der frühen Morgenstunde in Berlin war ausgesprochen gut, sehr nett, zuvorkommend und umsichtig. Also das Frühstück war perfekt, der Preis aber etwas überzogen mit  24,00 € (?) pro Person. Dafür kann man aber vom Aussenbereich einen Teil des Brandenburger Tores einsehen und hier in der Sonne die vorbeiflanierenden Touristen begutachten. Und geht man ein Stück in der Geschichte zurück, sitzt man virtuell vielleicht sogar auf einem Mauerstück. Und zentraler geht es kaum, 2 Minuten bis zum Potsdamer Platz, der ""neuen Mitte"" Berlins. Auf alle Fälle muss ich beim nächsten Mal die ""besten Steaks der Hauptstadt"" probiern. So zumindestens die Werbung.",5,8.5.2011
153,Midtown Grill,3.9,39,Steakhouse / BBQ & Barbecue / ,Tiergarten,3,Unknown,"Excellente Steaks, guter Service. Wir warn vom Caesar Salad begeistert. ES",5,1.5.2013
154,Midtown Grill,3.9,39,Steakhouse / BBQ & Barbecue / ,Tiergarten,3,Unknown,"Bei unseren bisherigen Besuchen überzeugte uns die gute Qualität der verwendeten Produkte sowie die handwerklich hervorragende Zubereitung der Speisen. Die Karte hält neben den obligatorischen (Rinder-)Steaks auch empfehlenswerte Thunfischsteaks und aussergewöhnliche Beilagen bereit. Die Raucherlounge ist angenehm belüftet und mit Kamin, Ledersesseln und Bücherregalen sehr gemütlich und einladend gestaltet. Highlights sind auf jeden Fall die ausgefallene Salzkarte, die Möglichkeit, zum Dessert eine Postkarte zu verschicken und derTischgrill, der das Zahlen der Rechnung etwas versüßt. Die große Weinauswahl hält für jeden Geschmack etwas bereit. Der Stern Abzug resultiert aus dem teilweise eher langsam arbeitenden Service (Tisch wurde bei einem unserer Besuche erst spät abgeräumt und wir mussten etwas länger auf die Rechnung warten, was an den Tischen um uns herum ebenfalls zu beobachten war) sowie einer seit unserem ersten Besuch nicht nennenswert geänderten Karte (ein bisschen saisonale Abschwechslung wäre schön). FAZIT: Insgesamt eher 4,5 als 4 Sterne, tolles Essen, entspannte Stimmung, ein Besuch lohnt sich auf jeden Fall.",4,1.4.2013
155,Midtown Grill,3.9,39,Steakhouse / BBQ & Barbecue / ,Tiergarten,3,Unknown,"Der Ausschläfer-Brunch im Midtown Grill ist sehr gut. Es gibt alles, was man sich nur vorstellen kann. Von Hering bis Sushi, von Käse bis Weißwürste mit Brezeln. Natürlich kann man sich auch Steaks braten lassen. Die Getränke wie frisch gepresster Orangensaft, Prosecco, Kaffee, Tee usw. sind im Preis enthalten.",4,8.6.2008
156,Midtown Grill,3.9,39,Steakhouse / BBQ & Barbecue / ,Tiergarten,3,Unknown,"Super atmosphäre, super essen, spitzen personal, tolles ambiente, aufmerksamkeit pur, alles was das herz begehrtein wundervoller abend gewesen und immer immer wieder gerne!!!",5,1.2.2013
157,Midtown Grill,3.9,39,Steakhouse / BBQ & Barbecue / ,Tiergarten,3,Unknown,"Wir waren wie im letzten Jahr wieder zum Truthahn-Essen im MTG. Die Bedienung war sehr freundlich, aber die Kellner waren ziemlich unkoordiniert. Während die eine Bedienung den Truthahn tranchierte, kamen die anderen Kellner nicht auf die Idee schon mal die Beilagen zu servieren, so daß das Fleisch dann Stück für Stück weiter auskühlte, bis man endlich einen komplett belegten Teller mit Truthahn und Beilagen hatte. Ausserdem schien der Truthahn erwärmt und nicht für uns auf den Punkt zubereitet, was bei einer verlangten mindestens zwei Tage vorher stattfindenden Reservierung möglich wäre. Daher war die Haut nicht knusprig und das Fleisch ziemlich trocken.Der Skandal ist aber die Weinkarte und die Uneinsichtigkeit der Bedienung in diesem Punkt. Es ist nämlich in der Weinkarte vermerkt, daß wenn nicht vorhanden, auch andere Jahrgänge der Weine serviert werden. Nun geht man als Gast aber davon aus, daß man erstens informiert wird, wenn der bestellte Jahrgang nicht da ist, und die Jahrgänge anders bepreist sind. Für mich ein Grund dort nur noch Steaks zu essen und doppelt hinzu schauen, wenn der Wein gebracht wird.",3,13.12.2012
158,Midtown Grill,3.9,39,Steakhouse / BBQ & Barbecue / ,Tiergarten,3,Unknown,"Am Anfang haben wir von der Bedienung eine Visitenkarte bekommen - handschriftlich war dort sauber ihr Name eingetragen; sie sei heute für uns zuständig. Fein! Nettigkeit und Geschwindigkeit sollten an einem Sonntag-Abend auch kein Thema sein - war mehr Personal als Gäste da.Mit den viel zu großen Speisekarten, mit dem man seine Mitgäste durchaus erschlagen kann und nach der Auswahl auch nicht weiß - wohin mit dem Ding - fing der gruselige Abend an. Bedienung war bemüht, aber nicht wirklich überzeugend. Wartezeiten viel zu lang; Getränkeumsatz wohl verpöhnt. Der Teller war zu große für den - warum auch immer vorhandenen - Unterteller; das Schneiden des Fleisches war somit akkustisch immer untermalt. Bei der Kartoffel-Beilage merkte man, dass es heute insgesamt nicht viele Gäste waren; die Schale so hart, das man sie nicht mit dem Steak-Messer durchbekam (!!) und diese Kartoffel-Käse-Schinken Masse geschmacklich eine Beleidigung - Meine Kritik wurde kommentiert mit ""Das ist auch keine Ofenkartoffel"" - da ich den gleichen Spruch vom Koch an der offenen Küche zur Bedienung hörte, schien diese Abwehr schon eingeübt und refelxartik. Meine Kritik hörte man sich an. Die zuständige Bedienung flörtete aber bereits seit 20 Minuten mit dem anderen Tisch, für den sie zuständig war; also traf es eigentlich die Falsch. Man versuchte dann noch mit Kaffee oder Marsh-Mellows aufs Haus zu beschwichtigen; trotzdem war die Kartoffel auf der Rechnung - ach ja; der Stift zum unterschrieben des Kreditkarten-Beleges fehlte auch und somit ebenfalls ein Trinkgeld. Rache muss sein!Ich kann nur sagen: FINGER WEG. Fleisch ist OK, aber nur Fleisch kann es ja auch nicht sein - bei dem Preis...",1,22.3.2010
159,Midtown Grill,3.9,39,Steakhouse / BBQ & Barbecue / ,Tiergarten,3,Unknown,"Wer gern Flesich isst, geht ins Steakhaus. Wer gern gutes Fleisch ist und bei wem auch noch die Brieftasche etwas locker sitzt, der geht ins midtowngrill. Wirklich allerbestes Männeressen, eine sehr nette und unaufdringliche Bedienung und ein schönes Ambiente. Mehr als empfehlenswert.",5,30.8.2011
160,Midtown Grill,3.9,39,Steakhouse / BBQ & Barbecue / ,Tiergarten,3,Unknown,"An der speisenqualität sowie an der weinkarten gibt es nichts Tu bemängeln.location,deko tischgedeck wirklich toll. Super Atmosphäre ! Nur am servicePersonal sollte gearbeitet werden.leider war man mit den einfachsten Fragen überfordert.",4,20.6.2012
161,Midtown Grill,3.9,39,Steakhouse / BBQ & Barbecue / ,Tiergarten,3,Unknown,"Super Service, Super Essen, Super Ambiente eines der besten Steakhäuser im Deutschland",5,4.11.2012
162,Midtown Grill,3.9,39,Steakhouse / BBQ & Barbecue / ,Tiergarten,3,Unknown,Das Essen war amerikanisch ohne Schörkel. Im Restaurant ist die Küche gut einsehbar. Als Goody gibt es Brot mit Dip. Es gibt eine Happy Hour mit einer Flatrate für Steaks.,3,29.11.2007
163,Midtown Grill,3.9,39,Steakhouse / BBQ & Barbecue / ,Tiergarten,3,Unknown,"Das Midtown-Grill wurde eigentlich dadurch bekannt,dass es im Radio Werbung machte für seine Steak-Flatrate.Ich wollte früher schon mal dorthin um diese auch auszutesten.Allerdings kam ich nie dazu.Nun weiß ich gar nicht,ob diese Flatrate überhaupt noch angeboten wird.Bei unserem Besuch habe ich leider auch nicht mehr daran gedacht.Wie auch immer,das Restraurant versprüht eben den typischen Charme eines Hotel-Restaurants,geräumig,sehr steril eingerichtet und alles auf schnelle Abfertigung ausgelegt.Nicht das es jetzt an unserem Platz,Fensterfront,ungemütlich war,aber der Wohlfühlcharakter wollte nicht so richtig überschwappen.Man sah auch andere Gäste,die sich nicht gerade wie daheim fühlten.Das mag auch an den Holztischen liegen,die man auch in jedem zweitklassigen Hotel vorfindet.Die so genannte Showküche war auf der linken Seite platziert.Loben muss man,dass es zu keinem Zeitpunkt nach Essen roch.Ein Mitbegleiter hat sein Steak medium rare bestellt,doch leider kam es medium,was ich sehr schade fand,da sie sich ja selbst als ""DAS"" Steakhaus Berlins betiteln.Trotzdem waren die Steaks im Geschmack wirklich okay,auch die Beilagen gingen in Ordnung.Jedoch muss man sagen,dass jetzt nicht zu den besten Steakhäusern Berlins gehört,für mich.Die Preise sind einigermaßen moderart und spiegeln natürlich auch die Lage,Potsdamer Platz,wieder.Was den Service anbetrifft,muss gesagt werden,dass sie äusserst kompetent waren, still und leise arbeiteten.Ob ich nochmal dort hin gehen werde,wird sich zeigen...aber um einen gemütlichen Abend zu verbringen gibt es sicherlich,kleinere,schmuckhaftere Restaurants,die es auch verstehen, Essen/Steaks schmackhaft zu zubereiten.",4,22.2.2010
164,Midtown Grill,3.9,39,Steakhouse / BBQ & Barbecue / ,Tiergarten,3,Unknown,"Die ausgesprochen positiven Eindrücke des Besuchs vom November des Vorjahres im Kopf, kehrte ich recht schnell wieder in dieses Restaurant zurück. Das erste, was ich wahr nahm, war: Sehr voll (spricht ja bekanntlich in den meisten Fällen für das Restaurant) und sehr laut. Dafür kann natürlich das Restaurant erstmal nichts - dennoch war es etwas störend, auch im weiteren Verlauf des Abends.Bei diesem Besuch fiel mir positiv die Gestaltung einer Ecke des Restaurants auf, eine Art modernes, großes Weinregal. Andere Elemente, die bestimmend für das Lokal sind, haben natürlich weiter Bestand: die offene Küche im Restaurant (ohne dass dies unangenehmen Geruch im Restaurant bewirkt) und die dort integrierte Showvitrine mit den besten Fleischsorten. Vielleicht war es ein Fehler zu bestellen, ehe ich in die Showvitrine sah. Das Fleisch war optisch nicht so gut wie beim letzten Mal und in der Konsequenz auch das servierte Striploin-Steak. Es war insgesamt nicht so zart und es gab sogar Stücke, die nicht zu essen waren (sehnig). Auch wenn diese Teile klein waren, geht das nicht bei dem Anspruch und dem Preis mit dem dieses Fleisch verkauft wird. Immerhin spricht das Restaurant in der Karte vom besten Fleisch, was zu bekommen ist und läßt sich 100g mit 13 € bezahlen ! Zum Glück war die Zubereitung an sich (Würzung etc.) weiter top - davon versteht man was in diesem Restaurant. Bei den Beilagen wählte ich zum einen Bratkartoffeln. Die waren eindeutig nicht kross genug gebraten. Das bunte Gemüse war gut, vorallem von guter Konsistenz und frisch. Zuvor hatte ich wieder Rindercarpaccio. Das war weiterhin so gut wie beim letzten Mal und sehr kreativ von den Zutaten und der Art der Präsentation. Sehr gut finde ich nach wie vor die Extras zum Essen: Drei verschiedene Dips zum Brot am Anfang (hier könnte allerdings eine bessere Servierform gefunden werden), Die Karte mit sicherlich 15-20 verschiedenen Salzen zum Steak und die Schoko-Marshmallows am Schluß zum selbst zubereiten an der offenen Flamme am Tisch. Dennoch: in Summe war das Essen zwar weiter sehr gut, aber auf Grund der genannten Einschränkungen nicht mehr so top wie beim letzten Mal.Die Bedienung war von Anfang an freundlich und schnell und auch am gesamten Abend in einem guten Bedien-Rhythmus. Die tolle Beratung mit Erläuterungen zum Fleisch, Wein und zu den Salzen, die ich beim letzten Mal noch genoß, fehlte aber diesmal komplett - vielleicht mit Blick auf den doch hohen Gästeandrang. Trotz gutem Niveau fehlte diesmal die Art der Bedienung vom letzten Mal, ein besonderes Flair zu verbreiten.In Summe war es auch diesmal ein guter Restaurantbesuch, allerdings bin ich doch nicht so stark angetan wie beim letzten Mal. Mit Blick auf die nicht unerheblichen Preise (als Ergänzung: ein Martini z.B. € 7,-, 0,75l San Pellegrino € 7,50, Bratkartoffelbeilage € 4,-) müßte man es aber eigentlich sein.Sicher werde ich irgendwann nochmal zurück kehren und hoffe dann wieder auf die Topqualität vom November.",4,29.4.2011
165,Osmans Töchter,3.9,39,Türkisch / ,Prenzlauer Berg,2,Dirk E.,"Very Berlin!Wer auf kleine Portionen zum Teilen steht, viel ausprobieren möchte und gerne von anderen Tellern isst, ist hier richtig.Osmans Töchter hat viele kalte und warme Meze auf der Karte.Empfohlen werden 2-3 Meze, um Satt zu werden.Das ist nicht gerade günstig bei einem Preis ab 8€ , aber die kleinen ""Schweinereien"" reißen es mit Frische und Geschmack wieder raus.Wer einen gemütlichen Abend zu Zweit oder aber in einer Gruppe macht, ist hier richtig um sich einmal durch die türkische Küche zu schlemmen.Der Service ist zwar nicht flott, aber sehr freundlich und hilfsbereit.TIPP!Reservierung  empfohlen, denn ich habe den Laden noch nie lehr gesehen.Und als Weißwein unbedingt den Suvla (mit 14% der richtige Begleiter für die nacht ;-)  )",5,12.10.2021
166,Osmans Töchter,3.9,39,Türkisch / ,Prenzlauer Berg,2,Norbert L.,"Berlin ist die gefühlt wohl größte türkische Stadt außerhalb der Türkei. Der türkische Gemüsehändler mit der Blumenstrauß großen Petersilie für 2,50 €, der Döner als das! Fast Food der Stadt und eben die türkischen Restaurants sind eingeführte Größen in dieser Stadt des Wandels. Mann und Frau und können zum Döner und den türkischen Restaurants wegen des Fleischkonsums stehen wie sie wollen, aber es ist fast überall sehr ähnlich und wenn man will gleich gut.Nun zu Osmans Töchter. Ich wollte da schon lange einmal essen gehen, zuviel gutes hatte ich als Urberliner darüber lesen dürfen die letzten Jahre und heute war dafür aus vielen Gründen (2 Freunde hatten Zeit und als Paar zu begleiten) der richtige Tag.ZäsurEs ist alles fake und seelenlos und auf eine bemerkenswerte Weise ""untürkisch"". Sei es die verpeilte aber sonst liebe junge Bedienung die die bestellte Mercimek nicht einordnen konnte - sorry ich kann kein türkisch!. Sei es das Vielvölkergemisch angefangen von Köchen und Bedienungen, die türkische Gastfreundschaft nicht einmal buchstabieren können.Es war alles dabei was den Gast ""begeistert"" - einer durfte immer alleine essen, weil, naja, warme Vorspeisen immer nach den kalten kämen - so so;-)Nun zum Essen, die laminierte Essenskarte ist bemerkenswert buntb gehalten, gefühlt wird hier jede/r satt. Es ist nur untalentiert, unmotiviert zubereitet. Die Lammspieße waren von der Grundlage des Fleischer her top Qualität. Nur den Grill hätten sie gerne in voller Flamme und so zwei drei Minuten gerne länger besucht. Lauwarme Lammspieße ohne Röstaromen retten ein Petersilien Ölgemisch nicht mehr wirklich. Fladenbrot ist warm und fluffig. Ehrlich, sorry, das! kann - sorry - jede Döner Bude besser.Im Fazit ist Osmans Töchter alles und wirklich alles andere als ein traditionsgeführtes Restaurant mit türkischer Küche. Da rettet auch das hippe Einrichtungskonzept nichts von der seelenlosen und kochtechnisch komplett unambitionierten Küche und Atmosphäre.Am Ende war das Ganze auch noch teuer, zu teuer für das Gebotene.Mein Tip an alle Berlin Besucher die die türkische Küche kennenlernen wollen, geht nach Kreuzberg türkisch essen. Osmans Töchter sind ein cleveres auf den Geldbeutel des Gastes abzielendes Geschäftskonzept das den Appetit auf die türkische Küche verderben kann. Schade fände ich!",2,18.4.2022
167,Osmans Töchter,3.9,39,Türkisch / ,Prenzlauer Berg,2,Christian B.,"Ohne Frage und viel Vorrede: das ist wohl eines der besten Restaurants türkischer Küche in Berlin. Der Service ist perfekt - mit angenehmen Mix aus unaufgeregter Aufmerksamkeit und herzlicher Freundlichkeit. Die kalten und warmen Meze sind durchweg köstlich, wobei die Empfehlung ""6 Meze für 2 Personen"" dazu führte, dass wir einige Reste mitnehmen mussten. Alles in allem eine tolle kulinarische Erfahrung.Zwei Sterne Abzug gibt es dafür, dass auch in 2019 keine Option für bargeldlose Zahlung angeboten wird. Und das, obwohl die Servicekräfte betonen, dass sich ständig Gäste darüber aufregen. Welchen Grund kann es geben, die Geschäft nur bar abwickeln zu wollen? Die Gebühren sollten bei der Preisgestaltung nicht das Thema sein. Und wenn die Kundschaft danach ruft, wäre das doch sicher eine Überlegung wert. Zu zweit lässt man dort locker 70 Euro (100 Euro inkl Wein). Kartenzahlung sollte also selbstverständlich sein.",3,13.5.2019
168,Osmans Töchter,3.9,39,Türkisch / ,Prenzlauer Berg,2,Sascha G.,"Osman's Töchter ist einfach in jeder Hinsicht fantastisch.Die Speisen - man bestellt hier mehrere kleine Portionen für alle am Tisch zum Teilen - sind ein reines Geschmacksfeuerwerk. Die Gewürze und Zutatenkombinationen sind frisch, modern, exotisch und überraschend zugleich - dabei jedoch nie überdreht. Alleine die Schafskäsecreme mit Trüffel und Krokant reißt mich immer wieder vom Hocker. Der Tintenfisch mit Chili, die ausgelösten Hähnchenschenkel, die Köfte - alles hinterlässt ein angenehmes Gefühl auf dem Gaumen.Die Getränke runden das Ganze dann noch ab. Der gute Wein und die hausgemachten Limonaden lassen echt keine Wünsche offen.Und wenn man denkt, das wäre schon das Beste an Osman's Töchter, setzt der Service hier noch einen drauf. Ich habe selten so entspannte, aufmerksame und freundliche Kellner erlebt.Und dass die Atmosphäre eine ebensolche Entspanntheit verbreitet ohne die Berlin-typische Gleichgültigkeit und Unengagiertheit zu verbreiten, ist einfach nur angenehm.Wäre der Laden nicht so teuer wäre, würde ich hier jede Woche einkehren. Aber vielleicht ist es ganz gut, dass ein Besuch hier damit etwas Besonderes bleibt.",5,30.6.2017
169,Osmans Töchter,3.9,39,Türkisch / ,Prenzlauer Berg,2,Aileen G.,"Moderne anatolische Küche und ungewöhnlich hippiger Atmosphäre. Osmans Töchter ist so nah und doch gleichzeitig so fern an der traditionellen Küche. Ohne Reservierung kamen wir an einem Freitagnachmittag kurz nach der Öffnung, als die Vorbereitungen noch in vollem Gang waren. Obwohl der Laden vor Hektik vibrierte, wurden wir freundlich an einen Tisch gesetzt und nach allen Vorlieben verwöhnt: Die hausgemachte Limo bitte nicht zu süß, dieses bitte in Reihenfolge zu jenem etc., und was war nochmal diese Zutat? Geduldig und mit viel Liebe wurden wir bedient und beraten.Letztendlich entschieden wir uns für eine Vielzahl an Vorspeisen, da wir auf Grund des Wetters nur mäßigen Hunger verspürten. Alle Speisen waren frisch und hochwertig, wurden aber zügig serviert. Überzeugen konnten mich die Qualität der einzelnen Zutaten sowie die individuelle Würze. Besonders empfehlenswert sind die Schafskäsecreme und der Olivensalat. Die Speisen haben zwar satte Preise, sind meines Erachtens aber jeden Cent wert.",5,31.7.2016
170,Osmans Töchter,3.9,39,Türkisch / ,Prenzlauer Berg,2,Avicenna I.,"Kurz und knapp: Bedienung und Geschmack vom Essen waren ok (hat mich nicht so begeistert, aber über Geschmäcker lässt sich ja streiten). Die Minuspunkte gibt es aufgrund des schlechten Preis-Leistungsverhältnisses. Meiner Meinung nach sind die Gerichte (sehr KLEINE Portionen) extrem überteuert. Hätte mir für diese Preise grössere Portionen erwartet. Weiteren Punktabzug gibt es, dass man im Jahre 2020 in einem so gehypten ""Restaurant"" nur in bar bezahlen kann. Fazit: Geschmacklich nicht schlecht, nur sind die Gerichte sehr überteuert. Es war mein erster und letzter Besuch.",2,2.1.2020
171,Osmans Töchter,3.9,39,Türkisch / ,Prenzlauer Berg,2,Lili B.,"Alles in allem ist das Restaurant eine schöne Anlaufstelle. Das Ambiente ist einladent und man sitzt sehr nett. Ich liebe das Konzept der Meze, dass man viele Kleinigkeiten bestellt und alles teilt. Geschmacklich hat alles gut geschmeckt, mich aber auch nicht vom Hocker gehauen. Unter anderem hatten wir Hummus und die Schafskäsecreme bestellt. Da nur ein kleiner Brotkorb gereicht wurde, mussten wir mehrmals nach mehr Brot fragen was irgendwann unangenehm wurde. Gerade bei solchen Gerichten ist ausreichend Brot zum dippen für mich Voraussetzung. Die einzelnen Preise finde ich okay, aber dadurch dass man so viel einzeln bestellt, wird es irgendwann teuer. Dadurch ist es wirklich eine Frechheit, dass Kartenzahlung nicht möglich ist. Mit einer Gruppe kommt man schnell auf ein paar hundert Euro, die man unter Umständen nicht immer bar dabei hat. Auch wenn aus den Automaten um die Ecke verwiesen wurde, finde ich Kartenzahlung bei den Preisen in 2020 Pflicht!",3,28.10.2020
