,Restaurant Name,Overall Rating,Total Reviews,Specialty,Region,Price Range,Author,Comment,Rating,Date
110,Midtown Grill,3.9,39,Steakhouse / BBQ & Barbecue / ,Tiergarten,3,Antje K.,"Nachdem wir viele Jahre nicht mehr im ""Midtown Grill"" waren, wollten wir ausprobieren, ob die Qualität wieder besser geworden ist.  Es war Dienstag Abend und fast alle Tische waren bereits belegt. Uns wurden die Jacken abgenommen und wir wurden zum Tisch geführt. Nachdem die Karten ausgehändigt wurden, wurden wir  sogleich über die Tagessuppe sowie den ""Fang des Tages"" informiert. Zudem wurde eine Extrakarte auf den Tisch gelegt, die nur verschiedenste Salze (z.B. Lemonsalz oder Hibiskussalz) aufführte, die man zum Steak oder Fisch bestellen konnte. Früher gab es immer Apple-Martinis, die in einem kleinen Cocktailshaker serviert wurden. Die Nachfrage ergab, dass es zwar noch möglich wäre einen Appletini zu bekommen, aber nicht in der gewohnten Darreichungsform. Letztendlich kam ein Glas mit grünem Inhalt ohne jegliche Dekoration (nicht mal der kleine Kirschapfel war im Glas) und ohne den bekannten tollen Geschmack. Das ganze für 12 € pro Glas.Die Vorspeisen (Salate und Suppen) und Hauptspeisen (je zweimal Steak mit Beilagen und zweimal Papageienfisch) schmeckten sehr gut. Leider wurde unser bestelltes Salz vergessen. Ebenfalls vergessen wurde bei uns der kleine Marshmallowofen zum Abschluss. Wir hatten 4 verschiedene Kellner, da ist es natürlich schwierig den Überblick zu behalten, was der Gast schon hat oder was noch fehlt. Besser wären hier feste Zuständigkeitsbereiche.Insgesamt waren wir aber trotz der Vergeßlichkeiten sehr zufrieden. Für zwei Cocktails, zwei Gläser Bier, 2 Gläser Cola, eine Flasche Wasser, vier Vorspeisen, vier Hauptgerichte und zwei Desserts haben wir inklusive Trinkgeld 250,00 € bezahlt.",4,11.3.2015
111,Midtown Grill,3.9,39,Steakhouse / BBQ & Barbecue / ,Tiergarten,3,Olaf D.,"Geschmack ist ja geschmäcklerisch. Nach gut einem Dutzend Besuchen in den vergangenen Jahren bin ich schon fast Stammgast. Mein erster Besuch hätte hier glatt auch nur mit einem Punkt abgeschnitten. Das Essen war damals gut und der Service schlecht. Immerhin lernte man bis zu sechs Personen des Hauses kennen. Heute ist das ALLES anders. Das Essen ist zu den gängigen Öffnungszeiten erstklassig und der Service kann sich ebenfalls sehen lassen. Wer ein hochwertiges Steak, nahezu egal von welchem Tier, essen möchte und egal in welcher Garstufe oder Grammatur, der ißt hier richtig. Eine Augenweide im Restaurant und inmitten ist die ""Küche"" man kann den ganzen Abend den Köchen auf die Pfanne oder den Herd schauen. Mir kommt es durch das angeschlossene Marriott Hotel immer wie ein Besuch in Amerika vor. Das Publikum setzt sich eher aus amerikanischen Gästen zusammen (so richtig voll ist es eher nicht aber gut gefüllt), die dort mit dem Zimmerpass die Speisen bezahlen. Mein Tipp: Salat des Hauses (8,- EUR), Filet Mignon 200 g (24,- EUR), Spinat (4,- EUR), Rotwein: Baron de Ley 0,2 l (12,- EUR) ... und die Kreditkarte nicht vergessen. Für zwei Personen wird ein niedriger dreistelliger Betrag fällig. Die Rechnung, egal ob mit Visa, Master, Zimmer oder bar wird jedes Mal mit einem kleinen Feuerchen und Marshmellows nebst Schokosplittern serviert ... ein süsses Ende. Wer sein Steak billiger essen möchte, muss ins Blockhouse gehen.",4,31.1.2011
112,Midtown Grill,3.9,39,Steakhouse / BBQ & Barbecue / ,Tiergarten,3,Claudia L.,"Hier stimmt für mich einfach alles. Herzlicher und professioneller Empfang auch ohne Reservierung am Samstag Abend. Wir bekamen einen schönen Tisch am Fenster und unser Kellner war aufmerksam ohne aufdringlich zu sein. Wir fühlten uns direkt wohl und konnten uns auf einen entspannten Abend freuen. Neben der umfangreichen Speisekarte, ist auch die Salzkarte nicht zu verachten. Die Weinauswahl war ebenfalls sehr gut. Nichts zu meckern :-)Die Idee mit der Dessertkarte als Postkarte zum Ankreuzen finde ich gelungen. Klingt zwar etwas kitschig, lockert aber die Stimmung nach dem Essen auf. Zum Abschied gibt es dann noch ein Marschmellow-Rösten am Tischgrill. Absoluter USP. Bleibt in Erinnerung. Das Ambiente ist gemütlich. Man sitzt sich nicht so sehr auf dem Schoß wie in anderen Restaurants. Perfekt geeignet fürs romantische Dinner, ein Geschäftsessen oder auch einen gepflegten Mädels / Jungsabend.Früher bin ich gerne ins Grill Royal gegangen. Jetzt ist das der Midtown Grill. Vielen Dank für den schönen Abend! Wir kommen gerne und bald wieder. Absolut empfehlenswert.",5,26.11.2012
113,Midtown Grill,3.9,39,Steakhouse / BBQ & Barbecue / ,Tiergarten,3,Peggy G.,"Für mich die Adresse Nummer 1, wenn es um ein anständiges Steak geht. Immer wieder eine Punktlandung  zart und saftig, frisch und aromatisch kommt es daher. Ausgefallen ist die Karte, nicht nur wegen der Vielfalt an Steaksorten, sondern auch ihres Formates wegen. Der Service ist souverän, aufmerksam und unaufdringlich. Für mich keine erkennbaren Abstriche.",5,6.5.2012
114,Midtown Grill,3.9,39,Steakhouse / BBQ & Barbecue / ,Tiergarten,3,Unknown,Sehr leckere Steaks zu maximalen Preisen. Guter Service und ein professionelles Ambiente.,5,9.3.2013
115,Midtown Grill,3.9,39,Steakhouse / BBQ & Barbecue / ,Tiergarten,3,Tim K.,"Wir waren neulich Abend dort, um mal wieder ein schönes und schmackhaftes Steak zu essen, anbei ein kurzer Bericht:Ambiente:Das Restaurant ist an das Marriot am Potsdamer Platz angegliedert. Ich würde das Design als moderne Interpretation eines klasischen US- amirikanischen Steakhauses beschreiben. Wirklich sehr stilvoll, alles im dunklen Holz gehalten. Top!Speisen:Die Vorspeise war bereits sehr schmackhaft (Krebs und Caesar Salad). Die Steaks waren dann hervorragend! Wirklich genau das, was wir gesucht hatten. Die Beilagen, die extra berechnet werden, waren ok, aber vor allem beim Grillgemüse besteht noch VerbesserungsbedarfPreise:Das Steak mit Beilagen kommt dann auf über 30 EUR. Muss man wissen, finde ich aber ok.Sevice:Sehr zuvorkommend und freundlich! Leider nicht überall selbstverständlich!Vergleich:Zuletzt waren wir im Tauro und Grillroyal. Ohne auf die Einzelheiten eingehen zu wollen, muss ich sagen, dass der Midtown Grill in dieser kleinen Liste unter dem Strich am überzeugensten war. Und zwar relativ deutlich (gefolgt vom Tauro).Sonstiges:Bedingt durch die Lage eine relativ hohe Touri Dichte. Mich hat das aber weniger gestört, da es zumeist kultivierte Menschen waren. Fazit:Klare Empfehlung",5,22.7.2013
116,Midtown Grill,3.9,39,Steakhouse / BBQ & Barbecue / ,Tiergarten,3,Unknown,"Nach drei Jahren waren wir mal wieder zum Brunch im Midtown Grill.Wir waren überrascht, dass nur wenige Gäste im Restaurant waren. Dementsprechend bescheiden war das Angebot der Speisen. Die Qualität der angebotenen Speisen war okay, aber nicht herausragend. Die Auswahl war eher bescheiden.Im Vergleich zu unseren Erfahrungen von vor drei Jahren, können wir den Brunch nur bedingt weiterempfehlen.",3,23.6.2013
117,Midtown Grill,3.9,39,Steakhouse / BBQ & Barbecue / ,Tiergarten,3,Unknown,AllgemeinSteak vom feinsten! Medium-Rare zum schwärmen! Die Qualiät rechtfertigt den Preis!BedienungSehr persönlich und freudnlich! Nicht unangenehm aufdringlich! Empfehlungen zur Salzkarte sollten auf Nachfrage möglich sein!Das EssenSirloin Flap Meat 250 g (Medium-rare) und Rib Eye mit Knochen 350 g (Medium-rare) perfekt gebraten!Das AmbienteZwar schön Eingerichtet aber ein Tisch neben der offenen Kücke (mit Tresen) und die sehr engen Durchgänge zwischen den Tischen machen das Ambiente doch sehr unruhig!,4,13.4.2014
118,Midtown Grill,3.9,39,Steakhouse / BBQ & Barbecue / ,Tiergarten,3,Frank D.,"Erstklassige Gastronomie in schöner Umgebung . Die offene Küche macht einen tollen Eindruck und wichtig man riecht Sie nicht .Die Staeks sind nicht billig , aber dafür erhält man auch was Besonderes . Wer sich also mal was exklusives leisten will  hier wäre er richtig .",5,30.11.2012
119,Midtown Grill,3.9,39,Steakhouse / BBQ & Barbecue / ,Tiergarten,3,Unknown,"Wir sind oft hier, alles ist ausgezeichnet!Die Steaks, das Stubenkücken, der Lachs Sehr gut.Dazu freundlicher und kompetenter Service. Volle Punktzahl !",5,15.9.2013
120,Midtown Grill,3.9,39,Steakhouse / BBQ & Barbecue / ,Tiergarten,3,Philipp B.,Beitrag folgt.,5,22.8.2007
121,Midtown Grill,3.9,39,Steakhouse / BBQ & Barbecue / ,Tiergarten,3,Andrea L.,"So. dann fang ich endlich auch einmal an, hier im Qype zu schreiben  und nicht immer nur zu lesen:-) Der Midtown Grill bekommt zu recht 4 Sterne, denn wir konnten die negativen Stimmen zu diesem Restaurant nicht verstehen. Wir waren an einem SA-Abend von 18:30 bis 20:15 dort (vor dem Kino, zack zack Potsdamer Platz = direkt nebenan). Die Restaurants in diesem Bezirk gehen halt grösstenteiles leider gar nicht:-( Anders der Midtwon Grill -) Wir kannten ihn ,weil wir über Bloomsburys (bloomsburys.de/de/liefer…) dort schon zweimal bestellt hatten  waren demnach mit Speisekarte und den Preisen vertraut. Ja, touristische Gegend, aber nein: kein Touri-Nepp-Laden wo man froh ist, dass die Leute die wiederkommen. Und dazu ist es sogar ein Hotel Restaurant. Aber: super netter Empfang, netter Kellner, sehr schnell und aufmerksam. Ja! Nichts von ungelernt etc. zu spüren. (ggf hat man sich ja auch all die Stimmen im Netz zu Herzen genommen, hm?:-))Essen: Spinatsalat mit Ziegenkäsebällchen und rote Beete: TOP! (kannte ich aber schon, wie gesagt)Main: grosses 300g Rib Eye very medium und very lecker!!!!! Mein Mann und ich gehen viel essen und fast immer in Steakhäuser und . doch, es war sehr gut! Mein Thunfischsteak war sooooo zart. dazu die Salz Karte auch nett:-) Beilagen Gemüse und hm.. Kartoffenstampf . cremig ohne Ende. Unbedingt essen.Whiskey Auswahl (sicher von der Hotelbar) war auch mehr als nur ok. Ich hatte nur Prosecco  da kann man ja nicht viel falsch machen.Mit 120EUR für zwei ist man dabei, aber das ist mittlerweile in den netteren Läden kaum gross zu unterbieten (wenn man Alkohol trinkt, bei Wasser & Cola geht es natürlich günstiger!). Und die Atmosphere ist schon gemütlich, da das Licht sehr gedämpft ist. Doch. Kein Bahnhofsvorhallenflair. Nein! Wir haben uns wohlgefühlt.Und wir gehen ganz bestimmt nochmal hin  wieder vor'm Kino:-)",4,27.1.2013
122,Midtown Grill,3.9,39,Steakhouse / BBQ & Barbecue / ,Tiergarten,3,Anke M.,"Das Restaurant ist schnörkellos mit offener Küche. Wer seine Ruhe haben möchte sollte sich aufgrund des sowieso hohen Geräuschpegels lieber einen Tisch weit ab vom Küchenbereich suchen/reservieren.Das Personal ist ausgesprochen freundlich und zuvorkommend.Wir hatten Steaks: 2x Entrecote, war nach Aussage meiner Begleiter gut. 1x Stip-Steak, war leider knorpelig. Geschmacklich gut, aber die Konsistenz ließ zu wünschen übrig.Meine Brokkolisuppe war sehr dünn (eher Brühe) und etwas zu salzig. Die Salate der anderen waren wohl gut.",4,14.4.2013
123,Midtown Grill,3.9,39,Steakhouse / BBQ & Barbecue / ,Tiergarten,3,Bamboule M.,"Ich war bisher immer zufrieden im MidTown Grill. Zugegeben die Preise sind gesalzen, aber dafür bekommt man auch wirklich gutes Essen und freundlichen Service! Braucht man nicht jeden Tag, aber wenn man sich mal was gönnen will und nach Fleischeslust schlemmen will kann man das MidTown gut mit in die Auswahl nehmen! 4 gute Sterne von mirzu fünfen hats wegen der Preise nicht gereicht!",4,5.2.2012
124,Midtown Grill,3.9,39,Steakhouse / BBQ & Barbecue / ,Tiergarten,3,Unknown,"Sehr leckeres Essen zu hohen preisen aber die Portionen sind sehr großzügig und egal welches Fleisch ich dort esse es ist ein Genuss. Das Personal habe ich als sehr freundlich erlebt..so wird das abendliche Dinner wirklich zum Event, es wird alles getan damit der Gast zufrieden ist.",5,18.10.2012
125,Midtown Grill,3.9,39,Steakhouse / BBQ & Barbecue / ,Tiergarten,3,Limomann K.,"Gutes Fleisch, leckere Beilangen, professioneller Service. Ein ordentliches Steakhaus.",4,23.2.2013
126,Midtown Grill,3.9,39,Steakhouse / BBQ & Barbecue / ,Tiergarten,3,Unknown,"Ein sehr empfehlenswertes, aber auch hochpreisiges Restaurant. Die Bedienung war freundlich und das Essen sehr gut. Besonders die offene Küche und das neckische Dessert mit Marshmallows zum selber rösten werden in Erinnerung bleiben. Trotzdem hat zum 5. Stern bei den Preisen etwas der letzte Pfiff gefehlt.",4,15.7.2012
127,Midtown Grill,3.9,39,Steakhouse / BBQ & Barbecue / ,Tiergarten,3,Unknown,Die Online Reservierung über die Website hat spitze funktioniert. Das Filet Mignon war perfekt zubereitet und das Personal war zuvorkommend und sehr aufmerksam. Die hohen Preise stehen in einem gesunden Verhältnis zur spitzen Qualität.,4,27.1.2013
128,Midtown Grill,3.9,39,Steakhouse / BBQ & Barbecue / ,Tiergarten,3,Unknown,"Sehr gutes Stake, klasse Beilagen, aber die Preise haben es auch in sich.",4,22.4.2013
129,Midtown Grill,3.9,39,Steakhouse / BBQ & Barbecue / ,Tiergarten,3,An V.,"Das Restaurant Midtown-Grill gehört zum Berlin Marriott Hotel.Bessere Steaks gibt es nirgendwo in der Stadt. Der Service ist super und standardgemäß für ein 5-Sterne-Hotel). Besonders Abends findet man eine sehr besondere Stimmung im Restaurant.Einziger Minuspunkt: Der Preis. Aber wenn man was Günstiges sucht, sollte man auch nicht unbedingt in ein 5-Sterne-Hotel gehen ;-)",4,30.11.2012
130,Midtown Grill,3.9,39,Steakhouse / BBQ & Barbecue / ,Tiergarten,3,Unknown,Eins der besten Steak-Restaurants in Berlin (lebouquet.org/feinschmec…) . Wir waren sehr zufrieden!,5,15.7.2013
131,Midtown Grill,3.9,39,Steakhouse / BBQ & Barbecue / ,Tiergarten,3,Unknown,"Ausgezeichnet. Die Steakflatrate klingt zwar irgendwie abschreckend, ist aber mit den Filet Mignons mit das Beste, was die Stadt an Steaks anzubieten hat. Schönes, edles Restaurant, vorbildlicher Service und eine Küche zum Verlieben. Wer's noch nicht kennt, hat wirklich 'was verpasst.",5,20.8.2011
132,Midtown Grill,3.9,39,Steakhouse / BBQ & Barbecue / ,Tiergarten,3,Unknown,"Best Steak in Town würde ich sagen!Nicht ganz preiswert aber oho.Leider ist das Carpaccio nicht mehr so gut wie am Anfang!Es wird nun mit Trüffel serviert (mag ich nicht) und ohen Trüffel dann aber mit Trüffelöl?? Besser sind die frischen Austern.Ok aber man ist nicht hier zum Vorspeisenessen sondern Steak essen!Und die sind einfach erst Sahne, schön abgehangen.",5,25.8.2011
133,Midtown Grill,3.9,39,Steakhouse / BBQ & Barbecue / ,Tiergarten,3,Unknown,"Ein Steakhouse der feineren Art mit amerikanischen, d.h. gigantomanischen Portionen. Ob das Fleisch tatsächlich besser ist als in anderen Steakhäusern kann ich nicht wirklich beurteilen, den Bissen, den ich bei meinem Mann probiert habe, fand ich jedenfalls sehr lecker. Zuerst gab es ein komplettes Ciabatta mit drei leckeren Dips (rote Olive, Erdnuss-Frischkäse und grünes Pesto), dazu hatten wir zwei Prosecco bestellt. Dann hatten wir als Vorspeise Ceasar Salad mit ordentlich richtig viel Parmesan darauf und die Tagessuppe. Als Hauptgericht gab es Filet Mignon, Sauce Bernaise (leider kalt) und Zitronenreis bzw. Thunfischsteak mit Spinat (sensationell). Ein Dessert hatte leider keinen Platz mehr, obwohl es etliche auf der Karte gab, die ich gern probiert hätte. Zusammen mit einer Flasche Wasser belief sich unsere Rechnung auf 92 EUR. Zum versüßen des Bezahlens gab es Marshmallows zum selber rösten mit Schokoladenraspeln, mmmmmh. Was mir fehlt, ist Sauercreme zum Steak, die sollten sie wirklich noch anbieten. Das Zwiebelchutney ist zwar lecker, aber über Sauercreme geht, finde ich, einfach nichts.Die Kellner waren ausgesprochen freundlich und bemüht (wir hatten nicht reserviert) und blieben es auch, selbst als ich aus Versehen ein volles Glas Wasser umstieß. Kein dummer Spruch, im Gegenteil, man kümmerte sich nett und schnell um das Malheur und gut war's.Insgesamt ein toller Abend, sicher nicht ganz preiswert, aber das war's wert.",5,8.4.2012
134,Midtown Grill,3.9,39,Steakhouse / BBQ & Barbecue / ,Tiergarten,3,Unknown,"Ich mag mein Steak vom Grill. Das schonendere Garen im Konvektomaten ist eine sichere Sache, liegt mir jedoch geschmacklich nicht.Dass sich das Marriot mit der großen amerikanischen Grilltradition vergleicht, finde ich schwierig, da es für diese Tradition nicht einmal ein Traditionshaus ist. Wagyu finde ich interessant und ziehe es am Ende dann doch vor, mein Geld in Tokio für echtes Kobe auszugeben, denn gutes US-Beef oder Weidebullen aus Deutschland oder der Schweiz sind für einen Grill hier doch viel geeigneter. Für einen Besuch nett und viel zu teuer, es sei denn die Atmosphäre soll edel sein. Für einen Klassiker ist das Angebot des Grills nicht wirklich interessant. Es gibt für rotes Fleisch vom Grill bessere Plätze in Berlin",3,14.1.2010
135,Midtown Grill,3.9,39,Steakhouse / BBQ & Barbecue / ,Tiergarten,3,Der H.,"Der Service in diesem Restaurant ist eine Katastrophe  New York Strip für 20EUR per 200g war schlecht ( Geschmack, Konsistenz ) Die Kartoffel war pampig  Preis Leistung stimmt hier NICHT ! Die 200EUR für 4 Personen waren schlecht angelegt  leider! Man bekommt anders viel mehr für sein Geld.",1,29.1.2012
136,Midtown Grill,3.9,39,Steakhouse / BBQ & Barbecue / ,Tiergarten,3,Unknown,Midtown Grill  Top Restaurant  sehr feine Steaks und auch der Fisch sind sehr zu empfehlen. Getestet und für sehr gut befunden  Filet Mignon / die Austern / US Rib Eye  die Beilagen z.B. grüne Bohnen oder auch das Kartoffelpüree schmecken ausgezeichnet und von der Menge her kann man sie sich getrost teilenTagesgericht gegrillte Forelle  Mega Die Weinkarte ist nicht riesig aber sehr gut ausgesucht. Unbedingt probieren  Rotwein - 2005 Vichon Frankreich  Merlot / Grenache und Shiraz  Cape Mentelle Südafrika Die gemütliche Einrichtung und der schnelle und nette Service spiegeln das Preisniveau !,5,27.8.2012
137,Midtown Grill,3.9,39,Steakhouse / BBQ & Barbecue / ,Tiergarten,3,Unknown,"Ein wirklich gutes Steak in Berlin? Dann ab in den Midtown Grill im Marriott Hotel. Allerdings sollte man den Gehaltsstreifen abwarten. Es wird extrem professionell zubereitet und serviert. Ich glaube, ich habe an dem Abend die ganze Belegschaft kennen gelernt. Aber alle sind informiert. kein Glas bleibt leer und nachher steht auch alles auf der Rechnung. Guter Service und und perfektes Essen wollen auch bezahlt sein.",4,28.2.2013
138,Midtown Grill,3.9,39,Steakhouse / BBQ & Barbecue / ,Tiergarten,3,Unknown,"Netter und herzlicher Empfang. Wir bekamen auf unseren Wunsch einen Tisch mit guten Blick auf die offene Küche. Sehr beeindruckend, wie die Köche dort die Steaks zubereiten.Umfangreiche Speisekarte mit Fokus auf Steaks. Witzig ist auch die extra Salzkarte.Service war sehr aufmerksam und freundlich. Es wurde sich sehr viel Zeit genommen uns z.b. die Salzauswahl ausführlich zu erläutern. Das Essen war super. Die Steaks genau so wie sie sein müssen. Mit der Rechnung gab es dann noch ein Marshmallow-Rösten mit Tischgrill. Sehr originell. Fanden die Kids natürlich großartig. Schönes, edles Ambiente mit lockerer Stimmung.",4,14.1.2013
139,Midtown Grill,3.9,39,Steakhouse / BBQ & Barbecue / ,Tiergarten,3,Unknown,"Wir waren an einem Sonntag abend hier, es war ein richtig schöner Abend!!Der Service nett und unaufgeregt, die showküche sauber und ihren Namen zu Recht verdient, das essen sehr lecker und die marshmallows am Schluss ein Knaller. Also wir fühlten uns richtig wohl :-)",5,7.11.2011
140,Midtown Grill,3.9,39,Steakhouse / BBQ & Barbecue / ,Tiergarten,3,Unknown,"New York strip mit Pilz Gemüse War nicht schlecht aber leider nicht ganz der erwartete Hammer. Positiv auf jeden Fall das Ofen warme Brot diverse Dips und ein sehr freundlicher Service. Auch das Auge kommt nicht zu kurz weder beim Essen noch bei der Atmosphäre.Preis Hey es ist ein steakhaus ;-)Currywurst für 2,50 gibts um die ecke.",4,13.11.2011
141,Midtown Grill,3.9,39,Steakhouse / BBQ & Barbecue / ,Tiergarten,3,Unknown,"Möchte man am PP ein gutes Restaurant finden, so muss man sich doch ein wenig umsehen, gerade wenn man nur wenige Tage zu Besuch ist. Neben dem Facil und dem Vapiano gehe ich gerne in den Grill. Ich fühle mich hier beinahe wie in den USA, den Preise finde ich angemessen",4,30.1.2012
142,Midtown Grill,3.9,39,Steakhouse / BBQ & Barbecue / ,Tiergarten,3,Unknown,"Ich verstehe nicht, warum dieser laden nicht 5 sterne hat.es handelt sich hier um das absolut beste steakhaus der stadt!das filet mignon ist das beste stück fleisch was ich je gegessen habe und das auch noch nach dem 30. besuch.der service ist für berliner verhältnisse sehr gut bis exzellent und gutes essen hat eben seinen preis.macht weiter so!",5,12.2.2012
143,Midtown Grill,3.9,39,Steakhouse / BBQ & Barbecue / ,Tiergarten,3,Unknown,"Wunderbares Angebot beim Ausschläfer-BrunchHeute waren wir mit 9 Personen im Midtown Grill zum Ausschläfer-Brunch von 12.00 bis 15.00 Uhr. Wir als Gastgeber und alle Gäste waren begeistert. Bereits beim Warten auf die Gäste um 11.45 Uhr bot man uns Kaffee und Prosecco an. Alle Mitarbeiter waren höchst zuvorkommend und freundlich. Das großartige Buffet ließ keine Wünsche offen. Dort gab es viel frisches Obst, Süßes und Salziges, kalte und warme Speisen im Überfluss. Man konnte sich außerdem noch ein Filet Mignon (im Preis inbegriffen) bestellen, welches dann auch zu unserer höchsten Zufriedenheit ausfiel. Auch die Pancakes wurden frisch zubereitet an den Tisch gebracht und ließen keine Wünsche offen. Wir haben uns sehr wohl gefühlt und können den Ausschläfer-Brunch uneingeschränkt empfehlen. Vielen Dank nochmals für die herzliche und professionelle Bedienung. Wir kommen bald wieder.",5,11.11.2012
144,Midtown Grill,3.9,39,Steakhouse / BBQ & Barbecue / ,Tiergarten,3,Unknown,"Das war uns aber hier echt zu teuer und die Bedienungen waren echt nicht besonders nett. Nächstes Mal gehen wir wieder ins Blockhouse.Da haben wir uns fürs Geld echt mehr erwartet. Zuerst diese arroganten Mädels von der Rezeption..ist ja echt ne Schande, da wird man behandelt wire der letzte Hund. Nur weil wir keinen Schlips hatten, oder wie?",3,7.5.2010
145,Midtown Grill,3.9,39,Steakhouse / BBQ & Barbecue / ,Tiergarten,3,Alex M.,Nettes Ambiente für Geschäftsessen. Die bisher servierten Speisen waren o.k. .,3,31.12.2012
146,Midtown Grill,3.9,39,Steakhouse / BBQ & Barbecue / ,Tiergarten,3,Michael B.,"Wer einmal Steaks in Amerika Steaks gegessen hat weiss, dass es mit guten Steaks hier recht schwierig ist. Der Midtown Grill bietet immerhin ein stilvolles urbanes Ambiente, leckere Vorspeisen und gute Salate. Die Spezialitäten (Bison, Wagyu, ...) sind nach meiner Meinung den Preis nicht wert. Am besten gefällt noch das sehr zarte Filetsteak, das in der Regel wie bestellt gebraten wird. Nachdem das Fleisch ""angegrillt"" wurde, wird es in Wärmeöfen auf den Punkt gebracht. Dadurch fehlt dann aber die krosse Oberfläche. Auch der Maine Lobster ist sein Geld sicher wert. Das Highlight is aber vielleicht der New York Cheesecake. Leider wurde der Steakhouse Salad mit dem leckeren Wasabidressing von der Karte gestrichen. Der größte Kritikpunkt ist der schwankende Service, man kann sich leider nicht darauf verlassen, dass leere Gläser auch wieder aufgefüllt werden. Insgesamt bietet der Midtown Grill ein stilvolles Ambiente mit einem sehr guten Qualitätsniveau. Tip: Die Parkkarte für das Marriott Parkhaus wird für Gäste freigeschaltet.",4,3.1.2010
147,Midtown Grill,3.9,39,Steakhouse / BBQ & Barbecue / ,Tiergarten,3,Dala M.,"Für mich immer noch das beste Steak der Stadt, auf den Punkt gegart, egal welche der 5 Garstufen man wählt. Sehr freundliches Personal, gehobene Preise. Die zusätzlich bestellte Pfeffersauce und die Kartoffel waren nicht der Knaller. Großes Bier für über 5 Euro ist grenzwertig, aber wohl angemessen, angesichts der Lage direkt am Potsdamer Platz. Inneneinrichtung ist modern, aber dennoch gemütlich. Jegliche Desserts sind sehr lecker, werden einem aber nicht in der Standardkarte angeboten, man sollte dafür noch Platz im Magen lassen. Highlight ist sicherlich der kleine Grill der inkl. Marshmellows und Schokostreusel zur Rechnung gereicht wird, außergewöhnlich lecker.Man sollte das Restaurant lieber abends besuchen, die Angebote zum Mittagstisch sind eher unterdurchschnittlich und dafür zu teuer. Hier bekommt man bei der Konkurrenz in der Umgebung ein deutlich besseres Preis-Leistungsverhältnis.",4,28.5.2012
148,Midtown Grill,3.9,39,Steakhouse / BBQ & Barbecue / ,Tiergarten,3,Unknown,"Online-reservierung über die Webseite hat problemlos funktioniert. Tisch war okay. Erster Eindruck war gut, aber nach dem Überreichen der Speisekarten war vom Service für den Rest des Abends kaum etwas zu sehen. Absolut enttäuschend für ein Restaurant, was sich gehoben und niveauvoll präsentiert. Wir haben viel zu lange gewartet, um unsere Bestellung aufgeben zu können. Die Kellnerin hat eine Bestellung komplett durcheinander gebracht, leider keine Entschuldigung. Schlechte Absprachen bzw. Tischzuständigkeiten, die darin gipfelten, dass wir irgendwann keine Lust mehr hatten, noch etwas zu trinken zu bestellen. Fazit: Speisen wirklich lecker, Ambiente gediegen, Service Katastrophe.",2,19.1.2013
