,Restaurant Name,Overall Rating,Total Reviews,Specialty,Region,Price Range,Author,Comment,Rating,Date
214,Steakhouse Asador,4.5,235,Steakhouse / ,Kreuzberg,2,Manu D.,"Vorab, die Steaks sind wirklich gut. Genau wie die Beilagen. Auch der Service ist eigentlich mit fünf Sternen zu bewerten. Einen Punkt Abzug gib's für die veraltete Einrichtung. Ein weiterer Punkt der mir nicht passt ist die Lage. Direkt vor einer ""Multi-kulti Hochhaussiedlung"" gelegen. Schreiende Kinder direkt nebenan. Entspannt essen geht hier mal garnicht. Die Plastikstühle auf der Terrasse sind nicht zeitgemäß. Auch die Tische wackeln munter hin und her wenn man sein Fleisch schneidet. Ich glaub ich komme nicht noch einmal her. Für das gleiche Geld bekommt man im Block House ein spitzen Steak !!!",3,7.7.2011
215,Steakhouse Asador,4.5,235,Steakhouse / ,Kreuzberg,2,Holger Z.,"Kann man der Empfehlung eines Bekannten trauen? Ja, man kann. Das Steakhaus war es auf jeden Fall wert besucht zu werden. Das Steak und das Gemüse waren sehr gut und auf den Punkt gegart. Zuvorkommende Bedienung lässt das Wohlfühlgefühl schnell ansteigen. Einzig die Inneneinrichtung ist nicht meine Sache und kostet einen Stern.",4,27.3.2014
216,Steakhouse Asador,4.5,235,Steakhouse / ,Kreuzberg,2,Unknown,"Auch wir sind Dank eines Groupon-Gutscheins im Asador gelandet. Dem Himmel sei Dank! Selten, wirklich seltenst habe ich so ein leckeres, auf den Punkt gegrilltes Steak gegessen, das mit einer ebenso schmackhaften Hummer-Sauce verfeinert wurde. Zugegeben, mein Freund bekam das Steak auf den Teller - mir hingegen war mehr nach Lachs, also bestellte ich mir selbigen. Dieser war leider: pfurztrocken. Ging gar nicht. Musste meinem Freund leider ein paar Löffelchen der Sauce klauen, sonst hätte ich den Lachs nicht hinunter bekommen. Tomatensuppe gab es als Vorspeise, weil die Gulaschsuppe leider aus war. Mein Freund hatte gebratene Chorizo, was sehr gut, aber für eine Vorspeise viel zu viel war. Insgesamt war der Service sehr aufmerksam und freundlich. Selten wurde ich von der Bedienung mit einem solchen Strahlen willkommen geheißen, als wir ankamen. Wir kommen definitiv wieder, wenn wir in ruhigem Ambiente lecker essen wollen. Wenn wir allerdings einfach nur ""zackig"" ein Steak auf dem Teller und eine ordentliche Portion wollen, geht es weiterhin ins Maredo. 5 Sterne.. eigentlich... aber der 5te Stern schwimmt mit dem totgebratenen Lachs davon... ---------------- Update vom 30.06.2011: Waren gestern wieder im Asador und unsere Vorfreude wurde nicht enttäuscht. Naja - fast nicht. Leider gab es wieder keine Gulaschsuppe. Laut Kellner wird diese nicht stark nachgefragt und daher nur in der kalten Jahreszeit serviert. Schade. Als Vorspeise gab es Chicken Nuggets mit etwas Dip und einem kleinen Salätchen. Ganz nett, nur das Fleisch fand ich etwas zu zäh und trocken. Als Hauptspeise gab es 2 Filets, einmal mit cremiger Knofi-Sauce und Wedges und einmal mit fruchtiger Orangen-Cointreux-Sauce, Rosmarinkartoffeln und meditteranem Gemüse. Beide Steaks waren top gebraten - ohne wenn und aber. Die Wedges waren super-knusprig und überhaupt nicht fettig. Rosmarinkartoffeln und Gemüse waren: ok. Etwas ölig. Alles in allem haben wir jeden Bissen genossen, sind satt geworden und freuen uns jetzt schon auf unseren nächsten ""Spanien-Kurztrip"".",4,27.4.2011
217,Steakhouse Asador,4.5,235,Steakhouse / ,Kreuzberg,2,Unknown,"Wir waren gestern Abend im ASADOR essen und ich kann nur bestätigen was meine Vorredner (-schreiber) schön alles gesagt haben. Überdurchschnittlich gutes Fleisch zu durchschnittlichen Preisen, der Service angenehm und aufmerksam. Vielen Dank bis zum nächsten Mal.",5,25.6.2011
218,Steakhouse Asador,4.5,235,Steakhouse / ,Kreuzberg,2,Unknown,"Nun möchte auch ich mich zum Asador äußern. Ich war auch für ein Wochenende in Berlin und habe das Restaurant mir über das Qype App Anzeigen lassen. Der Gratis Sekt machte mich, wie auch die vielen Bewertungen sehr neugierig sehr neugierig. Das Restaurant liegt in einem Bezirk mit vielen Hotel Gebäuden, unweit der Friedrichstraße. Von außen wirkt das Asador eher unscheinbar, eingereiht in ein größeres Wohn und Geschäftshaus. Von der Straße aus, kann man einen Außenbereich erkennen der mich persönlich nun nicht wirklich begeistert hat, da er direkt an der Straße gelegen ist und durch seine Plastikstühle nicht sehr einladend wirkt. Aber das ist nur der optische Eindruck und definitiv subjektiv zu werten. Nun aber zum Restaurant: Selten bin ich in einem Restaurant so freundlich, so offen und so angenehm begrüßt worden. Unser Kellner vermittelte durch das Ansprechen mit Namen, dem freundlichen Umgang und die zuvorkommende Art und Weise ein wohliges, unaufdringliches Gefühl. Hier passt vom Service her einfach alles. Sei es die Auswahl der Speisen wurde angenehm Unterstützt. Entschieden haben Wir uns für ein 250gr. Filet Steak (Medium) und einen Grillteller. Beides mit einer Ofenkartoffel. Die Zeit wurde uns angenehm mit einem Brotkorb inkl. Dipp verkürzt und dabei haben Wir den Begrüßungssekt genossen. Auch dieser war mit etwas O-Saft und einem Spritzer Grenadine zu einem schönen Glas angerichtet. Die Wartezeit war für einen Freitagabend war sehr angenehm bemessen. Unsere Getränkewahl wurde durch das probieren seitens des Kellner unterstützt. Ich wollte nach über 10 Jahren mal wieder ein Glas Fassbrause trinken, was mir durch einen kleinen Probeschluck angenehm ermöglicht wurde, denn auch das macht das gewisse extra vom Asador aus. Zum Essen: Ich würde sehr gerne 10* an dieser Stelle vergeben. Das Filet war auf den PUNKT Medium, optisch sehr gut angerichtet und die Beilagen (Kartoffel) üppig und sehr gut zubereitet. Das servieren in Schwanform ist eine optisch Zugabe. Die Kräuterbutter war sicherlich frisch zubereitet, die Sour Creme auch aus eigener Produktion. Auf dem Grillteller nebenan gab es eine breite Auswahl an Fleisch, was auch perfekt zubereitet war. Das schielen auf die Nachbarteller sei an dieser Stelle erlaubt und auch dort haben wir nur sehr gut angerichtete Speisen vorgefunden. Fazit: *HINGEHEN !!! Spätestens bei der Rechnung würde ich 15 Sterne vergeben wollen, denn in Hannover zahlt man für 3 Getränke, einem Filet dieser Qualität und einem Grillteller sicherlich 55EUR und mehr, da ich als Fleischgenießer öfter mal in diesem Zusammenhang ausgehe, bietet sich mir da ein recht umfangreicher Einblick. Wir haben 34,70EUR bezahlt und das macht das ausgehen in das Asador perfekt. Mein nächster Besuch in Berlin ist schon geplant und da es dasselbe Hotel wieder wird, komme ich gerne ein weiteres Mal ins Asador zurück. P.s. Danke an den Kellner (Mike) SO muss Service sein !",5,25.6.2011
219,Steakhouse Asador,4.5,235,Steakhouse / ,Kreuzberg,2,Sven L.,"Gute Steaks, nettes Ambiente und sehr freundliches und aufmerksames Personal. Am Silvesterabend galt eine spezielle Speisekarte, die ein etwas eingeschränktes Angebot des sonst üblichen Angebots bot, dafür waren die Preise aber ca. 15% höher als an regulären Tagen. In Anbetracht der Besonderheit des Silvesterabends preislich gerade noch im Rahmen.",4,1.1.2014
220,Steakhouse Asador,4.5,235,Steakhouse / ,Kreuzberg,2,Unknown,"Gerne wieder. Leckeres Essen und vor allem eine freundliche und kompetente Bedienung die mit Rat und Tat bei Fragen zum Essen an unserer Seite standen. Das Steak war auf den Punkt gebraten und auch die Beilagen waren sehr schmackhaft.Sonderwünsche wurden super umgesetzt und zum Nachtisch gab es für eine etwas längere Wartezeit eine Crème brûlée aufs Haus! Die Inneneinrichtung ist gemütlich und im Sommer werden wir garantiert mal den ""Biergarten"" ausprobieren der zum Restaurant gehört.",5,2.5.2010
221,Steakhouse Asador,4.5,235,Steakhouse / ,Kreuzberg,2,Unknown,"Ich kann leider die Begeisterung der anderen Bewerter nicht teilen. Pluspunkte:- nette Amuse Bouche mit leckerem Brot u. Bruschetta- gutes Steak, Schwein und Geflügel (wenn auch mit Glutamat)- gutes Preis-Leistungsverhältnis- höfliche Bedienung Minuspunkte:- sehr, z.T. s e h r lange Wartezeiten für alles - austauschbares DIY-Ambiente und lieblose Innenausstattung (Fliesenteppich, Wandbemalung wie bei einem Wochenendprojekt) - viele Touris, d.h. nicht viele wiederkehrende Gäste - warmes Bier (zweimal) Drei Sterne wg. der Pluspunkte, aber ein 2. Mal gehe ich nicht hin. Basta.",3,13.3.2011
222,Steakhouse Asador,4.5,235,Steakhouse / ,Kreuzberg,2,Unknown,"Bei uns überwiegten beim Besuch des ASADORS leider die negativen Dinge ...Auf 2 kleine Vorspeisen mussten wir geschlagene 45 Minuten warten. Trotz dass uns versichert wurde, dass der Hauptgang dann nicht mehr so lange auf sich warten lassen würde, haben wir hier auch nochmal 20 Minuten warten müssen. Von zwei servierten Hauptgängen wurde erst einer vertauscht - dies lies sich dann aber doch schnell klären ... Das Essen ansich war ok (1x Steak, 1x Nudeln), wobei das Nudelgericht geschmacklich leider eher einem Fertiggericht zuzuordnen war ... Negativ aufgefallen ist uns auch, dass sich die Kellner hier alles lautstark und über 3 Ecken zurufen - auch Dinge, die sonst eigentlich nicht für die Ohren der Gäste bestimmt sein sollten - z.b. wie froh man ist den Tag endlich abhaken zu können ... Pluspunkte gibt's für die nette Bedienung, die uns für die Unannehmlichkeiten noch etwas kleines auf Kosten des Hauses angeboten hat und für den leckeren Wein aus Chile. Als Stammgäste hat uns das ASADOR leider nicht gewonnen.",2,29.4.2011
223,Steakhouse Asador,4.5,235,Steakhouse / ,Kreuzberg,2,Ramona O.,"An einem Sonntagabend, nach einem sportlichen Tag im Klettergarten, hatten wir Lust auf Steak.Also das Internet an und schwups war online schon ein Tisch gebucht, das Taxi per Smartphone bestellt und eine Stunde später saßen wir in dem besten Steakhouse, was wir bisher besucht hatten.Beginnend mit einem trockenen Sherry, einer Vorspeisenplatte für zweiein leckerer RotweinFiletsteak und Rumpsteakbeide so serviert wie bestellt, auf den Punkt gegrillt/gebratendiverse Beilagenmmmmhhhhwaren wir rundum zufrieden!Der Service war sehr aufmerksam, freundlich, empfehlend und witzig.Der nächste Besuch ist schon geplant.:-)",5,6.8.2012
224,Steakhouse Asador,4.5,235,Steakhouse / ,Kreuzberg,2,Marius M.,"waren am Sa. 04.02.17 zu viert Essen, tolles Preis-/Leistungverhältnis, klasse Bedienung, gute Ware auf den Punkt gegrillt. Das Ambiente könnte verbessert werden. Jederzeit gern wieder.",4,12.2.2017
225,Steakhouse Asador,4.5,235,Steakhouse / ,Kreuzberg,2,Wusel B.,"Ein tolles Steakhouse mit Mittelklasse Preisen für einen gehobenen, erstklassigen Service und Essen in Top Qualität!!! Wir können es auf jeden Fall weiter empfehlen!",5,17.10.2013
226,Steakhouse Asador,4.5,235,Steakhouse / ,Kreuzberg,2,Unknown,Wir waren heute Abend ohne vorherige Reservierung im Asador. Nach der freundlichen Begrüßung folgten eine leckere Vorspeise und ein wirklich leckeres Rumpsteak. Darauf gab es einen leckeren Nachtisch. Ein rundum gelungener Abend zu zweit in schöner Atmosphäre. Und das zu einem angemessenen Preis/Leistungsverhältnis.Gerne wieder!,5,12.8.2012
227,Steakhouse Asador,4.5,235,Steakhouse / ,Kreuzberg,2,Unknown,"Ähemguten TagBesuchedas erste mal, über qype gefunden;Ambientehat mir gefallen;Angebotumfangreich, kreativ;Qualitätausgezeichnet;Service/Personalkompetent, höflich und sehr aufmerksamein offenes Ohr, auch für Nörgler;Weineam besten einen empfehlen lassen;Preisebin jetzt ein armer Froschn, Qualität hat hier eben ihren Preis;Fazitein Muss für Steakliebhaber;Na, geht doch!Und tschüss!",5,27.8.2012
228,Steakhouse Asador,4.5,235,Steakhouse / ,Kreuzberg,2,Balint D.,"Trotz eklektischer Einrichtung zwischen Mexico und Argentinien und einem Gruss aus der Erlebnisgastronomie (schwarzer Handschuh) bekommt man zwar keine authentischen argentinischen Asados, aber Fleisch in hoher Qualität und einige gute Flaschen Malbec. Im Sommer mit grossem Garten.",3,20.10.2014
229,Steakhouse Asador,4.5,235,Steakhouse / ,Kreuzberg,2,Unknown,"Allgemeinsehr angenehmes Raumempfinden, hervorragender Servis, ausserordentliche SpeiseBedienungnett und zuvorkommend, mit Sach und Fachkenntnis, reagiert auf den BlickDas EssenSteak auf den Punkt, Beilagen Kartöffelchen, und medtiterans Gemüsealle superDas Ambienteangenehm, gedämpfte Musik, so wie es sein sollalles zum wohlfühlenSauberkeitkeine Beanstandungen",5,25.1.2015
230,Steakhouse Asador,4.5,235,Steakhouse / ,Kreuzberg,2,1 Foto,Super Steak ! Besser als im Block House fand ich.,5,15.11.2011
231,Steakhouse Asador,4.5,235,Steakhouse / ,Kreuzberg,2,Unknown,TOLL TOLL TOLL!!!!! - Geile Steaks- freundliche Bedienung- Und üppige Portionen Kann man nix mehr zu sagen und nur weiterempfehlen!,5,30.3.2012
232,Steakhouse Asador,4.5,235,Steakhouse / ,Kreuzberg,2,1 Foto,Wirklich nicht die perfekte Gegend für ein Steakhouse  aber lieber eine nicht so perfekte Gegend und dafür ein perfektes Steakhouse.War wirklich begeistert: sehr leckeres Essen (ich hatte Filet und zum Nachtisch Créme Brûlée) und super freundliche Bedienung. Ich war sicher nicht das letzte Mal hier  weiter so !,5,9.7.2012
233,Steakhouse Asador,4.5,235,Steakhouse / ,Kreuzberg,2,Unknown,"Haben das Restaurant über Qype gefunden, weil es anlässlich unseres Hochzeitstages was besonderes sein sollte. Wir wurden nicht enttäuscht. Super freundliche und aufmerksame Bedienung. Essen von der Vorspeise bis zum Nachtisch wunderbar. Das war seit langem das erste Mal, dass mir das bezahlte Geld nicht leid getan hat. Wobei die Preise gegenüber anderen Steakhausketten sehr moderat sind und dann noch gute Qualität geboten wird. Ich fand auch besonders ansprechend, das man sich bei der Deko der Teller und dem Anrichten der Speisen sehr viel Mühe gibt und nicht einfach alles nur so raufgeklatscht ist. Da macht Essen gehen richtig Spaß. Vielen Dank. Wir kommen wieder und können Euch nur wärmstens weiterempfehlen.",5,4.9.2012
234,Steakhouse Asador,4.5,235,Steakhouse / ,Kreuzberg,2,Max M.,"Ich habe hier am letzten Wochenende mit meiner Freundin gegessen. Wir hatten beide ein Rumpsteak mit Kohlrabigemüse, Rosmarinkartoffeln und nebenher einen gemischten Salat. Das Hauptgericht fanden wir auf einer Extrakarte und wurde eigentlich mit einem Hüftsteak angeboten. Ein Austausch des Hüftsteaks gegen ein Rumpsteak war zu unserer Freude problemlos möglich. (gegen Aufpreis) Wir waren mit der Qualität, Geschmack und dem Aussehen des Hauptgerichtes sehr zufrieden. Anschließend bestellten wir noch ein Dessert und wurden auch hier nicht enttäuscht. Die Bedienung war überaus freundlich und alles wurde zügig serviert. Es empfiehlt sich, besonders am Wochenende, einen Tisch zu reservieren. Für diese Lage sind die Preise eher günstig. Das Ambiente ist vielleicht etwas kitschig, aber das tut dem Geschmack keinen Abbruch. Wir würden wiederkommen.",4,24.10.2013
235,Steakhouse Asador,4.5,235,Steakhouse / ,Kreuzberg,2,Unknown,"Also hier schmeckt NUR der Preis . ein well done steak wurde ausgetrocknet serviert, Bratensoße kommt aus der Metro, wurde schon vom Salatteller satt für 3,90 die Portion, was aber gar keine Qualität bietet  Fazit: für mich keine Experimente mehr was Steakhäuser angeht, lieber 30EUR für ein T-Bone-Steak im Blockhouse lassen was aber geil schmeckt und ausreichend ist, als sich mit Billigzeug vollstopfen wie eine Mastganz . nie weiderzwei Personen, 68 euro  die Sossen mussten extra bezahlt werden . unverschämt, lieber 10 euro mehr und hochwertiger ausgeben und normal woanders essen gehen .Komplett überbewertet ..",2,24.2.2013
236,Steakhouse Asador,4.5,235,Steakhouse / ,Kreuzberg,2,Unknown,"AllgemeinSehr lecker, zuvorkommende, sehr aufmerksame Bedienung,BedienungObwohl wir nicht reserviert hatten , bekamen wir einen Tisch (zuerst einen am Laufbereich, dann einen ""normalen""). Die Bedienung war sehr aufmerksam und machte uns auch darauf aufmerksam dass es heute es länger dauern würde, weil gerade eine Gruppe bestellt hätte. Im Endeffekt war die Zeit nicht zu lange.Das EssenVorspeise (Platte für 2) - gut gewürzte Platte mit diversen kleinen Zutaten.Hauptgericht - Steak - Entrecote 300 g sowie Lady 180 g kamen zeitgleich und waren auf den Punkt im gleichen Zustand Medium. Das Fleisch war sehr gut. Bei der Kartoffel wurde die Sour-Creme vergessen, was aber sofort korrigiert wurde.Das AmbienteMan sitzt sehr nett in dem Lokal, draußen mag es recht laut sein, da vor der Terasse eine größere Strasse verläuft. Das Lokal befindet sich mitten in Kreuzberg.Sauberkeitnichts auszusetzen",4,20.8.2014
237,Steakhouse Asador,4.5,235,Steakhouse / ,Kreuzberg,2,Oliver B.,Gutes Steakhaus mit Superpreisen. Nur die Lage. sonst wäre ich echt öfters hier.,4,2.3.2013
238,Steakhouse Asador,4.5,235,Steakhouse / ,Kreuzberg,2,Hartmut P.,Toller Service  Steak auf den Punkt. Ambiente hat mir sehr gut gefallen. Sehr empfehlenswert.,5,20.1.2013
239,Steakhouse Asador,4.5,235,Steakhouse / ,Kreuzberg,2,Christoph B.,Sehr gutes Steak mit gutem Service zu angemessenen Preisen fast in der Innenstadt. Was will man mehr?,5,19.1.2013
240,Steakhouse Asador,4.5,235,Steakhouse / ,Kreuzberg,2,Martin D.,"Die Menukarte ist etwas verwirrend, denn hier werden neben dem Steakangebot auch viele Tex-Mex Gerichte und Pasta angeboten. Eigentlich sollte man in das Asador ausschließlich zum Steak essen gehen. Die Steaks auf den Punkt gegart. Und die Beilagen sind als üppig und trotzdem als qualitativ gut zu bezeichnen. Vor den Hauptspeisen wird selbstgebackenes Brotgereicht, welches seinesgleichen sucht und  vorsicht  einen Suchtfaktor darstellt. Alles in allem bekommt die Küche 5 Sterne, das Ambiente und die Gegend nur 3 Sterne, aber für den Service und das Preis-Leistungs-Verhältnis würde ich glatt 6 Sterne vergeben.",5,26.3.2012
241,Steakhouse Asador,4.5,235,Steakhouse / ,Kreuzberg,2,Alexander D.,"Am 22.1.12 testete ich das Restaurant mit Begleitung zum Abendessen. Man wird in dem überschaubaren Gastraum von freundlichem Servicepersonal platziert. Wir hatten Glück und erhielten den letzten nicht reservierten Tisch, daher scheint eine Reservierung sinnvoll; es ist gut besucht. Das aufmerksame Servicepersonal ist ordentlich gekleidet und bedient mit Handschuh, das Ambiente stimmig, sauber und Tische erhalten für jeden Gast frische Tischdecken. Stühle sind nicht durchgängig einheitlich und haben teilweise Macken wie lose Holzblende, aber das stört nicht sehr. Die Wochenkarte findet sich nicht in meiner Karte, nur in der meiner Begleitung. Speisen und Getränke sind relativ preiswert, ohne wesentliche Ausreisser nach oben oder unten. Die Speisenbeschreibung ist zeitgemäß, ansprechend und von gehobener Natur.Der Umfang ist überschaubar mit einigen Highlights. Getränke und Speisen wurden nach kurzer Wartezeit serviert, die Präsentation war ansprechend. Mein Grillteller nach Art des Hauses war heiß, sättigend, gut gewürzt und auf den Punkt wunschgemäß zubereitet, auch wenn die Rotwein-Zwiebelsoße zu starkes Alkoholaroma hatte. Die drei verschiedenen Fleischsorten waren von guter Qualität. Unschön auffallend war das Zahlungsproblem, welches das veraltete Terminal mit Amex und Visa hatte und abschließend nur MasterCard akzeptierte.Insgesamt ein empfehlenswertes Restaurant, das ich gerne wieder besuche.",4,25.1.2013
242,Steakhouse Asador,4.5,235,Steakhouse / ,Kreuzberg,2,Sebastian K.,"Update: 25.11.2012 War gestern mit meiner Mutter hier essen und wir fühlten uns mal wieder sehr gut aufgehoben. Da wir am Nachmittag dort waren, war es auch noch nicht so voll und demnach ging alles reibungslos vonstatten. Das Essen war wie immer super, die Bedienung super nett und von daher kann ich nur wieder sagen, dass die fünf Sterne mehr als berechtigt sind. Vielen dank für das gute Essen und bis zum nächsten Mal :) ### Update: 27.07.2012 ###Ich war heute mit einem Kollegen hier und ich muss schon sagen, immer wieder schön hier einzukehren. Das Essen ist spitze und die Bedienungen alle super freundlich. Wir haben den Schelm der Kellner erwischt, der mir kurz Sorge machte, dass Kartenzahlung nicht ginge. Ich freu mich schon auf meinen nächsten Besuch bei euch. Bis dahin dem gesamten Team alles Gute und viele zufriedene Gäste. Ihr seid Spitze! ##### Waren heute zu dritt im Asador, haben das Restaurant per Zufall gefunden und ich muss schon sagen, so gut aufgehoben haben wir uns schon lange nicht mehr gefühlt. Die Bedienungen sind super freundlich und zuvorkommend, die Speisen sind mehr als lecker und an den Preisen gibt es auch nichts zu meckern. Für die Qualität, die man hier geboten bekommt fast schon zu niedrig angesetzt. Wir hatten eine Vorspeise (Tomatensuppe und Pilze frittiert) und als Hauptgericht jeweils ein Steak in verschiedenen Varianten. Das Fleisch war super zart und mit Medium Plus kann man echt nichts verkehrt machen. Zum Nachtisch gab es Creme Brullet, was ebenfalls sehr lecker war. Dieses Steakhouse ist für weitere Besuche vermerkt, hier nimmt man gerne Freunde mit hin und die mittlerweile über 120 positiven Bewertungen mit einem Durchschnitt von 5 Sternen sprechen für sich selbst. Vielleicht der beste Argentinier in Berlin!### Update 01.11.2013 ###Bitte beachtet, dass durch die Umstellung von QYPE zu YELP gerade ziemlich viele Bewertungen für das Steakhouse fehlen. Ich hoffe doch sehr, dass diese noch nachgereicht werden. Das Steakhouse zählt zu den Besten seiner Art und sollte dies auch online widerspiegeln. Momentan im krassen Widerspruch: einst 250 Bewertungen mit im Durchschnitt fünf Sternen (QYPE) und jetzt nicht mal 30 mit drei Sternen im Durchschnitt (YELP).",5,18.2.2012
243,Steakhouse Asador,4.5,235,Steakhouse / ,Kreuzberg,2,Jan-Philipp H.,"Tolles Steakhouse, nette dezente Musik, bes. Tip: Vorspeisenteller für zwei. Sehr freundliche Bedienung. Schöne und sehr saubere WCs. Gerne wieder.",5,27.11.2011
244,Steakhouse Asador,4.5,235,Steakhouse / ,Kreuzberg,2,Guido K.,"Es gibt Tageda sollte man nicht Essen gehen!Wir waren an einem Samstag dort und haben wohl einen schlechten Tag erwischt.Beide Steaks waren nur kurz angebraten(obwohl als Medium bestellt) und meine Bratkartoffeln bestanden aus halbieren Pellkartoffeln(mit Schale) die mit jeder Menge Rosmarin gebraten wurden und deshalb bitter schmeckten.Auf unsere Kritik wurden die angeschnittenen Steaks nachgebraten aber die Beilagen nicht warmgehalten.Nun war das Fleisch zwar Medium jedoch durch den fehlenden Fleischsaft relativ trocken.Nach der erneuten Beschwerde über die lauwarmen Beilagen wurden diese neu zubereitet.Positiv möchte ich beide Bedienungen hervorheben die trotz unserer Kritik immer ihre Freundlichkeit behielten sowie den Chef der persönlich an unserem Tisch erschien,sich entschuldigte und noch einen Schnaps ausgab.Aufgrund der vielen guten Bewertungen werden wir dem Restaurant eine erneute Chance einräumen und deshalb erneut dort einkehren.",3,7.10.2012
245,Steakhouse Asador,4.5,235,Steakhouse / ,Kreuzberg,2,Surf G.,"Ein wirklich gutes Steakhaus, rund eine Viertelstunde zu Fuß vom Potsdamer Platz entfernt. Ich war hier, weil ich im Holiday Inn Express (3 Minuten entfernt) zu Gast war, eine Location zum Abendessen suchte  und noch nie ein Lokal mit so vielen so positiven Bewertungen gesehen hatte. Ich muss sagen. Sie sind gerechtfertigt. Die Kritikpunkte vorweg, für die ich aber unterm Strich einen Stern abziehe:- Als wir zu zweit ankamen, war der Laden nicht sehr voll. Wir wurden gefragt, ob wir reserviert hätten (hatten wir nicht), und wurden dann an einen Tisch gebeten, der sehr gequetscht zwischen einem anderen Tisch und dem Durchgang zu den Toiletten stand. Wir fragten dann nach fünf Minuten den Kellner, ob wir uns nicht an einen anderen Zweiertisch umsetzen könnten, was kein Problem war. Aber mir war unklar, warum wir uns dieser viel bessere Tisch nicht von Anfang an angeboten worden war.- Der Kellner war nett, aber im Gegensatz zu anderen Rezensenten fand ich die Freundlichkeit aufgesetzt. Der Service war wirklich sehr aufmerksam, nur fast ein bisschen zu beflissen. Vielleicht ist das aber auch die Berliner Schule? Im Rheinland mag ich's etwas weniger überhöflich und dafür ehrlich freundlich.- Dass die Kellner alle eine Hand im schwarzen Gummihandschuh tragen, finde ich etwas befremdlich. Hat so einen Fetisch-Touch- Wir hatten beide unser Fleisch medium bestellt, und bei uns beiden war das Fleisch zu großen Teilen noch durchgängig rot, wenn auch nicht blutig. Ich mag das trotzdem, aber in einem Steakhaus erwarte ich, dass die Garstufe perfekt ist. Die können schließlich oft genug üben. Der Rest war allerdings toll. Die Atmosphäre des Ladens gefällt mir, gerade weil sie nicht besonders modern ist, sondern fast ein bisschen kitschig. Das Essen war sehr, sehr lecker, insbesondere war das Fleisch wirklich zart und schmackhaft. Preislich war der Besuch auch in Ordnung: Gebackene Champignons, Pfeffersteak und zwei Pils für 22 EUR sind in Ordnung, dazu gab's noch wirklich leckeres Brot mit gesalzenem Öl. Ich kann den Besuch hier sehr empfehlen, und wenn ich noch mal im Holiday Inn bin, dann bin ich ganz bestimmt auch wieder im Asador.",4,7.1.2012
