,Restaurant Name,Overall Rating,Total Reviews,Specialty,Region,Price Range,Author,Comment,Rating,Date
77,FACTORY GIRL,4.1,41,Frühstück & Brunch / Café / Desserts / ,Mitte,2,Unknown,Toll! Sehr nettes Personal. Essen ist superspitzenklasse :-) Magnolia als Nachtisch oder auch nur zwischendurch ist ein Traum.,5,9.10.2011
78,FACTORY GIRL,4.1,41,Frühstück & Brunch / Café / Desserts / ,Mitte,2,Unknown,"soo ein schönes Café in Friedrichshain. In der Simon Dach Straße, wo im Sommer die Hölle los ist aber auch im Winter viel zu viele Leute nach einem Platz suchen, muss man schon viel Glück haben, wenn man einen Platz ergattern will. Aber dann: Superschöne Einrichtung, ein bisschen 70er. Leckeren Kaffee, Chai und Mocchacino. Aber das Beste sind die Nachtische  die Magnolias. Unbedingt den Bananen-Magnolia probieren!",5,4.3.2012
79,FACTORY GIRL,4.1,41,Frühstück & Brunch / Café / Desserts / ,Mitte,2,Unknown,"Wirklich schöner und entspannter Laden in einer nicht gerade ruhigen Umgebung. Eine nette Alternative zu Burger, Pizza und Co.",4,31.8.2012
80,FACTORY GIRL,4.1,41,Frühstück & Brunch / Café / Desserts / ,Mitte,2,Ama R.,"Eine Freundin hat mich in den Laden mitgenommen, ich habe mich auf Anhieb verguckt in die nette gemütliche Einrichtung, das köstliche Magnolia (eine Art Mascarpone-Creme in vielen unglaublich leckeren Geschmackssorten), ganz zu schweigen davon, daß man so freundlich und zuvorkommend bewirtet wird, daß man am Liebsten gar nicht mehr weggehen möchte. Der Betreiber hat sogar extra seinen Laden für uns länger geöffnet gelassen. Ach ja, die Limonade sollte man unbedingt probieren, hausgemacht und sehr lecker! Hingehen, ausprobieren, mit nach Hause nehmen (das Magnolia gibts auch zum Mitnehmen)",5,22.7.2011
81,FACTORY GIRL,4.1,41,Frühstück & Brunch / Café / Desserts / ,Mitte,2,Unknown,"super laden, sind jetzt in mitte, in der auguststrasse. anscheinend aus f'hain weggezogen.mein favorit natürlich das leckere magnolia, nachspeise aus sojamilch und kuchen, früchten etc. man wird leider süchtig davon, soll aber anscheinend was die kalorien angeht nicht zu sehr ansetzen.gegessen habe ich bereits die linsensuppe (bisschen pikanter), das frühstück, das eier-gericht (mit knoblauchwurst und schinken) und die baguettes. alles sehr lecker und wunderschön angerichtet.alles in allem ein laden zum verweilen, besonders die sessel am fenster. lage top, gemütlichkeitsfaktor hoch und die zeitschriftenauswahl ist die mit abstand beste in der spandauer vorstadt.",5,22.5.2013
82,FACTORY GIRL,4.1,41,Frühstück & Brunch / Café / Desserts / ,Mitte,2,Unknown,"ich bin verliebt in den laden, da passt einfach alles zusammen die qualität der speisen ( magnolia, sandwiches ) und getränke ( hausgem. limonade ) kann man sowieso nicht in frage stellen, tip top 1a und einfach nur köstlich aber noch etwas macht den laden soooo geil, ich als hobbyfotograf habe soviele details in dem laden zum fotografieren endeckt das ist unglaublich, wenn man sich auch die größe mal vorstellt ca. 22 m2 und ich habe mehr als 30 verschieden bilder, das ist immer wieder ein besuch wert didem und husso weiter so.. ;-)",5,20.7.2011
83,FACTORY GIRL,4.1,41,Frühstück & Brunch / Café / Desserts / ,Mitte,2,Unknown,Echt leckere magnolias,5,24.10.2011
84,FACTORY GIRL,4.1,41,Frühstück & Brunch / Café / Desserts / ,Mitte,2,Unknown,"Leckere Creme, man kann fast nicht mehr aufhören..",5,29.4.2012
85,FACTORY GIRL,4.1,41,Frühstück & Brunch / Café / Desserts / ,Mitte,2,Unknown,"Hey Euer Sofia-Salat hat echt nachgelassen!! War ein echter Fan, da so viele leckere Zutaten drin waren. Beim letzten Mal leider nur noch Eisbergsalat, ein paar getrocknete Tomaten und Kichererbsen und das für 7 Euro!!! (damals glaub ich noch 5 oder 6). Mhh bin echt enttäuscht!",2,29.1.2012
86,FACTORY GIRL,4.1,41,Frühstück & Brunch / Café / Desserts / ,Mitte,2,Unknown,"Das Factory-Girl sieht hübsch aus mit den kleinen Tischchen und den karierten Tischdecken, der Kellner (Chef?) ist ein super-freundlicher Typ, die Speisen sind kreativ und abwechslungsreich (die Pudding-Kuchen, die Salate, die Baguettes zum Selberzusammenstellen). Leider sind die Portionen viel zu klein, eher Häppchen. Und leider schmecken weder Kaffee noch Kakao. Der Milchschaum war leider auch jedes Mal nicht gelungen, der Kakao lauwarm und der Kaffee bitter. Da geh ich lieber nebenan ins Cortado. Schade, dabei hätte der Laden viel Potential.",3,6.9.2012
87,FACTORY GIRL,4.1,41,Frühstück & Brunch / Café / Desserts / ,Mitte,2,Unknown,"leckere baguettes bzw bagel deren belag über die typischen kochschinken und salami angebote hinausgeht. frischer rucola, feigensenf etc. alles hochwertige produkte.diese quark oder pudding-speise ist der wahnsinn. macht süchtig. ambiente toll!",5,28.9.2011
88,FACTORY GIRL,4.1,41,Frühstück & Brunch / Café / Desserts / ,Mitte,2,Julian H.,"unbedingt ne magnolia testen. absolut herrlich für jeden der kekse, kuchen und pudding mag!",5,18.12.2011
89,FACTORY GIRL,4.1,41,Frühstück & Brunch / Café / Desserts / ,Mitte,2,Unknown,Ein reichhaltiges und sogar günstiges Angebot welches echt lecker ist gibt es hier.,4,25.6.2012
90,FACTORY GIRL,4.1,41,Frühstück & Brunch / Café / Desserts / ,Mitte,2,Unknown,"unglaublich netter Laden mit absolut adoring Besitzern Frühstück ist einmalig lecker und alles so schön präsentiert, eine wahre Freude",5,17.8.2012
91,FACTORY GIRL,4.1,41,Frühstück & Brunch / Café / Desserts / ,Mitte,2,Unknown,"Ich war lange nicht im Factory Girl, aber neulich war ich echt begeistert!Service schnell, Essen super!Hat sich so einiges getan!Sehr cooler, schicker Laden, wo ich immer wieder gern hingehe, allein wegen der super,leckeren Magnoliacreme!!!",4,14.11.2012
92,FACTORY GIRL,4.1,41,Frühstück & Brunch / Café / Desserts / ,Mitte,2,Unknown,Sehr freundlicher und zuvorkommender Service! Essen superlecker! Hier werde ich ab sofort öfter herkommen. Endlich mal ein gutes Café inmitten des Nepper-Schlepper-Touritums der Simon-Dach-Straße.,5,14.8.2011
93,FACTORY GIRL,4.1,41,Frühstück & Brunch / Café / Desserts / ,Mitte,2,Unknown,"Wir waren im Rahmen der eat the world-Tour im Factory Girl. Da wir auf anhieb von Magnolia begeistert waren, beschlossen wir am nächsten Tag dort zum Frühstücken hinzu gehen. Das Frühstück war sehr lecker, große Auswahl, es wurde auf Wunsch großzügig nachgelegt. Das Ambiente ist schnuckelig, der Service war klasse. Beim nächsten Berlin Besuch auf jeden Fall wieder!",5,16.10.2011
94,FACTORY GIRL,4.1,41,Frühstück & Brunch / Café / Desserts / ,Mitte,2,Unknown,"magnolia =  ob mit banane, heidelbeeren oder apfel-zimt  alles leeeecker und nur zu empfehlen! unbedingt ausprobieren!!!",5,16.12.2011
95,FACTORY GIRL,4.1,41,Frühstück & Brunch / Café / Desserts / ,Mitte,2,Unknown,"Nach dem 4. Besuch bei Factory Girl bin ich noch immer so hellauf begeistert wie beim 1. Jedes mal wenn ich in Berlin bin geht kein weg am wundervollen Frühstück, Magnolia und hausgemachter Limo vorbei. Ob draußen vor dem Café oder drinnen im wohlig warmen Laden mit wundervoller entspannter musik, die Wohlfühlatmosphäre ist jedes mal vorprogrammiert. Wie schon in vorherigen Bewertungen geschrieben wird man hier wie alte Freunde willkommen geheißen. Als erstes fällt die konsequente und total ehrliche Freundlichkeit des Personals auf. Es ist immer wieder schön die verwunderten Gäste am Nebentisch zu belauschen, die nicht glauben können wir freundlich sie hier bedient werden. Wünsche werden hier an den Augen abgelesen. Würde ich in der Nachbarschaft wohnen wäre das mein tägliches Stammcafé! Macht weiter so Factory Girl, ohne euch wär alles doof ;) Kleiner Tipp, die selbst gemachte Limo gibt's jetzt auch heiß, wunderbar köstlich und genau das richtige für kalte Wintertage!",5,23.12.2011
96,FACTORY GIRL,4.1,41,Frühstück & Brunch / Café / Desserts / ,Mitte,2,Unknown,"Um unseren Shoppingtag gut starten zu können, wollten wir uns bei einem gemütlichen Frühstück in Fhain stärken. Durch die Qype Empfehlungen bin ich auf das Factory Girl gestoßen. Von außen ist es mir bisher nie aufgefallen, und ich treibe mich sehr oft in der Gegend rum. Ich hatte ein Sandwich mit getrockneten Tomaten, Rucola, Feigensenf und Käse, mit selbstgemachter Limo zum Frühstück. Beides sehr sehr lecker! Die Limo kann man kalt oder heiß genießen. Meine Freundin hatte ein Frühstücksmix mit allem drum und dran und war auch mehr als zufrieden. Magnolia haben auch wir gekostet, und ich muss sagen, oberlecker! Auf jeden Fall ein Grund diesen Laden aufzusuchen. Ein Muss für alle Süßmäuler. Am zufriedensten waren wir allerdings mit dem Service. An diesem Morgen ein netter junger Mann, der uns das Gefühl gab, willkommene Gäste zu sein und alles tun würde, damit es uns gut geht :-). Wir kommen bestimmt wieder! Endlich mal ein Laden, der was anderes hat, als die Anderen.",5,30.12.2011
97,FACTORY GIRL,4.1,41,Frühstück & Brunch / Café / Desserts / ,Mitte,2,Unknown,Ganz nette Café aber auch nicht das was es vorher mal war! Café und Magnolia waren gut aber lange Wartezeiten und wacklige Tische sollten mal wieder überarbeitet werden!,3,28.8.2012
98,FACTORY GIRL,4.1,41,Frühstück & Brunch / Café / Desserts / ,Mitte,2,Unknown,"Generell ist der Laden gut ABER NUR WENN DER BOSS DA IST. Jedes mal, wo er nicht da ist, wird alles langsam. Der Service ist schlecht, obwohl mehrere dort arbeiten. Meine Bestellung kam bei drei verschiedenen Besuchen zwei mal falsch und einmal 45 minuten später weil vergessen. Generell ist das ein guter Laden, aber der Service ohne Aufsicht ist völlig daneben.",1,24.9.2012
99,FACTORY GIRL,4.1,41,Frühstück & Brunch / Café / Desserts / ,Mitte,2,Unknown,"Zuletzt war ich vor ein bis zwei Wochen im Factory Girl!  es gehört zu jedem meiner Berlinbesuche dazu  fast schon Ritual, mindestens an einem Morgen für eine Stunde im Factory Girl zu frühstücken. Das Essen ist fantastisch. Am besten schmeckt das Rührei mit Rucolasalat und Speck, dazu frisch gebackenes Steinofenbaguette, das einem einfach nur auf der Zunge zergeht und den Wunsch nach mehr wecktdie Getränke sind eher teurer, aber das ist völlig okay, schließlich frühstückt man nicht jeden Tag dort und zweitens ist das Café so klein und relativ unbekannt (jedenfalls für Touristen) dass sie auch schauen müssen wovon sie leben. Es ist so wundervoll eingerichtet, ein bisschen friedrichshain-kitschig vielleicht, im typischen Wohnzimmerstil und Flohmarktflair, aber ich persönlich mag das eben sehr so, andere vielleicht weniger. Das Personal ist eher englischsprachig, aber wahnsinnig nett, herzlich und so sehr um die Gäste bemüht, dass es schwerfällt das Café nicht ins Herzen zu schließen!",5,6.2.2013
