,Restaurant Name,Overall Rating,Total Reviews,Specialty,Region,Price Range,Author,Comment,Rating,Date
133,DUDU,3.9,39,Sushi / Vietnamesisch / Asiatisch / ,Mitte,2,Unknown,"Ich Liebe das DUDU! Also ich muss da einmal in der Woche hin! Best Asia Food! Nettes Ambiente, Bedienung und Essen sind toll.",5,3.1.2013
134,DUDU,3.9,39,Sushi / Vietnamesisch / Asiatisch / ,Mitte,2,Unknown,"Wir wollten heute mal spontan sein und einen neuen Sushi Laden ausprobieren. Also google bemüht und Sushi eingegeben und uns aufgrund der Bilder für das dudu entschieden. Als wir dort ankamen waren wir positiv überrascht. Etwas zurückgesetzt von der lauten Torstraße hinter Bambusbüschen versteckt, kann man - wenn das wetter mitspielt - sicher auch gut draußen sitzen. Als wir auf der Karte nach Sushi suchten wurden wir allerdings nicht fündig. Auf Nachfrage verweis man uns auf die Tageskarte. Hier gab es nun 4 verschiedene Varianten. Unschlüssig bestellten wir also einen Sushi Teller für 2 Personen für 35 EUR. Dazu einen Xa Tee aus frischen Zitronengras, Ingwer und Honig. Super wirklich genial lecker und es blieb nicht bei einem. Als das Sushi kam waren wir erneut positiv überrascht. Es gab 3 x 8 Rollen die recht extravagant daherkamen, einige Scheiben gebratenen Tunfisch und eine leckere Kombination aus Guacamole und Tomaten-Zwiebel-Mix der an Bruscetta erinnert. Wirklich ein Geschmackserlebnis. Man könnte also meinen ein voller Erfolg.Leider gibt es doch etwas aus zusetzten. Der Service war recht unaufmerksam und ohne Zeichen und Armwedeln hätten wir wohl weder bestellen können noch die Rechnung erhalten können. JE später der Abend desto voller das Restaurant und das Personal fing an die Gäste an bereits besetzte Tischen zu platzieren. Ich persönlich finde das ist ein no-go aber darüber kann man ja mal hinwegsehen...Nachdem wir dann bezahlt hatten und noch einige Minuten saßen und uns unterhielten kam der Kellner erneut und bat uns bitte an der Bar Platz zu nehmen, da wir ja nicht mehr essen würden. Wirklich schade wie ein so kulinarischer Abend mit einem so negativen Beigeschmack endet...",3,12.10.2009
135,DUDU,3.9,39,Sushi / Vietnamesisch / Asiatisch / ,Mitte,2,Unknown,"Meist sehr gutes Essen, freundliches Personal und vernünftige wenn auch keine günstigen Preise! Das Ambiente ist ganz in Ordnung, jedoch ist es oft sehr schwer einen Tisch zu bekommen! Generell ein Restaurant zu dem man gut und gerne hingehen kann!",4,9.12.2010
136,DUDU,3.9,39,Sushi / Vietnamesisch / Asiatisch / ,Mitte,2,Unknown,"Mit der Einrichtung hat sich jemand Mühe gegeben. Die Ideen und die Umsetzung gefallen mir. Das Essen war etwas enttäuschend, das Sushi war nicht gut gerollt. Die große Spezialrolle ist schnell zerfallen aber durch eine Unaufmerksamkeit meinerseits habe ich mir zu dem Übel noch eine Fischboulette bestellt. Die hört sich nicht nur fies an sondern sieht auch so aus.",3,11.2.2011
137,DUDU,3.9,39,Sushi / Vietnamesisch / Asiatisch / ,Mitte,2,Unknown,"Das Essen im Dudu ist tatsächlich lecker und hat mehr als 2 Sterne verdient. Aber wirklich geärgert hab ich mich über die herablassende Art mit der wir aufgefordert wurden, weitere Leute an unseren Tisch, der mit 8 Personen bereits gut belegt war, zu lassen: Ihr seid der einzige Tisch, der nicht in der Lage ist, zusammenzurücken.Der Laden war zu diesem Zeitpunkt proppenvoll, wie auch unser Tisch. Das ist Service, der die Bezeichnung nicht verdient und mich und meine 7 Begleiter wird das Dudu nicht mehr sehen.",2,3.5.2012
138,DUDU,3.9,39,Sushi / Vietnamesisch / Asiatisch / ,Mitte,2,Unknown,Mein Lieblings-und Stammladen!Immer freundllich und schnell bedient worden-auch mit größeren Runden und wenn der Laden komplett voll war (was fast immer der fall ist)Eine super Fisch-Qualität zu wirklich fairen Preisen.Alles richtig gemacht und bitte so bleiben!,5,19.5.2012
139,DUDU,3.9,39,Sushi / Vietnamesisch / Asiatisch / ,Mitte,2,Unknown,Megaaaa Essen. Wirklich unschlagbar! Unfreundliches und eingebildetes Personal,4,12.9.2012
140,DUDU,3.9,39,Sushi / Vietnamesisch / Asiatisch / ,Mitte,2,Unknown,"An einem Wochenendtrip in Berlin traf ich mich mit Freunden im DUDU.Kleiner Laden in guter Lage in Berlin Mitte. Der Außenbereich war sehr voll und ohne Reservierung setzen wir uns einfach auf eine Bank neben andere Gäste. Das scheint im DUDU allerdings auch so gewollt zu sein. Die Bedienung war freundlich und unsere Getränke kamen relativ flott. Hier darf ich ""DUDUs Calpico"" empfehlen. Ein alkoholfreies Getränk mit Calpico, frischen Beeren und Minze.Zu Essen bestellten wir vorab eine Portion ""Bohnen"" und zum Hauptgang verschiedene Sushi Platten und ""Crunchy DUDU"", eine Sushi Rolle mit Lachs, Thunfisch, Avocado und Gurke gefüllt im knusprigen Tempuramantel.Das Essen war sehr lecker und das Ambieten mit lauterer elektronischer Musik passend dem Anlass. Für ein Businessdinner würde ich das ""DUDU"" nicht empfehlen, aber für einen schönen Abend mit Freunden allemal!",4,23.10.2012
141,DUDU,3.9,39,Sushi / Vietnamesisch / Asiatisch / ,Mitte,2,BlowIn I.,Nice location and friendly staff; this really is a lovely spot for a quick bite and a drink.,4,1.4.2013
142,DUDU,3.9,39,Sushi / Vietnamesisch / Asiatisch / ,Mitte,2,Mik O.,"Richtig lecker ist es hier, vor allem die Teigrollen, in die alles mögliche, was Flossen hat, hineingestopf werden. Das Interieur ist asiatisch-minimalistisch, das Publikum hier recht hip, und wie sich das für Großstadtmenschen gehört, essen sie ihr figurbewußtes Mahl erst spät. Also entweder früh kommen oder reservieren! Alles in Allem: Leckeres Asia-Food zentral gelegen und noch nicht allzu bekannt. I like!",4,17.5.2010
143,DUDU,3.9,39,Sushi / Vietnamesisch / Asiatisch / ,Mitte,2,Lamrock T.,"top produkt.ich war bereits mehrmals im DUDU und ich kann es absolut weiterempfehlen. die gerichte DUDU CRUNCHY ROLLS, ROASTBEEF NOODLES und SEAFOOD BOWL sind wirklich klasse. hochwertige und frische lebensmittel, die gekonnt zubereitet werden. wer asiatisch mag, ist hier richtig!das einzige, was das geschmackserlebnis trübt, ist der nervige zigarettenqualm von den nachbartischen. aufgrund der sonnenschirme zieht der rauch leider nicht ab und man sitztl leider im gestank.",5,12.6.2012
144,DUDU,3.9,39,Sushi / Vietnamesisch / Asiatisch / ,Mitte,2,Unknown,"Tolles Essen, etwas beengte Atmosphäre und die Bedienung war / ist auch nett. Wenn es hektisch zugeht, kann ich verstehen, dass man nicht bei jedem Gast alles noch freundlich hinterfragen kann  einfach aus Zeitgründen. Es soll schnell gehen. Das Essen war innerhalb weniger Minuten auf meinem Tisch. Geschmacklich war es 1A. Die Bedienung war freundlich und fix. Ich komme sehr gerne wieder",5,6.2.2013
145,DUDU,3.9,39,Sushi / Vietnamesisch / Asiatisch / ,Mitte,2,Unknown,"Ich bin neu in Berlin und gerade auf Entdeckungsreise. Das DUDU wurde mir empfohlen und nicht zuviel versprochen: trotz Reservierung mussten wir zwar warten, aber der Besitzer war sehr aufmerksam und hat uns die Zeit mit einem Sekt versüßt. Die Serviceleute sind alle sehr nett und freundlich  auch wenn der Laden total voll ist. Das Ambiente ist einfach und praktisch. Wir saßen neben der Küche und mir gefällt es sehr gut, dass man den Köchen  die übrigens SEHR LECKER kochen  über die Schulter schauen kann. Das Essen kam schnell, war auch fürs Auge schön angerichtet und wie schon gesagt richtig gut. Auch die Preise waren für die Portionen absolut angemessen. Sehr gerne wieder!!!",5,21.9.2013
146,DUDU,3.9,39,Sushi / Vietnamesisch / Asiatisch / ,Mitte,2,Unknown,"Top Top Top, einer meiner Lieblingsläden! Seafoodbowl oder Dudu Crunchy Roll  immer wieder gut",5,15.9.2013
147,DUDU,3.9,39,Sushi / Vietnamesisch / Asiatisch / ,Mitte,2,Unknown,"Ozan Sakar und Sushi-Koch Nam Cao Hoai machen dort ihr zeitgemäße asiatische Küche. Wechselnde Tageskarte ideenreich und exotisch, lekker, ausprobieren, es lohnt sich.",5,7.11.2008
148,DUDU,3.9,39,Sushi / Vietnamesisch / Asiatisch / ,Mitte,2,Unknown,"Das Dudu bietet in der großen Zahl der Berliner Vietnamesen eine Küche mit einer etwas anderen Nuance. Guacomole zu Sashimi habe ich woanders noch nicht bekommen. Auch die Suppen und Curries sind lecker. Der Service ist freundlich. Wiederholt sich aber (wenn man öfters hingeht) genauso wie bei anderen Asiaten, jedes Lokal hat halt einen eigenen Style, daher öfter mal die Location wechseln, je nach Appetit und finanzieller Lage.",4,27.9.2009
149,DUDU,3.9,39,Sushi / Vietnamesisch / Asiatisch / ,Mitte,2,Unknown,"hybsches design, tolle location, essen ausgewählt aber lecker und frisch, für jeden der mal gut asiatisch essen möchte, der preis ist schon etwas gehoben für die gegend",4,22.6.2010
150,DUDU,3.9,39,Sushi / Vietnamesisch / Asiatisch / ,Mitte,2,Unknown,guter service und sehr gutes essen.,5,19.7.2010
151,DUDU,3.9,39,Sushi / Vietnamesisch / Asiatisch / ,Mitte,2,Unknown,Ich komme sehr gerne hier her: weil es schmeckt und der Wirt ein aussergewoehnlich angenehmer Mensch ist.,5,22.9.2010
152,DUDU,3.9,39,Sushi / Vietnamesisch / Asiatisch / ,Mitte,2,Unknown,"Der Hype ums dudu ist für mich schwer nachvollziehbar. Wer das dudu betritt, wird vom lauten Wummern der Bassboxen begrüsst. Und dann steht man mittendrin: zwischen, hin- und herwuselnden, überhippen Barkeepern und Kellnern und obertrendigen Mittetypen in einer Geräuschkulisse, die ein Garant für anstrengende Anschreigespräche ist. Zwischendurch flitzt die Bedienung zwischen den rustikalen Sitzgelegenheiten, als ginge es um ein Casting für die neue Hauptrolle. Das dudu ist eine Bühne, bloß weswegen war ich eigentlich hier? Stimmt, ich wollte ja was essen. Nunja, ein rasend schnell serviertes Hauptgericht für einen nicht unstolzen Preis, nicht wirklich brillant abgeschmeckt, so gehts allemal auch andernorts.",2,1.5.2012
153,DUDU,3.9,39,Sushi / Vietnamesisch / Asiatisch / ,Mitte,2,Unknown,"ganz lustig. lange tische, lauter house, emsiger service. kulinarisch wird ganz asien munter in einen topf geworfen: roher fisch, frittierte gambas, salat, guacamole (asien?!?). alles in einer schüssel. ach ja, plus koriander und tomate. hat nix miteinander zu tun, schmeckt aber frisch und augenscheinlich allen anwesenden touris. nicht böse, aber keine offenbarung und primär dann doch an eine kantine erinnernd!",2,30.9.2012
154,DUDU,3.9,39,Sushi / Vietnamesisch / Asiatisch / ,Mitte,2,Unknown,"Das Dudu ist ein echter Tipp in Mitte - großartiges asiatisches Fusion-Food, mal ein vietnamesischer, mal ein japanischer Einschlag. Aber immer lecker und immer einfallsreich. Was ich besonders gut fand ist, dass es auch viele leckere kalte Gerichte (natürlich mal abgesehen von Sushi) gibt, auch als Hauptgericht. Mein Essen war frisch gemacht, perfekt gewürzt (scharf aber nicht zu scharf) und sowohl der vietnamesische Salat vorab als auch das Hauptgericht waren einfach nur großartig. Die Location selber ist stylish eingerichtet, mit reduziertem, zum Thema passendem Desing. Sehr gelungen. Zum Thema schnell zu Mittag essen muss ich dem Kollegen agentberlin allerdings widersprechen. Schnell ging es bei mir leider nicht. Was aber nicht schlimm war und mir ehrlich gesagt auch lieber ist, wenn ich weiss, dass die Speisen frisch zubereitet werden. 5 von 5 Daumen hoch für Dudu.",5,26.8.2009
155,DUDU,3.9,39,Sushi / Vietnamesisch / Asiatisch / ,Mitte,2,Unknown,"Die Tageskarte und die ständige Karte enthalten eine Reihe wirklich leckerer japanischer Gerichte. Und ich kenne sonst kein Restaurant in Berlin, das so leckere lauwarme Sushi mit halb angebratenem Tunfisch macht. Zu vergleichen sonst nur mit den großen Brüdern aus NY und London... Die Preise sind dafür auch human...",5,18.10.2010
156,DUDU,3.9,39,Sushi / Vietnamesisch / Asiatisch / ,Mitte,2,Unknown,"Super Sushi, ich bin jedes mal begeistert. Aber die Bedienung ist leider mehr an ihrer Frisur als an den Gästen interessiert.Schade.",4,22.2.2011
157,DUDU,3.9,39,Sushi / Vietnamesisch / Asiatisch / ,Mitte,2,Unknown,"viel zu sehr auf umsatz und nicht qualität aus, das ist es, was dieses restaurant leider austauschbar macht. das dudu hat einfach keine seele. vielmehr werden fremde parteien auf ungemütlichen bänken zusammengepfercht. also sicherlich kein abend für einen romantischen anlass. und als ob es nicht ohnehin schon hektisch genug ist, wird monotone club-music gespielt. stress ist geradezu vorprogrammiert... leider kam ich nicht umher -wie auch bei dem engen platz, vergleichbar mit dem eines huhns in der legebatterie- und hab von den ständig prahlenden nachbarn immer wieder konversationsfetzen aufschnappen müssen. verdächtig oft kam hier ""projekt"" ""das ist voll laser"" aber mit blick in die karte auch ""viel zu teuer"" vor... echt nervig! das essen ist wirklich gut, keine frage. entsprechend hoch ist der preis. der service ist bemüht und wirkt sehr gehetzt und vergisst das eine oder andere schon mal. das ambiente kommt dem eines hektischen kleinstadtbahnhofs gleich, außer dass die provinzler anderswo authentischer sind und weniger gernegroß! fazit: gutes sushi, allerdings nur zum mitnehmen!",2,4.7.2011
158,DUDU,3.9,39,Sushi / Vietnamesisch / Asiatisch / ,Mitte,2,Unknown,"Essen, besonders die Rollen, ist Top. Der Laden ist laut und eng und voll, Publikum stylisch, aber die Grundatmosphäre ist dennoch entspannt, nicht abgehoben. Nichts für romantisches Dinner zu zweit. Man sitzt an langen Bänken mit beliebigen Leuten zusammen am Tisch.",5,10.1.2013
159,DUDU,3.9,39,Sushi / Vietnamesisch / Asiatisch / ,Mitte,2,Unknown,"Überraschen neue Küche, toller Service, sehr zu empfehlen.",5,24.7.2009
160,DUDU,3.9,39,Sushi / Vietnamesisch / Asiatisch / ,Mitte,2,Unknown,"kann den Laden nur empfehlen, vielleicht ein wenig teuer , aber mega lecker und schickes Design .. Mehr gibts nicht zu sagen ;-)",4,10.3.2011
161,DUDU,3.9,39,Sushi / Vietnamesisch / Asiatisch / ,Mitte,2,Unknown,"Ich liebe es hier. Perfekt fürs Mittagessen. Manchmal könnte die Bedienung etwas freundlicher sein, aber meistens sind sie das, es gibt nur eine Ausnahme. Die Preise sind auch sehr stolz, aber beim Mittagsmenü ist die Preis Leistung sehr gut.",4,21.6.2011
162,DUDU,3.9,39,Sushi / Vietnamesisch / Asiatisch / ,Mitte,2,Unknown,"Ich weiß nicht genau, was mich antrieb während der Fashion Week und Bread & Butter zu einem angesagten Restaurant in Mitte zu fahren, aber irgendwie hatte ich das Verlangen, endlich mal das DuDu in der Torstraße auszuprobieren. So schwang ich mich an diesem wunderschönen milden Donnerstagabend um kurz nach 21h auf mein Fahrrad und fuhr an hunderten von hippen Modegrazien, die vor den Modeläden Prosecco tranken, vorbei in Richtung DuDu. Nicht anders zu erwarten, war das Restaurant pickepacke voll. Wenn ich an diesem Abend nicht alleine gewesen wäre, hätte ich mich auch nicht hinein getraut. Das Schöne am Alleinessen ist aber, dass man meist einen Platz am Tresen bekommt. So saß ich dann vis a vis den Sushiköchen an einer schmalen Theke. Links und rechts von mir griff das Bedienpersonal nach den kunstvoll gefertigten Sushirollen und Sashimiplatten, die die zwei Köche im Akkord fertigstellten. Der Raum war ein lautes Klangmeer von Houseklängen aus den Lautsprechen und Gesprächsfetzen auf Deutsch und Englisch. Die Karte erwartete mich mit verschiedenen japanisch und vietnamesischen Fushionspeisen. Ich entschied mich für den Papyasalat mit Hühnchen als Vorspeise und der Fishbowl als Hauptgericht. Der Service war professionell nett, aber aufgrund der vielen Gäste auch leicht angespannt. Das bestellte Veltins dauerte recht lang, dafür kam der Salat sehr schnell. Über die Vorspeise muss man ansonsten nicht mehr Worte verschwenden, als das sie solide war. Für meinen Geschmack sollte derein grüner Papayasalad schärfer und frischer sein. Das Hühnchen, welches ein bisschen zu trocken war, ging auch total unter. Gut war aber die frische Koriandernote. Kurz nachdem ich den übersichtlich portionierten Salad für 4,50EUR hinter mich gelassen hab, kam auch schon die Fishbowl, eine Mischung aus Sashimi (roter und weißer Tunfisch sowie Lachs) mit zweierlei Shrimp (Tempura und roh) über Wildkräutersalat, Salsa Roja, Guacamole und Reis. Als erstes probierte ich die Guacamole. Ich bin ein großer Avocadofan, aber leider war diese auch nichts besonderes. Ich weiß, dass es immer ein gewisses Glückspiel ist. in unseren Breitengraden eine wirklich schmackhafte Avocado zu bekommen. Zu dieser Zeit setzte sich in mir das Gefühl durch, dass das DuDu ein professionell durchgestyltes Lokal ist, welches visuell, was Speisen und Interieur angeht, etwas hermacht, aber das leider die gewisse Leidenschaft für wirklich gutes Essen vermissen lässtBis ich dann die Salsa Roja probierte. Von diesem Moment an veränderte sich die Dynamik meines Essens. Diese war nämlich wirklich einfach unheimlich lecker. Die Tomaten frisch und voller Geschmack. Dann probierte ich den Fisch, welcher auch phänomenal war. Und auch der Reis hatte eine wunderbare leichte Kokosnussnote, die sich wahnsinnig gut mit dem Fisch, der Salsa Roja und dem Salat zu einem Geschmackserlebnis verband. Zu diesem Zeitpunkt entwickelte sich in mir ein seltenes Gefühl des nicht Einsehenwollens, dass diese Schüssel ein endliches Erlebnis sein wird. Nach einigen Bissen überlegte ich mir schon eine zweite Schüssel zu bestellen, was natürlich völliger Quatsch war. Ich bestellte mir aber noch ein Glas Weißwein. Leider hatte die Karte nur zwei offene Weißweine: einen deutschen Grauburgunder und einen österreichischen Veltliner, für welchen ich mich entschied. Nach einem zweiten Nachhaken bei der Kellnerin bekam ich diesen dann auch endlich. Leider konnte er nicht das Niveau des Essens halten. Als Vorschlag an das Restaurant würde ich hier anbringen, eine größere Auswahl an offenen Weißweinen anzubieten oder mindestens einen trockenen Riesling auf die Karte zu setzen, der sich aus meiner Sicht gut mit dem Essen ergänzen würde. Aber zurück zum Essen. Besonders angetan hat mich der weiße Tunfisch, welcher mich aber eher an einen Butterfisch erinnerte. Ich aß die Schüssel so langsam wie möglich auf, vermischte lustvoll den Fisch, die Salsa, die Guacamole, den Salat und den Reis und las vergnügt in meinem Spiegel zwischen den tösenden Gästen und den herumflitzenden Personal. Leider kam es dann auch irgendwann zum befürchteten Ende und nach kurzem Überlegen und des Insichgehens entschied ich, dass ich satt war und bezahlte die Rechnung, die insgesamt 24EUR (für Vor-/Hauptspeise, einem Glas Wein und einem Bier) völlig angebracht war. Gerade die Fishbowl für EUR11,90 ist jeden Cent wert. Auch wenn sich viele Hauptspeisen gleichen und meist mit Salsa Roja und Guacamole gereicht werden, weiß ich ganz bestimmt, dass ich wiederkommen werde und auf jeden Fall die Fishbowl wieder essen muss. Wenn dann auch noch die Avocado passt, bin ich im Food Heaven. Natürlich kann man sich über das typische gestylte Mitte-Flair auslassen oder darauf aufmerksam machen, dass einige der Mitarbeiter sogar spezielle ""DuDu"" gebrandete Turnschuhe trugen, aber Fakt ist, dass mich die Hauptspeise total überzeugt haben. Fünf Sterne gibt es aber nicht, da die Vorspeise wie erwähntn""nur"" solide war.",4,7.7.2011
163,DUDU,3.9,39,Sushi / Vietnamesisch / Asiatisch / ,Mitte,2,Unknown,"Wer es laut und voll mag ist hier genau richtig. Man sitzt dicht zusammengedrängt auf langen Holzbänken. Die Musik ist zwar toll aber sehr! laut und macht eine Unterhaltung nahezu unmöglich. Enttäuschend für uns war, dass unser 4 Wochen vorher! reservierter Tisch nur für 2,5 Stunden reserviert war. Nach Aussage der (kurz angebundenen) Bedienung ist das immer so. Wir 6 Mädels mussten also um 22:00 Uhr aufstehen um uns eine neue Location zu suchen, da bereits die nächsten Gäste warteten. Es wäre schön gewesen, wenn man uns das schon bei der Reservierung gesagt hätte. Das Essen würde 3 Sterne bekommen. Die Currys eher enttäuschend. Erinnerten ziemlich an ein Risotto. Die Gerichte von der Tageskarte waren deutlich besser. Aber auch deutlich höher im Preis. Schade wir können die vielen guten Bewertungen leider nicht teilen.",1,1.3.2012
164,DUDU,3.9,39,Sushi / Vietnamesisch / Asiatisch / ,Mitte,2,Unknown,"sushi schmeckt super, wenn auch recht wenig auswahlauch der tempura salat war ziemlich lecker, kann man nur empfehlen!was uns nicht so gefallen hat war das man ziemlich lange nicht von der bedienung beachtet wurde, sehr freundlich aber ein wenig unaufmerksam.die preise sind mir etwas zu hoch für das leistungsverhältnis aber das ist nun mal typisch mittesehr gemütlich ist es dort auch nicht aber es kommt ja eher auf das essen an und das war sehr gut, mal was anderes!",3,3.4.2012
165,DUDU,3.9,39,Sushi / Vietnamesisch / Asiatisch / ,Mitte,2,Unknown,"Alles in Allem ganz nett. Essen ist ok, aber auch nix Besonderes, dafür aber auch nicht überteuert. Service war nett. Von den Leuten her: viele Touris, aber auch mal ein Ex-GZSZ C-Promi",4,15.7.2012
166,DUDU,3.9,39,Sushi / Vietnamesisch / Asiatisch / ,Mitte,2,Unknown,"Bestes vietnamesisches Essen in ganz Berlin! Wildkräuter Curry, Papayasalat und Sommerrollen probieren! Wen laute Musik stört sollte nicht am Freitag oder Samstag Abend kommen.",5,27.8.2012
167,DUDU,3.9,39,Sushi / Vietnamesisch / Asiatisch / ,Mitte,2,Unknown,"Das DuDu ist natürlich ein Szeneladen. Selbst mit Reservierung muss man warten und sich quetschen, die Kellner sind nicht immer aufmerksam und die Geräuschkulisse ist teilweise etwas anstrengend. Aber das Essen ist wirklich großartig, besonders der Thunfisch. Mittags gibt es übrigens ein Menü zum Sonderpreis und dann ist es auch nicht so voll und man kann sich unterhalten ohne sich anzuschreien.",4,7.3.2013
168,DUDU,3.9,39,Sushi / Vietnamesisch / Asiatisch / ,Mitte,2,Unknown,"Ist schon super trendy, aber vom Essen war ich wirklich überzeugt. Zumindest mittags. Hatte ein kleines Menü und das Sushi war wirklich gut und lecker.",5,7.1.2013
169,DUDU,3.9,39,Sushi / Vietnamesisch / Asiatisch / ,Mitte,2,Unknown,"Frische Zutaten, offenes Ambiente und ein ambitionierter Inhaber, der auch selbst gerne kocht. Das sind schon einmal gute Voraussetzungen für einen gelungenen Abend. Die Weinkarte ist überschaubar und bietet solide Klassiker, die gut zum Essen passen, was bei der asiatischen Küche bekanntlich schwierig ist. Mein Favoriet beim Mittagslunch ist übrigens das Wildkräuter-Curry",5,27.10.2009
170,DUDU,3.9,39,Sushi / Vietnamesisch / Asiatisch / ,Mitte,2,Unknown,Die Dudu Crispy Rolls sind der Hammer und mein absoluter Favorit;)!!,5,24.11.2009
171,DUDU,3.9,39,Sushi / Vietnamesisch / Asiatisch / ,Mitte,2,Unknown,"Eines meiner Lieblingsrestaurants in Berlin zur Zeit, zumal dort viele Gerichte auch als vegetarische Alternative bestellbar sind. Das Team ist nett und cool zugleich. In Berlin selten, wo man meistens nur cool ist ;).",5,26.4.2010
172,DUDU,3.9,39,Sushi / Vietnamesisch / Asiatisch / ,Mitte,2,Unknown,"1. Service: Personal jederzeit supernett. So, wie man es von einem guten Restaurant erwartet. 2. Bestellung: läuft glatt. Man wird schnell bedient, das Essen ist im Nullkommanix fertig und bezahlen kann man auch sofort. 3. Qualität des Essens: Sehr gut. Fish Bowl  unschlagbar. Steak  ein Traum. Dazu ein Calpico oder ein Wein ;) und der Abend ist perfekt. 4. Ambiente: Etwas laut, geschäftig, aber superclean, alles in weiß gehalten und die Musik der angesagtesten DJs/Produzenten der Stadt tönt aus den Lautsprechern. Bin mittlerweile Stammgast hier und führe alle meine Nicht-Berliner Freunde hierhin aus. Falls man Glück hat, sitzt George Clooney am Nachbartisch, munkelt man",5,11.11.2010
173,DUDU,3.9,39,Sushi / Vietnamesisch / Asiatisch / ,Mitte,2,Unknown,Sehr gutes Essen zu fairen Preisen. Unbedingt vorher reservieren!,5,30.1.2012
174,DUDU,3.9,39,Sushi / Vietnamesisch / Asiatisch / ,Mitte,2,Unknown,"Sehr lautes Restaurant. Die Speisen sind aber sehr sehr lecker, dafür aber auch ein wenig preisintensiver als die Konkurrenz in PrenzlB und Fhain. Das DuDu ist ein typisches IN-LOKAL in Mitte. Wer also auf SCHICKIMICKI steht und sich auf Sitzbänken gerne drängt, der ist hier absolut richtig.",3,5.3.2012
175,DUDU,3.9,39,Sushi / Vietnamesisch / Asiatisch / ,Mitte,2,Unknown,"Gutes Essen in angenehmer Atmosphäre. Und obwohl es für Berliner Verhältnisse eher chic ist, ist es nicht teuer. Man wird auch von den 8EUR Gerichten locker satt. Das Publikum ist offen und gut durchmischt. Viele Touristen, aber auch Berliner. Einziger Nachteil ist die Akustik, denn, wenn es richtig voll ist, ist es so laut, dass man sein Gegenüber bei normalem Gesprächston nicht mehr versteht und schon etwas mehr Energie aufbringen muss, um sich zu unterhalten. Nichtsdestotrotz ein netter Laden, ich komme gerne wieder.",4,12.3.2012
176,DUDU,3.9,39,Sushi / Vietnamesisch / Asiatisch / ,Mitte,2,Unknown,"Bestes Sushi der Stadt! Superfreundliche Kellner, urbane Atmosphäre und einfach die großartigste Seafood Bowl, die ich bisher gegessen hab. Preis absolut wert! (Wer darüber meckert, sollte darüber nachdenken, was er bereit ist, für guten Fisch auszugeben :) und vielleicht doch ganz das Fischessen seinlassen)",5,28.3.2012
177,DUDU,3.9,39,Sushi / Vietnamesisch / Asiatisch / ,Mitte,2,Unknown,"Das DUDU ist immer gut, um dort einen Snack zu nehmen! Preis /Leistung ist total ok ! Freitag und Samstag ist es schon sehr voll, also lieber die anderen Tage nutzen!",5,24.9.2012
