,Restaurant Name,Overall Rating,Total Reviews,Specialty,Region,Price Range,Author,Comment,Rating,Date
337,Cocolo Ramen,4.2,42,Ramen / ,Mitte,2,Jenni N.,"Das Restaurant ist sehr authentisch Japanischen gestattet ( schön klein, engen, laute, locke...)aber die Atmosphäre in den Laden einfach sehr gemütlich . Mein Tonkotsu hat gut geschmeckt und sah Super aus , aber die Brühe liebe noch etwa länge köcheln lasen damit der milchigen Saft aus dem Schweineknoken , Fleisch noch besser heraus kommen .Bedienung sehr nett , schnell , sehr freundlich ... Mir sehr gut gefällt . Ramen - die Nudeln, vor allem die daraus hergestellte Nudelnsuppe , werden Ramen genannt . Ursprünglich Stammt das Gericht aus China , wurde aber 19 . Jahrhundert von  der Japanischen Küche übernommen & angepasst ...Ramen ist mein Liebling Gericht neben Sushi .. Tonkotsu ist ja nicht anfach zu selbe kochen , es verbraucht etwa12-24 Stunde zum kochen bringen ( damit dem weiss Farben heraus kommen ) ;-) also ich komme wieder :-)",5,30.4.2014
338,Cocolo Ramen,4.2,42,Ramen / ,Mitte,2,Kratos84 ..,Hat geschmacklich leider nach gelassen zwar immer noch gut aber Verhältnis preis Leistung ist nicht mehr gerecht.,4,17.1.2016
339,Cocolo Ramen,4.2,42,Ramen / ,Mitte,2,Cvetelina Y.,"Die Atmosphäre ist richtig toll und das Essen ist unglaublich lecker! Man hat sogar die Chance zuzuschauen wie sein Essen vorbereitet wird, echt cool! Immer wieder gerne!!!",5,24.9.2016
340,Cocolo Ramen,4.2,42,Ramen / ,Mitte,2,Zündi C.,Sehr nettes Personal und echt lecker!!! Beim Mittagstisch bekommt man einen guten Ersteindruck und kommt sicher ein weiteres Mal....! :-),5,18.6.2016
341,Cocolo Ramen,4.2,42,Ramen / ,Mitte,2,Anna D.,"Das beste traditionelle Ramen in Berlin in authentischer Japanischer Atmosphere! Hab much direkt nach Japan versetzt gefühlt. Die Auswahl ist zwar nicht riesig aber groß genug und die Edamame vorweg sind immer himmlisch! Hier arbeiten nur super nette Japaner/innen die immer, egal wie voll es ist gut gelaunt und höflich sind. Der einzige Nachteil ist, dass man manchmal anstehen muss aber das nehme ich gerne in Kauf, hab schon viele nette Leute in der Schlange getroffen.",5,26.7.2018
342,Cocolo Ramen,4.2,42,Ramen / ,Mitte,2,2 Fotos,"Die Nudeln Suppen sind super und die Preise sind gut! Sehr autentischer Laden, Service ist sehr gut und die Laden riecht super!Es ist zu klein, aber man wartet nicht mehr als halbe stunde",5,11.12.2011
343,Cocolo Ramen,4.2,42,Ramen / ,Mitte,2,Florian P.,"Na holla die Waldfee, hätt ich doch fast einen meiner Lieblingsläden vergessen mal drüber zu schreiben. Gibt eigentlich nicht viel drüber zu schreiben ausser Genial,Lecker, Authentisch, Durchdacht = ) Hab alle Suppen schon durch, mein Liebling Tonkotsu (Schweinebraten und süßen Schweinebauch) der Schweinebauch ist ne Wucht, auch zum einfach so bestellen als Tapa. Tantan ist mit Hackfleisch, schwankte aber im Geschmack von sehr gut zu sehr scharf. Wan tan, auch sehr gut, alles hausgemacht und gut abgeschmeckt. Schätze sehr bei diesem Laden das die Suppen nicht so Überwürzt sind sondern natürlich abgeschmeckt, und Ohne MSG (Glutamat) hergestellt werden. Bald anwesend sollte man  sein am besten bei der Öffnung, sonst Wartezeit, mach ich aber auch gerne (auch bis zu 45 min.) da schon kaltes Bier auch nach draussen serviert wird = ) Unbedingt mitnehmen, bedungungslose Empfehlung !!!",5,4.1.2015
344,Cocolo Ramen,4.2,42,Ramen / ,Mitte,2,KatHa K.,"Ein Fest!Ich hatte absolut keinen Hunger und hab nur gegessen!Vorspeise, Ramen, Nachtisch und alles war wirklich lecker. Der Laden ist wirklich schön gemacht und hat ein schönes Ambiente. Die Bedingung war sehr freundlich und zu lange warten mussten wir auch nicht.",5,20.11.2015
345,Cocolo Ramen,4.2,42,Ramen / ,Mitte,2,Jan W.,"Ramen und Raum begeistern so sehr, dass man bereit ist 9 Takken + 3 für eine homey - Limo zu zahlen. Gutes Konzept, guter Laden mit unaufgesetzt lächelndem Service.",5,22.1.2014
346,Cocolo Ramen,4.2,42,Ramen / ,Mitte,2,Johnny Knoxville K.,Leider mussten wir draußen anstehen umso mehr war die Erwartung laden toll Service super schnell . Unterm Strich ganz nett extra Schweine Bauch nicht das Geld wert 3 Stücken etwas für den Metzger Gesellen die Basis der Suppe super aber die hausgemachten Nudeln waren etwas einsam .selbstgemachte Limonade lecker na gut ich war da sicher nicht noch einmal,3,17.10.2015
347,Cocolo Ramen,4.2,42,Ramen / ,Mitte,2,Silke H.,", totemo oishiidesune, It tastes very great, sehr lecker, sehr authentisch so wie ich es in Japan erlebt habe!!! Die Preise sind zwar hoch aber das ist es mir hin und wieder Wert!!! Das einzige was ich schade finde ist das dieses tolle auch sehr authentisch eingerichtete lokal erst um 18h öffnet.. Alles in allem sehr empfehlenswert",5,25.9.2012
348,Cocolo Ramen,4.2,42,Ramen / ,Mitte,2,Frank M.,"Waren heute Aufgrund der vielen guten Bewertungen da. Für meine Begriffe ist der Laden überbewertet. Es schmeckt ok (haben einige Vorspeisen und Ramen probiert), jedoch ist und bleibt es eine einfache japanische Suppenküche mit Schnellrestaurant-Charakter im Bistrostiel und dafür ist es preislich nicht günstig! Die Musik ist sehr laut und es wird an Menschen durchgeschleust, was das Zeug hält. Wir habens probiert, zu unserem Stammrestaurant wird es wohl nicht werden, da das Speiseangebot nicht überzeugte und keine Gemütlichkeit aufkam.",3,29.3.2015
349,Cocolo Ramen,4.2,42,Ramen / ,Mitte,2,T S.,Ein Muss für jeden Ramen Fan - für mich eine der besten Ramen Bars ausserhalb Japans. Die Niederlassung in Mitte ist Nippon-typisch sehr klein aber deshalb auch sehr gemütlich. Die Qualität des Essens ist absolute Spitze.,5,28.6.2015
350,Cocolo Ramen,4.2,42,Ramen / ,Mitte,2,Anja A.,"Mein damaliger Chef hat mich das erste Mal in diesen zauberhaften kleinen Laden geschleppt. Wirklich authentisches japanisches Essen. Das Cocolo Ramen liegt direkt neben dem Kuchi, einem weiteren hervorragenden, aber teurem japanischen Restaurant. Da das Cocolo eigentlich als mobile japanische Küche angefangen hat, wird es auch gerne mal als Suppenküche des Kuchi bezeichnet.Wer im Cocolo ist, merkt das auf einen Blick an der Auswahl auf der Karte. Hier gibt es kein Sashimi oder Sushi. Es gibt eben die traditionellen japanischen Nudelsuppen, Ramen, auf der Karte stehen ungefähr sechs Sorten. Ansonsten hängen die auch als Bilder nochmal an der Wand. Die Nudeln sind hausgemacht und es gibt die Gerichte mit oder ohne Fleisch.Wer will kann auch noch eine der Vorspeisen essen, aber eine Suppe ist ziemlich groß und macht gut satt. Die Wan Tan Ramen ist ziemlich lecker. Gegessen wird an hohen Holztischen und auf den Tischen findne sich diverse Soßen zum verfeinern der Suppen. Die Suppen sind ziemlich fleischig im Geschmack, das mag wahrscheinlich nicht jeder und die Nudeln sind auch nicht unbedingt jedermanns Sache.Entweder man liebt es oder man kommt nie wieder. Ich mag`s und viele Japaner anscheinend auch.",4,13.6.2010
351,Cocolo Ramen,4.2,42,Ramen / ,Mitte,2,Jens B.,"Toller kleiner authentischer Laden mit leckeren Ramen wie man sie auch tatsächlich in japan bekommt. Der Preis geht mehr als in Ordnung und auch das Ambiente weiß zu gefallen. Viel Platz gibt es leider nicht, weshalb man am Abend schon mal länger warten muss um einen Platz zu bekommen. Gerade im Winter eine tolle Adresse für ein schmackhaftes und gemütliches Abendessen.",4,21.8.2015
352,Cocolo Ramen,4.2,42,Ramen / ,Mitte,2,Audrey J.,"Für Ramenliebhaber aufgepasst.  Bei Cocolo gibt es leckere Nudelsuppe. Auswahl mag nicht groß sein, aber Geschmack schon ganz prima, dass es völlig zu unserer Zufriedenheit bereitgestellt ist. Das Essen wird auch sehr japanisch eingerichtet, was die Vorliebe an japanische Tradition weiter entwickeln könnte. Der Raum ist ausgerechnet klein. Aber im hinteren Hof befinden sich weitere Sitzplätze (geteilt mit Kuchi nebenan) und da sind die beste Plätze.  Abends kann es aber recht ärgerlich voll.",4,21.5.2010
353,Cocolo Ramen,4.2,42,Ramen / ,Mitte,2,Hagen H.,"Für jemanden wie mich, zu dessen Lieblingsfilmen der japanische Spielfilm ""Tampopo"" gehört, ist der Besuch einer Ramen-Küche Pflicht. Aufgrund vielseitiger Empfehlungen habe ich die Tage das Cocolo von Oli Prestele aufgesucht. Der erste Eindruck vom Restaurant mit ausschließlich japanischem Personal an dem Abend: Sehr klein, wenig Sitzplätze, japanisches Interieur, angnehmes, dezentes Licht - nett und einladend. Von der sehr übersichtlichen Speisekarte suchten wir uns auf Empfehlung des Kochs zwei Ramen (jap. Nudelsuppe) aus. Eine mit einem Hackfleischragout, leicht scharf (ich glaube, es war die Tantan) sowie eine mit süßem Schweinebauch und Miso (Tonkotsu).Wir bekamen zwei irdene Schalen mit Stäbchen und primitiv anmutenden Suppenlöffeln aus Kokosschalen in Form kleiner Suppenkellen, mit denen man die Brühe aber sehr gut löffeln kann. Der Geruch der Brühe war sehr gut, die Zutaten nett in der Ramen arrangiert. Enttäuschend fiel die Geamtmenge aus. Das Volumen der Schalen war vielleicht zu einem guten Drittel ausgefüllt. Satt wurden wir davon nicht. Dies ist bei einem Preis von 8,50 EUR bzw. 9,50 EUR (ich bin mir nicht ganz sicher) auch nach Meinung des mit mir speisenden Berliner Gastronomen inakzeptabel! Also Herr Prestele, entweder ihr geht mit dem Preis runter oder - besser - ihr macht die Schalen so voll, wie man es bei chinesischen und vietnamesischen Nudelsuppen - und das zu einem deutlich günstigeren Preis - gewohnt ist! Außer uns waren nur Japaner als Gäste im Restaurant anwesend. Dies spricht in jedem Fall für die Authentizität der Küche (vielleicht auch für die Mengendosierung, abgestimmt auf einen eher verhaltenden Appetit des durchschnitlichen Japaners?) Auf jeden Fall waren beide Ramen gut.Die mit dem Hackfleischragout war bezüglich der Würze gegenüber unserer Erwartungshaltung zu zurückhaltend. Sie kam uns eher ein wenig fad herüber, lebte aber von der guten Qulität der Brühe (ein wenig mehr von dem köstlichen Ragout würde diese Suppe deutlich heben). Die mit dem süßen Schweinebauch wusste uns da eher zu überzeugen. Rund, hamonisch, lecker. Auf jeden Fall der leckerste Schweinebauch, den ich je gegessen habe. Da wir offen gestanden nach dem Essen immer noch hungrig waren, haben wir uns noch jeweils eine Portion vom dem Schweinebauch und dem Ragout extra bestellt und geteilt. Der Schweinebauch war so lecker wie in der Ramen. Aber das Ragout- mmmmmhhh! Dieses schmeckte durch die Vermischung mit der Brühe in der Ramen eher zurückhaltend aber pur war es der reine Genuss. Ich würde am liebsten einfach eine große Portion der Nudeln mit diesem Ragout essen. Dafür würde ich jede Spaghetti Bolognaise stehen lassen. Schade, dass es das nicht auf der Karte gibt (wäre wohl auch nicht authentisch, oder?) Wäre trotzdem ein Knaller! Wir beide haben anschließend noch ca. eine halbe Stunde den Geschmack des Ragouts auf der Zunge gehabt und waren begeistert. Allein dieses zu testen, lohnt neben dem Ambiente einen Kurzbesuch des Cocolo. Satt waren wir allerdings auch nach dem Zusatzgang nicht, aber der beissende Hunger war jedenfalls weg. Ich werde es auf jeden Fall mit dieser Suppenküche wieder ausprobieren. Hagen",3,27.7.2010
354,Cocolo Ramen,4.2,42,Ramen / ,Mitte,2,Unknown,"Japanisch! Nun gut auf zum Cocolo. Durch Zufall hatten wir es in der Gipsstraße entdeckt. Zuerst waren wir etwas unsicher, was wir bestellen sollten. Aber dann nahmen wir eine Variation mit Schweinefleisch. Uppps - die war eiskalt. Vielleicht ist das so in Japan üblich, aber wir waren doch etwas enttäuscht. Die Miso-Suppe war ebenfalls nur noch lauwarm. Die Gerichte waren sauteuer und als wir fertig waren, zog uns die Kellnerin die Teller vom Tisch. Andere Gäste warteten schon am Eingang. Insgesamt war es eine interessante Erfahrung. Aber dabei wird es auch bleiben.",1,5.6.2009
355,Cocolo Ramen,4.2,42,Ramen / ,Mitte,2,Unknown,"Auf Empfehlung von einem Freund ging ich in den äußerst gut besuchten, winzigen Suppenladen. Zunächst war ich etwas skeptisch und dachte mir wie blöd es doch eigentlich ist sich 30-60 min vor einem Restaurant anzustellen um eine Suppe essen zu gehen..Naja mir wurde dann aber klar warum der Laden so gut besucht ist: Die Suppen sind nicht einfach nur Suppen, sondern geschmackliche Meisterwerke!Absolut einzigartig im Geschmack, sehr sehr frische Zutaten (z.B. das Fleisch/der Teig bei meiner Wan-Tan Suppe) und dazu noch asiatisches Flair.Es kamen auch auffalend viele asiatische Gäste, was schonmal für den Laden spricht.Dennoch muss man sich darauf gefasst machen etwas tiefer ins Portemonaie zu greifen: Eine Suppe kostet hier durchschnittlich 9-12 Euro.Wenn man aber auf qualitativ hochwertige Köstlichkeiten steht, ist man hier genau richtig.",5,15.5.2013
356,Cocolo Ramen,4.2,42,Ramen / ,Mitte,2,1 Foto,"Sushi gut, aber nicht überragend. Ziemlich teuer. Leckerer Papaya-Salat. Moderne Einrichtung.",3,21.5.2010
357,Cocolo Ramen,4.2,42,Ramen / ,Mitte,2,J O.,Jap. Nudel Specialist in Berlin in guter Lage und Atmosphäre.Sehr nette und schnelle Bedienung.Viele Varianten Nudel-Suppe mit Reis-Gerichte Kombinationen wie in Japan. Ich habe Miso-Nudelsuppe und Gebraten Reis bestellt und war alles lecker.,5,25.2.2012
358,Cocolo Ramen,4.2,42,Ramen / ,Mitte,2,2 Fotos,"War heut Abend zum ersten Mal dort und bin nur begeistert. Ich kam um 11:30 rein und hatte damit Glück  mein Tonkotsu Ramen wurde noch ruckzuck gemacht und dann wurde es in der Küche aufgeräumt. Während ich aß wurden mehrmals Gäste weggeschickt. Aber ich hatte dafür wenig Aufmerksamkeit. Ich war vertieft in der leckeren Brühe, bissfeste Nudeln, ganz tollen Schweinefleish. Die Einrichtung, die Küche, die Atmosphäre, wenn man an der Theke sitzt, einfach super! Nur muss man Glück haben, um einen Platz zu kriegen, da der Laden nur Abends auf hat, sehr klein ist und offensichtlich sehr beliebt ist. Aber ich werde es sicherlich wieder versuchen. UPDATE: War gerade zum ersten mal in Japan unterwegs und habe viele unterschiedliche Ramenläden probiert. Nun habe ich einen klaren Vergleichsbasis und ich finde Cocolo immer noch richtig top! Der Laden würde in Kyoto bestimmt mithalten können!",5,2.3.2012
359,Cocolo Ramen,4.2,42,Ramen / ,Mitte,2,Neils G.,"super leckere ramen, hatten als vorspeise den edamame, der sehr zu empfehlen ist. Einfach nur Bohnen, die aber gut daher kommen. Ich bewundere wie organisiert und freundlich das Personal war. wirklich toll!",5,1.8.2016
360,Cocolo Ramen,4.2,42,Ramen / ,Mitte,2,Unknown,"war mal ein klasse Laden,hat leider in sämtlichen Bereichen abgebaut. Das fängt mit den Plastiklöffeln (früher aus Holz) zur Suppe an und hört bei den mittlerweile gesalzenen Preisen nicht auf. Da",1,26.8.2013
361,Cocolo Ramen,4.2,42,Ramen / ,Mitte,2,Unknown,"Ich hab ein paar Jahre in Japan gelebt und da viel Ramen gegessen (ist billig dort und schmeckt). So bin ich froh, dass mit dem Kokoro nun endlich auch in Berlin ein Laden aufgemacht hat, der ein recht ordentliches Ramen macht. Hier gehen auch viele Japaner hin. Die wenigen anderen kleinen Gerichte auf der übersichtlichen Karte sind auch gut. Ich selber nehme meist Tan-Tan Ramen (scharf) oder Wan-Tan Ramen, je nach Stimmung. Die sind beide prima. Da das Kokoro recht klein und eng ist, kann man hier allerdings nicht mit grösseren Gruppen kommen. Ausser vielleicht im Sommer, wenn sie den Garten hinten offen haben. Die Toilette teilt man sich mit dem Nachbarladen Kuchi. Der Service ist nicht super, aber auch nicht schlecht. Normal halt, würde ich sagen. Zu beachten ist, dass das Kokoro nur abends (ab 18 Uhr) offen hat. Im Kokoro war ich sicher insgesamt 20 Mal.",4,15.2.2010
362,Cocolo Ramen,4.2,42,Ramen / ,Mitte,2,Michael S.,"Seit ich vor Jahren den Film ""Tampopo"" gesehen habe, der sich in unvergleichlicher weise mit der Zubereitung der besten Nudelsuppe befasst, war ich auf der Suche nach einer Möglichkeit, hier in Deutschland die absolute Ramen Erfahrung zu machen. Ich hab schon einige Restaurants ausprobiert aber keines kommt ans Cocolo heran. Gut, es ist klein, sehr klein, aber die Karte und die die Atmosphäre stimmen einfach. Wenn man im Winter kommt und das Glück hat abends noch einen Platz zu bekommen, beginnt die Erfahrung schon vor dem Eintreten. Die durch die Enge des Raums und die offene Küche bedingte hohe Luftfeuchtigkeit sorgt für total beschlagene Scheiben und Nebel bei öffnen der Tür. Dass man den Köchen bei der Zubereitung der Suppen zusehen kann und das selbstgetöpferte Geschirr zusammen mit dem genialen Geschmack der Suppen machen den Abend dann perfekt. Ich werde wohl noch öfter kommen.",5,24.2.2011
363,Cocolo Ramen,4.2,42,Ramen / ,Mitte,2,Casual T.,"Vorab: Keine Frage, hier Ramen zu Essen ist ein Genuss. Sehr lecker, sehr authentisch. Jetzt das Aber: die Preise sind gesalzen (8-10EUR je Ramen) und der kleine Laden stark überlaufen (Wartezeit einkalkulieren). Hier entspannt zu Essen ist nur schwer möglich.",3,21.10.2013
364,Cocolo Ramen,4.2,42,Ramen / ,Mitte,2,Unknown,"Nachdem ich in Paris das erste Mal Ramen gegessen hatte (dort findet man in den hippen Gegenden einen Ramen-Laden am anderen), machte ich mich auf die Suche nach etwas Vergleichbarem in Berlin. In so einer großen Stadt muss es doch viele Ramen-Läden geben. Schon das kalte Wetter sollte den Absatz von heißer, sättigender Nudelsuppe fördern. Das einzige Angebot, das ich finden konnte, war das Cocolo. Also nichts wie hin. Der Gatte war etwas skeptisch bei der Aussicht, für eine Schüssel Suppe fast 10 Euro zu bezahlen. Ich schwärmte ihm vor, wie unvergleichlich toll Ramen schmeckt. Eine herzhafte Brühe, echte japanische Reisnudeln, dekorative, frische Einlagen obendrauf und hoffte dabei, dass mich das Berliner Ramen nicht im Stich lassen würde. Tatsächlich war alle Sorge unbegründet und mein Mann schon nach dem ersten Löffel überzeugt. Das Geld lohnt sich und wir kommen wieder!",5,30.3.2009
365,Cocolo Ramen,4.2,42,Ramen / ,Mitte,2,Domingo M.,"Ja, man steht (gerade an den kalten Tagen) auch mal 30 Minuten (davon 15 Min. draußen) an. Aber was soll ich sagen, es lohnt sich einfach! :-) Tonkotsu essen und auf Wolke sieben schweben.",4,4.1.2017
366,Cocolo Ramen,4.2,42,Ramen / ,Mitte,2,Martina L.,"Auf Empfehlung einer Bekannten, die ein paar Jahre in Japan verbracht hat und hierher geht, wenn sie Japan-Weh hat, was ja schon mal für die Authentizität spricht, habe ich es nun auch mal getestet. Nach halbstündigem Warten vor der Tür (unter der Woche!)  weil es drinnen so klein ist, dass nur ca. 6-8 Leute stehend warten können, konnten wir rein und weitere 20 Minuten später einen Platz an der ""Theke"" einnehmen. Die Karte ist klein und unerwartet teuer (9 Euro aufwärts für ein Nudelsüppchen mit etwas Fleisch drin?), aber gut.Umgehauen hat mich das Essen leider nicht. Die Nudeln waren zu sehr al dente, die Suppe seehr salzig, vielleicht muss das alles so sein, dann ist es aber nicht mein Fall. Schade.",3,17.11.2013
367,Cocolo Ramen,4.2,42,Ramen / ,Mitte,2,Unknown,"Der Laden sieht wirklich nett aus. Man könnte denken man sei in Japan. Klein, etwas schmutzig, lange Schlange, alle reden Japanisch. Das was aber auch schon. Der Laden würde nicht ein Tag in Japan überleben. Die Suppe war extrem mit Glutamat gepanscht. Ich hatte danach Kopfschmerzen. Ich habe nichts gegen Glutamat, denn es ist eine natürliche Substanz, aber man kann mit künstlichen Glutamat übertreiben. Glutamat ist kein Ersatz für guten Geschmack und das hat wirklich für eine Suppe (Tonkotsu), die 10,50 Euro kostet, gefehlt. Die Suppe war dünn, was ein schlechtes Zeichen für Tonkotsu Ramen ist, denn sie muss cremig mit leicht milchlicher Konsistenz sein.Schade, netter Laden, aber die müssen wirklich am Geschmack arbeiten.",1,15.12.2012
368,Cocolo Ramen,4.2,42,Ramen / ,Mitte,2,Elchang3000 C.,"Am Wochenende unbedingt reservieren! Tolle Innendeko und fantastische Ramen! Bisschen hochpreisig und man sitzt dicht an dicht. Aber das ganze Gewese um die Nudeln, ist ok. Gutes Essen! Aber auch nicht nur vom Hype blenden lassen: gute Ramen gibt es auch noch woanders in Berlin.",3,21.12.2015
369,Cocolo Ramen,4.2,42,Ramen / ,Mitte,2,Robert N.,"Sehr guter Ramen in mehreren Variationen. Meine Favoriten bislang sind die Ramen mit geräuchertem Huhn und mit Garnelen-Teigtaschen. Platz nimmt man entweder direkt gegenüber der Küche wo man die Zubereitung hautnah verfolgen kann - oder im Gastraum an kleineren oder größeren Tischen. Im Sommer auch gerne draußen auf der ruhigen Terasse - die an heißen Tagen auch gerne mal mit Wasser besprenkelt wird, sodass quasi eine kleine Oase entsteht. Neben Ramen gibt es auch Vorspeisen (z.B. Edamame, Kimchi), der Ramen allein ist jedoch auch schon sättigend. Mittags sehr gut besucht, zum Ramen gibt's dann auch ein Freigetränk. Sehenswert sind auch die abgepausten Gullideckel-Bilder an der Wand im Innenraum.",4,21.11.2015
370,Cocolo Ramen,4.2,42,Ramen / ,Mitte,2,Mike G.,"nicht billig, aber wirklich gute Ramen Suppen. Laden ist immer voll",5,12.7.2016
371,Cocolo Ramen,4.2,42,Ramen / ,Mitte,2,Unknown,"Cocolo!Was soll man sagen?Ich war schon 2mal in Tokyo und ich bin seit dem Ramen Fan!Und Cocolo ist einfach da für mich, wenn ich Fernweh habe.Es ist wirklich genau so wie ich es in Japan kennengelernt habe.Der ganze Stolz des Betreibers sind die aufwendig - zum Teil 24 Stunden lang - zubereiteten Buppenfonds, die selbstgemachten Nudeln und die hervorragende Gesamtabstimmung.Ich glaube, daß es Mittwochs ganz besonders gut ist, doch es ist immer:Sehr gut.",5,13.11.2010
372,Cocolo Ramen,4.2,42,Ramen / ,Mitte,2,Roll M.,"Hier bekommt man das beste Tonkotsu Ramen der Stadt in gemütlicher Atmosphäre. Direkt nebenan befindet sich das Kuchi, falls man mal mehr Lust auf Sushi hat (oder als Vor-/Nachspeise :-)",4,28.1.2011
373,Cocolo Ramen,4.2,42,Ramen / ,Mitte,2,Unknown,"5 Sterne weil keine Alternative.Vorab, Miso Ramen schmeckt sehr Authentisch.Ich habe fast 3 jahre in Tokyo gelebt und es mir zur Aufgabe gemacht den besten Ramen Shop zu finden(unmöglich!)Ich habe im Cocoro alle Ramen ausprobiert bis auf die Wantans(in tokyo macht man keine Garnelen rein, und abgesehen davon müsste man für qualitative garnelen horrende Summen zahlen, deswegen no go für mich)Kakuni schmeckt sehr Japanisch, YES ! Hab fast geweint, war lange nicht mehr so glücklich wie als ich Gyoza mit Miso Chashyu Kakuni Ramen gegessen habe.Es gibt sogar Leitungswasser umsonst(so japanese)!Kakuni und Schweine Chashyu schmecken wie in Japan.Preise bewegen sich für Ramen zwischen 7,50 und 10 Euro je nach extras etc.Dazu kommen gyoza mit ich glaube 3,50.(must have)Die Gyoza sind sehr gut, leider wird einem nur eine schon gemischte Soße gereicht.Gyoza ist man überlicherweise mit 3 verschiedenen Soßen.Soja, Essig, und Chilli Öl.Diese mischt mans ich dann selber zusammen, hier wird eine Soja Essig Mischung gereicht(die allerdings sehr gut schmeckt)Das Personal ist Japanisch, (was für mich sehr Wichtig ist, jeder der in Japan gelebt hat versteht was ich meine, es ist einfach eine andere Kulturelle Einstellung zum Essen)Ich war bis jetzt 6 oder 7 mal im Cocoro, Und ich hatte 2 KotsuRamen bestellt. Bei einem war die Supper sehr schwach und falsch zubereitet.selbst ein Ei hat gefehlt. Sowas ist eigentlich unverzeihlich aber da es nur das eine Mal war möchte ich das nicht in meine Bewertung einfließen lassen.Es gibt noch das Makoto mit extrem gutem Miso Katsudon, aber die Ramen dort (außer das Curry Ramen) kommen nicht ans Cocoro ran.Sake habe ich leider noch nicht im Cocoro probiert da ich immer nach der Arbeit beim Cocoro vorbei schaute und Motorisiert unterwegs war. Ich werde jedoch noch ein Uptdate posten wenn ich das getan habe.Ich bin ein großer Fan von Japanischem Bier, ich habe sogar in Japan erst mit Bier Trinken angefangen und würde niemals den Geschmack von einem Kirin oder Asahi vergessen. Das problem mit den in Deutschland erhältlichem japanischem Bier ist allerdings dass dieses in Chechz oder England Produziert wird. Sprich es schmeckt scheiße. Und nicht nach Japan. Wie gesagt, ich habe alkoholische getränke noch nicht probieren können. Aber wenn diese Brewed in Chechz oder England drauf haben, verzichten sie bitte gleich darauf, es wird kein japanisches Bier sein.Alles in allem:Authentischer geht es in Berlin momentan nicht.",5,16.10.2011
374,Cocolo Ramen,4.2,42,Ramen / ,Mitte,2,Sunny S.,Klein aber fein. Sehr empfehlenswert!!,5,25.12.2012
375,Cocolo Ramen,4.2,42,Ramen / ,Mitte,2,Unknown,"Super Ramen Suppen zu fairen Preisen. Ausserdem eine kleine Auswahl an Vorspeisen, die durch die Bank weg ausgezeichnet sing. Vorallem die Gyozas sind die besten die ich bisher in Berlin gegessen habe. Freundlich Bedienung in netter Atmosphäre. Im Hintergrund läuft häufig japanische Popmusik. Alles in allem ein authentischer Laden mit tollen japanischen Gerichten.",5,9.11.2009
376,Cocolo Ramen,4.2,42,Ramen / ,Mitte,2,Kristian L.,"Der Laden ist sehr schön eingerichtet, ich fühle mich hier sehr wohl. Mir schmecken die Ramen auch hervorragend. Vielleicht nicht die besten Ramen der Welt, zumindest in Berlin aber konkurrenzlos.Die Preise sind nicht wirklich günstig  aber man zahlt eben auch etwas für die Lage mit. Jedenfalls ist der Laden immer sehr gut besucht.",4,25.2.2013
377,Cocolo Ramen,4.2,42,Ramen / ,Mitte,2,Tess S.,"Sehr authentischer Ramen-Laden, sehr leckere Suppen (habe jede probiert, mein Favorit: Wan Tan mit Garnelen-WanTans und Huhn), tolles Preis-Leistungsverhältnis. Cooles Ambiente, da man direkt vor dem Koch sitzt, es dampft und duftet und einfach mal hin!!!",5,18.9.2011
