,Restaurant Name,Overall Rating,Total Reviews,Specialty,Region,Price Range,Author,Comment,Rating,Date
0,FACTORY GIRL,4.1,41,Frühstück & Brunch / Café / Desserts / ,Mitte,2,Saman T.,"Moin,ich schreibe meine Bewertung in Kategorien damit ich das Lokal möglichst gut beschreiben kann.Location:Ein wenig typisch Berlin, stellt euch vor ihr kommt in Omas Backstube. um die Holztische stehen Holzstühle und vereinzelt gepolsterte Stühle aus der fernen Vergangenheit.Der Laden ist hemdärmlich und trotzdem gemütlich eingerichtet. Es passt einfach sehr gut zu einem gemütlichen brunchlokal.Essen:Das Lokal bietet hauptsächlich Frühstückstaugliches an und Kuchen.Alles was sie anbieten ist sehr frisch und lecker.Vorallem jedoch Preis/Leistung sehr gut!Zb gibt es für knapp 10 Euro eine Platte mit so vielen Verschiedenen Aufschnitt ( Käse und Fleisch) und Konfitüren inkl Brot.  Das krieg ich meistens gerade noch so aufgegessen ( und glaubt mir ich bin ein guter Esser).Dazu Eine Portion Rührei mit zB Sucuk für ca 3 Euro zum teilen, 2 Kaffeegetränke und man hat zu zwei für ca 20 Euro genug geile Sachen gefrühstückt für den ganzen Tag!Service:Ich hab den Eindruck der Laden wird von einer Familie geführt. Auf jeden Fall sehr freundlicher Service der auch mal für einen Spass zu haben ist und einem bisher immer mindestens schon mit dem freundlichen Lächeln Lust auf den nächsten Besuch gemacht hat.Sehr zu empfehlen. Mittlerweile einer meiner Stamm Brunch Lokale",5,28.12.2017
1,FACTORY GIRL,4.1,41,Frühstück & Brunch / Café / Desserts / ,Mitte,2,Marie F.,"Ich bin über Instagram auf dieses Frühstücksrestaurant aufmerksam geworden. Als wir dort ankamen, war jeder Tisch besetzt. Wir haben ungefähr 20 Minuten auf einen freien Tisch gewartet, was in Berlin nicht ungewöhnlich ist. Man muss Geduld haben ;-) Die Auswahl ist überschaubar, aber absolut ausreichend. Die Anrichtung des Frühstücks finde ich kreativ und besonders. Es war sehr lecker und abwechslungsreich. Das Dessert ist angeblich Bewusstseins verändernd, was ich nicht wirklich nach empfinden kann. Das ist Geschmacksache. Für ein Frühstück in Mitte ein schöner Ort.",4,26.9.2018
2,FACTORY GIRL,4.1,41,Frühstück & Brunch / Café / Desserts / ,Mitte,2,Nicole H.,"Heute das erste mal bei +Factory Girl gewesen! Schöne Lokalität, sehr gemütlich, freundliche und aufmerksame Bedienung. Essen und Getränke auch lecker (zumindest das war ich probiert habe) Preis - Leistung fand ich auch okay. Obwohl der Laden recht voll war, ging alles zügig und ich musste nicht übermäßig lange warten. Komme gerne wieder, nur die Parkplatzsuche gestaltet sich im näheren Umkreis eher schwierig. Evtl das nächste mal mit den Offis hin.",4,16.11.2018
3,FACTORY GIRL,4.1,41,Frühstück & Brunch / Café / Desserts / ,Mitte,2,Natalie B.,"Hipsterladen mit englischsprachigem Personal ohne Deutschkenntnisse. Beim Einchecken gab es ein Dessert gratis. Sollte zumindest. Die Bedienung verstand mich nicht, fragte dann hinten nach, nachdem ich darauf bestand.Verweis darauf, dass das kein aktuelles Angebot sei. Es gab nicht mal eine kleine Entschädigung oder sonstiges. Unprofessionell. Das vegane Dessert war wirklich super lecker, aber die Portion ist für 4€ eine absolute Unverschämtheit. Erster und letzter Besuch.",2,1.3.2018
4,FACTORY GIRL,4.1,41,Frühstück & Brunch / Café / Desserts / ,Mitte,2,Anja S.,"Nettes kleines Frühstückslokal, toll zum draußen sitzen, Super lecker, frisch, und farbenfroh zusammengestellt, wirklich nettes Personal, trotz des sonntäglichen Frühstücksstress, kommen allen wünschen entgegen. Wir kommen gern wieder!",5,1.9.2019
5,FACTORY GIRL,4.1,41,Frühstück & Brunch / Café / Desserts / ,Mitte,2,Kim K.,"Das Factory Girl in der Auguststraße ist ein nettes kleines Café mit gutem Frühstück. Die Frühstückskarte bietet von Rührei mit Bacon über Pancakes oder Wurst- und/oder Käsefrühstück (ca. 10 EUR) alles was das Herz begehrt. Dazu gibt es hausgemachte Limonaden und Kaffeespezialitäten und als kleine Aufmerksamkeit sogar noch eine Nachspeise (""Magnolia"") auf Kosten des Hauses für einen Yelp Check-In! Leider ist das Factory Girl vor allem am Wochenende immer hoffnungslos überlaufen (Reservierung unbedingt erforderlich und auch über Yelp möglich!) und der nur gebrochen Deutsch sprechende Service teilweise hoffnungslos überfordert. In Kombination mit der daraus resultierenden immensen Lautstärke, die am Tag unseres Besuchs noch von diversem Kinderkreischen unterstützt wurde, und der Tatsache, dass man die einzige Toilette nur durch ein Vorbeiquetschen an mehreren Tischen und nach teils langer Wartezeit erreichen kann, ist das Café eher nichts für ein gemütliches entspanntes Sonntags-Frühstück. Nichtsdestotrotz ist geschmacklich nichts an den Speisen und Getränken auszusetzen und ich komme gerne zu gegebener Zeit - evt. an einem anderen Wochentag wieder.",4,16.10.2016
6,FACTORY GIRL,4.1,41,Frühstück & Brunch / Café / Desserts / ,Mitte,2,Germanicure M.,"Halleluja, es gibt sie noch ... Cafés, die etwas von Rührei verstehen!!Die Factory Girls zaubern aus drei Eiern total geniales Rührei oder auch Omelett und servieren es mit frischem warmem Brot, das mit ein klein wenig Butter himmlisch schmeckt. Auch die heiße Schokolade geizt nicht mit kraftvollem Geschmack. Einzig das berühmte, hochgelobte Dessert namens Magnolia ließ mich eher kalt ... zerkrümelte Butterkekse in sehr sahniger Creme mit weißer Schokolade und garniert mit ein paar säuerlichen Himbeeren ... es gab zwar noch zwei andere Magnolia-Varianten, aber für mich schreit nichts nach einer weiteren Kalorien-Attacke auf die Figur.Die Factory Girls selbst sind einfach wunderbar und gestalten den Aufenthalt sehr angenehm. Von Service-Schwierigkeiten habe ich rein gar nichts bemerkt. Ich hatte aber auch einen eher ruhigen Freitagnachmittag erwischt, der von einzelnen Äpfelchen-Abhängigen dominiert wurde. Mit einer einsamen Tasse und ihrem schicken Notebook auf dem Tisch, an dem die Augen förmlich klebten, entstand eine merkwürdige Büro-Atmosphäre. Schade, denn die Factory Girls beweisen richtig guten Musikgeschmack! Ich könnte dort Stunden zubringen und Rührei essen ;O)!",4,1.2.2016
7,FACTORY GIRL,4.1,41,Frühstück & Brunch / Café / Desserts / ,Mitte,2,Aileen G.,"Eine Erfrischung im sonst so durchgestylten Berlin Mitte. Die Möbel und Deko wirken auf den ersten Blick wahllos durcheinander gewürfelt, ergeben bei näherem Hinsehen jedoch ein Gesamtkonzept. Gemütlich ist es allemal, auch wenn die Tische sehr eng stehen und es im Winter durch die große Glasfront schnell kalt wird. Speisekarten liegen auf den Tischen, bestellt wird am Tresen. Außer Sandwiches, Frühstück und Kuchen gibt es keine Mahlzeit, die mittags sättigt. Das Café eignet sich daher eher für einen Snack zwischendurch, einen Kaffee mit Kuchen oder als Frühstücksoase. Ausgehungert entschied ich mich für das einzige größere Gericht: einen Salat. Mit liebe zubereitet und absolut außergewöhnlich: Himbeeren, Datteln, Oliven und Feta sind nur einige der Zutaten. Man fühlt sich sofort herzlich willkommen und wird den gesamten Aufenthalt über angelächelt.",4,22.1.2016
8,FACTORY GIRL,4.1,41,Frühstück & Brunch / Café / Desserts / ,Mitte,2,Bobby B.,"Das Essen war in Ordnung. Es hat mich jetzt nicht umgehauen aber es war ganz gut.Preis - Leistung fand ich nicht sonderlich ansprechend. Für den Preis hätte ich mir etwas qualitativere Produkte gewünscht. Auch meinen Saft von 5 € war i. O. Dieser kam halt in nen blanken mittleren Glas mit Strohhalm ohne alles.Unsere Kellnerin war super, auch wenn sie uns zuerst auf Englisch ansprach. Der Kaffee und das Ei war ganz gut. Am Ende waren es 38 € für 2 Personen zum Frühstück. Für das Geld habe ich in Berlin schon besser gefrühstückt.",3,20.1.2018
9,FACTORY GIRL,4.1,41,Frühstück & Brunch / Café / Desserts / ,Mitte,2,Matthias M.,"Bei uns ging beim Brunch am Sonntag alles drunter und drüber, der Service war überfordert, die Wartezeit mit beinahe 50 min extrem lang. Das Essen war gut aber auch nicht günstig, hier stimmen Preis-Leistung nicht.Allerdings: Man war sich dessen bewusst, wir haben wohl schlicht einen schlechten Tag erwischt, das kann auch den besten passieren. Ich werde wieder kommen und der Sache eine zweite Chance geben, da die Mahlzeit an und für sich lecker war es aber in dem dichten Brunch Markt in Berlin bessere Optionen gibt.(beim nächsten mal auch mit ausführlichem Feedback)",3,16.7.2018
10,FACTORY GIRL,4.1,41,Frühstück & Brunch / Café / Desserts / ,Mitte,2,Karin S.,"Typische Berliner Touristen-Falle: hipster-mäßig eingerichtet, irgendwas mit Avocado auf Brot, englischsprachiger Service und völlig überteuert. War irgendwas besonders schlecht? Nein. Essen und Service waren ok. Aber halt auch nicht so überragend, dass es den Preis rechtfertigen würde. Werden nicht wiederkommen.",3,7.9.2019
11,FACTORY GIRL,4.1,41,Frühstück & Brunch / Café / Desserts / ,Mitte,2,Henning H.,"Der Name klingt amerikanisch ? Ja, die meisten Gäste scheinen hier Englisch zu sprechen. Das Frühstück war lecker, der Cappuccino auch (allerdings mit wenig Leidenschaft zubereitet) und die sch oft genannte Wartezeit erträglich.Bei sonnigem Wetter kann man auch draußen sitzen. Da die Straße 10er Zone ist, ist das gut möglich.",4,26.4.2015
12,FACTORY GIRL,4.1,41,Frühstück & Brunch / Café / Desserts / ,Mitte,2,Corinna S.,"Morgens mit Magenknurren aufgestanden und Lust auf Frühstück? Bei Factory Girl gibt es eine nette Frühstückskarte, die u.a. interessante Ei-Varianten in hippem Ambiente bietet. Dazu Kaffee oder eine Schokolade (alle Getränke gibt es entweder heiß oder auf Eis) und schon ist man bereit gut gestärkt in den Tag zu starten.Wir hatten Kaffe mit vegetarischem Rührei und geeiste Schokolade mit Ei im Omelett-Style mit Schinken, Tomaten und Rucola. Dazu gab es jeweils eine kleine Portion warmes Brot mit Butter. Das Ambiente ist wie so oft hier in Berlin sehr bemüht hipsterhaft, eine bunte Zusammenstellung von ""Sperrmüll"" (Tische, Stühle, Bänke) und teilrenovierten Wandflächen bieten genug Platz für viele Menschen. Für Kinder gibt es in einer Ecke auch Bücher und Spielsachen, für Internetabhängige gibts freies W-Lan.Lange mussten wir nicht auf unser Frühstück warten, die Mitarbeiterin war sehr nett und die Auswahl ausreichend. Uns hat es geschmeckt und wir können es weiterempfehlen.",4,1.8.2015
13,FACTORY GIRL,4.1,41,Frühstück & Brunch / Café / Desserts / ,Mitte,2,Hilal K.,"Tolle Lokation, leckeres Frühstück. Die Art der Servierung lässt mich wie in Istanbul fühlen. Sehr vertraut.Die Kellner sind sehr nett und aufmerksam - auch wenn alle Plätze voll sind und viel Druck da ist.Ich muss sagen, der Sofia's Salad kann tatsächlich süchtig machen.Ich habe sehr viele Salate in unterschiedlichen Lokationen ausprobiert, doch keiner konnte mithalten.Salatliebhaber müssen also diesen himmlischen, ballaststoffreichen, gesunden Salat unbedingt kosten.",5,20.7.2017
14,FACTORY GIRL,4.1,41,Frühstück & Brunch / Café / Desserts / ,Mitte,2,Claudia A.,"Wir waren an einem Sonntag gegen 11:30 hier und es war sehr gut besucht, aber wir konnten uns (zu zweit) noch an einen Tisch mit ransetzen. Sehr netter und aufmerksamer Service, ausgesprochen leckeres und liebevoll dargebotenes Essen (super Preis-Leistungsangebot) und ein gemütliches Ambiente machen das Factory Girl zu einer klaren Empfehlung!!Da die Nachspeise ""Magnolia"" aus war, servierte man uns als Wiedergutmachung ein ebenfalls sehr leckeres Stück vom Cheesecake. Gerne wieder, wenn wir in Berlin sind!!",5,19.3.2017
15,FACTORY GIRL,4.1,41,Frühstück & Brunch / Café / Desserts / ,Mitte,2,Steffi M.,"Genial lecker, alles frisch, tolle Auswahl, supernettes Team! Absolut empfehlenswert! Nicht nur zum Frühstücken, auch zu anderen Tageszeiten :)",5,2.8.2019
16,FACTORY GIRL,4.1,41,Frühstück & Brunch / Café / Desserts / ,Mitte,2,Christian A.,"Ein Kellner im Factory Girl hat versehentlich ein großes Glas heißer Milch über mich und meine Begleitung verschüttet. Hose, Schuhe, Shirt, alles war voll mit Milch. Der Kellner hat sich vielmals entschuldigt. Dass einem so etwas im normalen Leben passiert, ist äußerst selten, aber solche Dinge können nunmal einfach passieren, dafür habe ich Verständnis. Wofür ich kein Verständnis hatte, war dann allerdings die Entscheidung des Managements, dass uns keine Reinigung angeboten wurde und dass wir sogar den vollen Preis zahlen mussten. Alles in allem sehr enttäuschend. :/",1,11.8.2016
17,FACTORY GIRL,4.1,41,Frühstück & Brunch / Café / Desserts / ,Mitte,2,Eliane F.,"Schon lange stand das Factory Girl im schicken Teil von Mitte auf unserer Liste und an einem warmen Sonntag im September haben wir ihm mal einen Besuch abgestattet. Der Laden ist super gelegen, nett eingerichtet und man kann gut draußen sitzen. Es gibt Frühstücksplatten, Sandwiches, Rührei und Omelette sowie Müsli und Kuchen. Das FG Tasting Board für 9€ (veg) / 9,50€ (mit Wurst) ist reichlich, schön angerichtet und sehr lecker. Satt wird man auf jeden Fall! Auf unserem Board war anstatt wie in der Karte angegeben Bresaola zwar Pasturma, aber das war nicht weiter schlimm. Mozzarella, Brie, Blauschimmelkäse, Schnittkäse, Feta, Pasten und Sucuk waren sehr lecker.Die Kaffeegetränke waren so wie sie sein sollen und die Preise vernünftig (2,80€ Cappuccino/ Latte Macchiato, 3€ Milchkaffee).Lohnenswert sind hier auf jeden Fall die selbstgemachten Joghurt-Müsli-Mischungen mit frischen Früchten (Magnolia), zum Beispiel Himbeer-Crumble, Erdbeer-Cookie, oder Schwarzwälder-Beeren-Crumble Mischung. Der Service spricht teilweise nur gebrochen deutsch und ist etwas langsam, aber das hat nicht weiter gestört.Sehr zu empfehlen und gerne wieder!",4,4.9.2016
18,FACTORY GIRL,4.1,41,Frühstück & Brunch / Café / Desserts / ,Mitte,2,Cynthia T.,"Heute, am Sonntagmorgen haben wir uns entschlossen im Factory Girl frühstücken zu gehen.Sehr kleines, aber feines Lokal im Herzen von Berlin.Wir hatten über Yelp reserviert, was aber komplett ignoriert wurde. Als Wunsch hatten wir ""bitte nicht an der Tür"" angegeben. Ein paar Minuten vor 11 Uhr wurden wir nicht einmal höflich begrüßt und es musste von draußen ein Tisch geholt werden, der mitten in den Gang gestellt wurde. Dadurch saßen wir direkt vor der Tür im Lauf- und Wartebereich. Wozu wird eine Reservierung angeboten, wenn man diese nicht beachtet. Der erste Eindruck war demnach nicht gut.Die Servicekraft am Thresen war freundlich, die anderen haben weder Hallo gesagt, noch einen angeguckt. Sie wirkten wir unorganisierte aufgescheuchte Hühner. Fanden wir sehr unfreundlich. Nun zum Frühstück. Kleine Karte, aber reicht völlig aus. Gutes Preis-Leistungsverhältnis und sehr lecker. Das Essen würde ich sofort nochmal nehmen. Hübsch angerichtet und einfach gut.Fazit: Tolles Frühstück,  aber ein sehr kleines Restaurant (kaum Tische) mit schlechtem Service  (Ausnahme die Dame an der Theke). Vielleicht geben wir dem Lokal irgendwann nochmal eine zweite Chance.",3,24.4.2016
19,FACTORY GIRL,4.1,41,Frühstück & Brunch / Café / Desserts / ,Mitte,2,Tobi W.,"Gutes Frühstück in Berlin zu finden ist aufgrund von Überangebot und vielen Menschen, die denken, sie könnten ein Café führen, nicht einfach.Hier jedoch habe ich eine Perle entdeckt! Angefangen vom Ambiente des Cafés: sauber, authentisch zusammengestellte Deko und Porzellan, freundliches Personal über die Qualität des Frühstücks- man merkt einfach, dass sich hier jemand wirklich (erfolgreich)Gedanken gemacht hat! Hier kann man sich wohlfühlen! Die Delicatesse Rühreier für 5€ waren Spitze im Preis/Leistungsverhältnis für 5€, angerichtet in kleiner Pfanne mit Holztablett und Lederbändchen. Für sowas habe ich auch schon 8€ oder mehr bezahlt. Dazu gibt's für einen Checkln per App noch das Dessert ""Magnolia"" kostenlos. Freies Wifi ist ebenfalls vorhanden und auch bei der Frage nach Sojamilch gibts nur freundliches Nicken. :)Ich wünsche mir mehr von solchen Cafés in Berlin und werde sicher viele meiner Couchsurfer hierher bringen!",5,4.4.2016
20,FACTORY GIRL,4.1,41,Frühstück & Brunch / Café / Desserts / ,Mitte,2,Claudia H.,"WOW! Klein, aber fein. Wir waren hier zum Geburtstag einer Freundin.Super Platten, leckeres Rührei, auch die Sandwiches waren grandios.Hot Chocolate zum selbst anrühren! Yummy!Aufs Haus bekamen wir dann sogar noch einen kleinen Teller vom Magnolia Dessert.Danke! Wir kommen wieder.",5,4.2.2016
21,FACTORY GIRL,4.1,41,Frühstück & Brunch / Café / Desserts / ,Mitte,2,Soso J.,"ein kleiner gemütlicher laden, schön und gemütlich eingerichtetdie frisch gepressten säfte sind super lecker und günstig, essen war auch super allerdings auch etwas teuerUnd total freundliche bedienungAber gerne nochmal!",4,25.2.2016
22,FACTORY GIRL,4.1,41,Frühstück & Brunch / Café / Desserts / ,Mitte,2,Michael H.,"Das Factory Girl ist echt ein toller Laden zum Frühstücken in Berlin. Durch Bekannte hier her bekommen. Sehr individuell-verrückte Einrichtung mit kunterbunten Möbeln und Dekoration. Essen ganz besonders liebevoll und frisch mit Blick für Detail zubereitet. Wir hatten am Freitag Morgen verschiedene Frühstücksangeboten bestellt: Ei, Käseplatte, Käse-Wurstplatte, Obstsalat, O-saft, Kaffee, Tee. Bedienung war sehr freundlich und flink. Man konnte an der Theke zuschauen, wie einiges zu Essen hergestellt wurde. Preis-Leistungsverhältnis stimmt total. Im Vergleich zu vielen Frühstücksangeboten in Berlin sicherlich etwas besonderes. Super lecker auch der Magnolia-Nachtisch, den wir zum Abschlus zum probieren bekamen. Auf jeden Fall ausprobieren!",5,10.5.2016
23,FACTORY GIRL,4.1,41,Frühstück & Brunch / Café / Desserts / ,Mitte,2,Sabine P.,"Teuer, hip. Das Café erinnert wirklich etwas an die bekannten New Yorker Cafés à la Magnolia Bakery gepaart mit dem traditionellen deutschen Frühstückscafé. Leider mangelt es hier an der Umsetzung. Vor allem das Personalkonzept ist mir nicht aufgegangen. Die sehr jungen Kellnerinnen, uns haben insgesamt vier verschiedene bedient und eine weitere hat- im lauten Disput mit noch einer anderen jungen Dame, ob der aktuell auf Yelp angebotene Gutschein nun wirklich eingelöst werden dürfe oder nicht- dann abkassiert. Die angebotenen Frühstücksoptionen sind am Ende doch auf die überall angebotene Auswahl herunter zu brechen, wird aber sehr modern angerichtet. Die Magnolia- inspirierten Nachtische sind eine echte Gaumenfreude und transportieren einen kurz nach New York. Auch für Vegetarier und Veganer eine ausreichende Auswahl. Für den, der sehr viel Wert auf eine ""coole"" Athmosphäre legt, sicher das richtige Café.",3,11.3.2018
24,FACTORY GIRL,4.1,41,Frühstück & Brunch / Café / Desserts / ,Mitte,2,Anna M.,"Super leckeres türkisch angehauchtes frühstück. Das angenehme ist, dass es sogar ein einem Sonntag nicht allzu voll war und somit alles schnell und frisch rauskam. Empfehle die Pide mit Sucuk.",4,3.8.2017
25,FACTORY GIRL,4.1,41,Frühstück & Brunch / Café / Desserts / ,Mitte,2,Holger H.,"Freundliches Personal, Essen schmeckt wie es aussieht.. Sehr lecker und die Käse Zusammenstellung ist ein Gedicht in Verbindung mit dem extrem leckeren Brot. Ganz klar 5 Sterne von mir und sollte ich nochmals in Berlin brunchen steht Factory Girl ganz oben, auch da Haustiere willkommen sind.",5,24.9.2018
26,FACTORY GIRL,4.1,41,Frühstück & Brunch / Café / Desserts / ,Mitte,2,Gina T.,Ein nettes kleines Cafe in einer tollen Gegend. Der Kaffee war leider nur mittelmäßig und die Preise auch. Ambiente ist stylisch. Das Personal war freundlich :),3,20.4.2017
27,FACTORY GIRL,4.1,41,Frühstück & Brunch / Café / Desserts / ,Mitte,2,Jannis B.,"Habs nicht zum Essen geschafft, nach 30min auf Kellner warten gegangen, essen sah lecker aus",1,15.1.2017
28,FACTORY GIRL,4.1,41,Frühstück & Brunch / Café / Desserts / ,Mitte,2,Nina F.,"Liebes überfordertes und unqualifiziertes Factory Girl-Team,Vergangenen Sonntag haben wir uns spontan entschlossen bei Factory girl zu brunchen, weil wir im Mai dieses Jahres schon mal da waren und es definitiv qualitativ und quantitativ ein besserer Service war. Mit der Aufnahme der Bestellung auf die wir schon 25 min. Warten mussten fängt  das schon mal an. Die Servicekraft konnte kaum deutsch. Das Essen wurde kalt serviert (Rührei) und die Getränke kamen erst später (ein no go).Dies war im Mai nicht so, da wurden wir von einer jungen Servicekraft sehr herzlich empfangen und es wurde immer wieder abgehorcht, ob bei uns alles in Ordnung sei oder ob es wünsche gibt. Das haben wir diesmal vermisst. Wir haben auf eine zweite Runde Getränkebestellung verzichtet, weil wir nicht den ganzen Sonntag dort verbringen wollten. Noch einmal werden wir nicht mehr kommen, weil uns unsere Zeit viel zu kostbar ist und das Geld für so einen schlechten Service nicht wert ist. Hinzu kommt, dass wir mitbekommen haben, wie die Kellnerin alte Minze aus dem Glas vom Vorgänger genommen und in das neue Glas für den anderen Gast gelegt hat. Wie kann man bitte so etwas tun? Es ist uns echt fraglich, wie ein Laden mit solch chaotischen und unqualifizierten Arbeitskräften bestehen bleibt!?",2,27.10.2016
29,FACTORY GIRL,4.1,41,Frühstück & Brunch / Café / Desserts / ,Mitte,2,Casual T.,"Lustige, typisch Berliner Location für Kaffee, Kuchen und Frühstück. Die Auswahl ist übersichtlich aber lecker. Es geht sehr international zu, Franzosen, Schweden, Briten, hier trifft man ganz Europa. Einziger Kritikpunkt ist die Bedienung, die unsere Bestellung erst halb vergessen, dann auf Nachfrage nur halb nach geliefert und zu guter letzt endlich im dritten Anlauf vollständig an den Tisch gebracht hat. Den Latte Machiatto für 3,40 EUR fand ich auch ganz schön happig.",3,31.1.2015
30,FACTORY GIRL,4.1,41,Frühstück & Brunch / Café / Desserts / ,Mitte,2,Dasterix X.,"Durch Zufall reingestolpert.Zunächst wollten wir nur Kaffee (sehr zu empfehlen). Dann haben wir uns aber doch von Nachbartischen inspirieren lassen.Frühstück war großartig.Liebevoll präsentiert. Alles hatte eine sehr gute Qualität. Die Menge absolut ausreichend. Gerne wieder!Service war zunächst etwas unbeholfen, nach hinten raus aber alles wieder gut gemacht.",5,9.1.2015
31,FACTORY GIRL,4.1,41,Frühstück & Brunch / Café / Desserts / ,Mitte,2,Oliver T.,"Wenn ihr hier seid, MÜSST ihr wenigstens einen Probierlöffel voll Magnolia kosten! BOMBE! Das hat nichts mit Blumen zu tun, sondern es handelt sich um eine leckere amerikanische Süßspeise, die es im Factory Girl in mehreren und veganen Variationen gibt.Daneben bekommt man sehr leckere und reichhaltige Frühstücke und Snacks und vor allem wunderbaren Service von einem Team, das mit Leidenschaft arbeitet! Ich kannte den Laden bereits aus der Simon-Dach-Straße und musste ihn nun erst einmal in Mitte ""wiederentdecken"", da ich den Umzug gar nicht mitbekommen hatte.Ganz soooo schräg-stylish wie der alte Laden ist dieser hier nicht eingerichtet. Das tut aber dem Genuss und dem sympathischen Team gar keinen Abbruch: schaut definitiv mal vorbei, hier hat der Mitte-Chic mal kurz Pause und man fühlt sich einfach wohl!",4,8.10.2014
32,FACTORY GIRL,4.1,41,Frühstück & Brunch / Café / Desserts / ,Mitte,2,Any B.,"Super cooler laden, die homemade lemonade ist soooooo lecker das Frühstück natürlich auch. Eins war n bisschen doof wir wussten nich ob Selbstbedienung ist oder ob jemand zum Tisch kommt, wir haben zwar die Getränke am Tisch bestellt, aber für den Rest mussten wir dann immer an den Tresen, was ja auch okay ist wenn man es gleich wüsste ;)",4,2.10.2014
33,FACTORY GIRL,4.1,41,Frühstück & Brunch / Café / Desserts / ,Mitte,2,Thomas P.,"Tolles Café !! Gute Preise, nette Leute aber leider am We sehr voll.Ich muss auch sagen das die Toiletten nicht so das wahre sind, da besteht Verbesserungsbedarf.",5,4.3.2012
34,FACTORY GIRL,4.1,41,Frühstück & Brunch / Café / Desserts / ,Mitte,2,1 Foto,"Ich war schon eine der ersten Kunden damals wenn diese süße kleine Café in Krossenerstr. 16 war. Seitdem ist die Bedienung richtig freundlich, fast die ganze Karte insbesondere die legendäre Magnolia Puddings schmecken himmlisch und der Kaffee (Segafredo) ist erinnerungswert!Alles was man von einem Café sich erwünscht, ist hier zu finden: gemütliche Atmosphäre, entspannende Musik, guter Kaffee, leckere Köstlichkeiten.",5,20.5.2012
35,FACTORY GIRL,4.1,41,Frühstück & Brunch / Café / Desserts / ,Mitte,2,Kathy S.,"Wunderschönes (Frühstücks)Cafe mitten in Friedrichshain. Wir sind hier zum Frühstück gelandet und waren durchaus begeistert. Wir teilten uns zu zweit das große Frühstück (um die 7 EUR) und ein Rührei und die Menge war wirklich mehr als ausreichend. Dazu gabs einen leckeren Cappuccino und trommelwirbel zwei der außergewöhnlich leckeren Desserts (die es übrigens auch zum Mitnehmen gibt). Praktisch ist, dass man die Cremes auch probieren kann bevor man sich eine aussucht (ich persönlich fand den Beerenmix einfach klasse!)Die Einrichtung war (wie man es in Berlin so gewohnt ist) ziemlich hipp. Genau wie die Bedienungen und das restliche Publikum. Definitiv ein Besuch wert!",5,15.5.2012
